10:29:56.060366 IP 192.168.108.128.123 > 132.163.4.102.123: NTPv4, Client, length 48
10:29:56.108593 IP 132.163.4.102.123 > 192.168.108.128.123: NTPv4, Server, length 48
10:29:57.060480 IP 192.168.108.128.123 > 216.152.240.220.123: NTPv4, Client, length 48
10:29:57.126276 IP 216.152.240.220.123 > 192.168.108.128.123: NTPv4, Server, length 48
10:29:58.060487 IP 192.168.108.128.123 > 199.102.46.80.123: NTPv4, Client, length 48
10:29:58.094863 IP 199.102.46.80.123 > 192.168.108.128.123: NTPv4, Server, length 48
10:29:58.806411 IP 192.168.108.128.48701 > 192.168.108.2.53: 29812+ A? p1.pichost.me. (31)
10:29:58.806749 IP 192.168.108.128.9628 > 192.168.108.2.53: 46985+ AAAA? p1.pichost.me. (31)
10:29:58.811491 IP 192.168.108.2.53 > 192.168.108.128.48701: 29812 1/0/0 A 62.210.138.100 (47)
10:29:58.811503 IP 192.168.108.2.53 > 192.168.108.128.9628: 46985 0/1/0 (82)
10:29:58.811700 IP 192.168.108.128.59490 > 62.210.138.100.80: Flags [S], seq 2117143951, win 29200, options [mss 1460,sackOK,TS val 186529 ecr 0,nop,wscale 7], length 0
10:29:58.898335 IP 62.210.138.100.80 > 192.168.108.128.59490: Flags [S.], seq 816589083, ack 2117143952, win 64240, options [mss 1460], length 0
10:29:58.898362 IP 192.168.108.128.59490 > 62.210.138.100.80: Flags [.], ack 1, win 29200, length 0
10:29:58.898546 IP 192.168.108.128.59490 > 62.210.138.100.80: Flags [P.], seq 1:379, ack 1, win 29200, length 378: HTTP: GET /i/76/2008429.jpg HTTP/1.1
10:29:58.898649 IP 62.210.138.100.80 > 192.168.108.128.59490: Flags [.], ack 379, win 64240, length 0
10:29:58.989803 IP 62.210.138.100.80 > 192.168.108.128.59490: Flags [.], seq 1:1461, ack 379, win 64240, length 1460: HTTP: HTTP/1.1 200 OK
10:29:58.989821 IP 192.168.108.128.59490 > 62.210.138.100.80: Flags [.], ack 1461, win 32120, length 0
10:29:58.989847 IP 62.210.138.100.80 > 192.168.108.128.59490: Flags [.], seq 1461:2921, ack 379, win 64240, length 1460: HTTP
10:29:58.989853 IP 192.168.108.128.59490 > 62.210.138.100.80: Flags [.], ack 2921, win 35040, length 0
10:29:58.989867 IP 62.210.138.100.80 > 192.168.108.128.59490: Flags [.], seq 2921:4381, ack 379, win 64240, length 1460: HTTP
10:29:58.989872 IP 192.168.108.128.59490 > 62.210.138.100.80: Flags [.], ack 4381, win 37960, length 0
10:29:58.989884 IP 62.210.138.100.80 > 192.168.108.128.59490: Flags [.], seq 4381:5841, ack 379, win 64240, length 1460: HTTP
10:29:58.989887 IP 192.168.108.128.59490 > 62.210.138.100.80: Flags [.], ack 5841, win 40880, length 0
10:29:58.989898 IP 62.210.138.100.80 > 192.168.108.128.59490: Flags [.], seq 5841:7301, ack 379, win 64240, length 1460: HTTP
10:29:58.989901 IP 192.168.108.128.59490 > 62.210.138.100.80: Flags [.], ack 7301, win 43800, length 0
10:29:58.989910 IP 62.210.138.100.80 > 192.168.108.128.59490: Flags [.], seq 7301:8761, ack 379, win 64240, length 1460: HTTP
10:29:58.989913 IP 192.168.108.128.59490 > 62.210.138.100.80: Flags [.], ack 8761, win 46720, length 0
10:29:58.989923 IP 62.210.138.100.80 > 192.168.108.128.59490: Flags [.], seq 8761:10221, ack 379, win 64240, length 1460: HTTP
10:29:58.989926 IP 192.168.108.128.59490 > 62.210.138.100.80: Flags [.], ack 10221, win 49640, length 0
10:29:58.989994 IP 62.210.138.100.80 > 192.168.108.128.59490: Flags [.], seq 10221:11681, ack 379, win 64240, length 1460: HTTP
10:29:58.989998 IP 192.168.108.128.59490 > 62.210.138.100.80: Flags [.], ack 11681, win 52560, length 0
10:29:58.990008 IP 62.210.138.100.80 > 192.168.108.128.59490: Flags [.], seq 11681:13141, ack 379, win 64240, length 1460: HTTP
10:29:58.990012 IP 192.168.108.128.59490 > 62.210.138.100.80: Flags [.], ack 13141, win 55480, length 0
10:29:58.990021 IP 62.210.138.100.80 > 192.168.108.128.59490: Flags [P.], seq 13141:13454, ack 379, win 64240, length 313: HTTP
10:29:58.990024 IP 192.168.108.128.59490 > 62.210.138.100.80: Flags [.], ack 13454, win 58400, length 0
10:29:59.060312 IP 192.168.108.128.123 > 45.127.112.2.123: NTPv4, Client, length 48
10:29:59.077114 IP 45.127.112.2.123 > 192.168.108.128.123: NTPv4, Server, length 48
10:29:59.078558 IP 62.210.138.100.80 > 192.168.108.128.59490: Flags [.], seq 13454:14914, ack 379, win 64240, length 1460: HTTP
10:29:59.078586 IP 192.168.108.128.59490 > 62.210.138.100.80: Flags [.], ack 14914, win 61320, length 0
10:29:59.078638 IP 62.210.138.100.80 > 192.168.108.128.59490: Flags [P.], seq 14914:16374, ack 379, win 64240, length 1460: HTTP
10:29:59.078647 IP 192.168.108.128.59490 > 62.210.138.100.80: Flags [.], ack 16374, win 64240, length 0
10:29:59.079968 IP 62.210.138.100.80 > 192.168.108.128.59490: Flags [.], seq 16374:17834, ack 379, win 64240, length 1460: HTTP
10:29:59.079982 IP 192.168.108.128.59490 > 62.210.138.100.80: Flags [.], ack 17834, win 64240, length 0
10:29:59.080065 IP 62.210.138.100.80 > 192.168.108.128.59490: Flags [.], seq 17834:19294, ack 379, win 64240, length 1460: HTTP
10:29:59.080074 IP 192.168.108.128.59490 > 62.210.138.100.80: Flags [.], ack 19294, win 64240, length 0
10:29:59.080101 IP 62.210.138.100.80 > 192.168.108.128.59490: Flags [P.], seq 19294:20754, ack 379, win 64240, length 1460: HTTP
10:29:59.080109 IP 192.168.108.128.59490 > 62.210.138.100.80: Flags [.], ack 20754, win 64240, length 0
10:29:59.080136 IP 62.210.138.100.80 > 192.168.108.128.59490: Flags [P.], seq 20754:22214, ack 379, win 64240, length 1460: HTTP
10:29:59.080143 IP 192.168.108.128.59490 > 62.210.138.100.80: Flags [.], ack 22214, win 64240, length 0
10:29:59.119338 IP 62.210.138.100.80 > 192.168.108.128.59490: Flags [P.], seq 22214:23674, ack 379, win 64240, length 1460: HTTP
10:29:59.119373 IP 192.168.108.128.59490 > 62.210.138.100.80: Flags [.], ack 23674, win 64240, length 0
10:29:59.165830 IP 62.210.138.100.80 > 192.168.108.128.59490: Flags [.], seq 23674:25134, ack 379, win 64240, length 1460: HTTP
10:29:59.165866 IP 192.168.108.128.59490 > 62.210.138.100.80: Flags [.], ack 25134, win 64240, length 0
10:29:59.165941 IP 62.210.138.100.80 > 192.168.108.128.59490: Flags [.], seq 25134:26594, ack 379, win 64240, length 1460: HTTP
10:29:59.165952 IP 192.168.108.128.59490 > 62.210.138.100.80: Flags [.], ack 26594, win 64240, length 0
10:29:59.165981 IP 62.210.138.100.80 > 192.168.108.128.59490: Flags [.], seq 26594:28054, ack 379, win 64240, length 1460: HTTP
10:29:59.165989 IP 192.168.108.128.59490 > 62.210.138.100.80: Flags [.], ack 28054, win 64240, length 0
10:29:59.166085 IP 62.210.138.100.80 > 192.168.108.128.59490: Flags [P.], seq 28054:29514, ack 379, win 64240, length 1460: HTTP
10:29:59.166096 IP 192.168.108.128.59490 > 62.210.138.100.80: Flags [.], ack 29514, win 64240, length 0
10:29:59.166127 IP 62.210.138.100.80 > 192.168.108.128.59490: Flags [.], seq 29514:30974, ack 379, win 64240, length 1460: HTTP
10:29:59.166135 IP 192.168.108.128.59490 > 62.210.138.100.80: Flags [.], ack 30974, win 64240, length 0
10:29:59.166161 IP 62.210.138.100.80 > 192.168.108.128.59490: Flags [.], seq 30974:32434, ack 379, win 64240, length 1460: HTTP
10:29:59.166168 IP 192.168.108.128.59490 > 62.210.138.100.80: Flags [.], ack 32434, win 64240, length 0
10:29:59.166193 IP 62.210.138.100.80 > 192.168.108.128.59490: Flags [.], seq 32434:33894, ack 379, win 64240, length 1460: HTTP
10:29:59.166200 IP 62.210.138.100.80 > 192.168.108.128.59490: Flags [P.], seq 33894:35354, ack 379, win 64240, length 1460: HTTP
10:29:59.166205 IP 192.168.108.128.59490 > 62.210.138.100.80: Flags [.], ack 35354, win 64240, length 0
10:29:59.166529 IP 62.210.138.100.80 > 192.168.108.128.59490: Flags [.], seq 35354:36814, ack 379, win 64240, length 1460: HTTP
10:29:59.166538 IP 62.210.138.100.80 > 192.168.108.128.59490: Flags [.], seq 36814:38274, ack 379, win 64240, length 1460: HTTP
10:29:59.166544 IP 192.168.108.128.59490 > 62.210.138.100.80: Flags [.], ack 38274, win 64240, length 0
10:29:59.166608 IP 62.210.138.100.80 > 192.168.108.128.59490: Flags [P.], seq 38274:39734, ack 379, win 64240, length 1460: HTTP
10:29:59.206607 IP 192.168.108.128.59490 > 62.210.138.100.80: Flags [.], ack 39734, win 64240, length 0
10:29:59.251034 IP 62.210.138.100.80 > 192.168.108.128.59490: Flags [.], seq 39734:41194, ack 379, win 64240, length 1460: HTTP
10:29:59.251055 IP 62.210.138.100.80 > 192.168.108.128.59490: Flags [.], seq 41194:42654, ack 379, win 64240, length 1460: HTTP
10:29:59.251066 IP 192.168.108.128.59490 > 62.210.138.100.80: Flags [.], ack 42654, win 64240, length 0
10:29:59.251096 IP 62.210.138.100.80 > 192.168.108.128.59490: Flags [.], seq 42654:44114, ack 379, win 64240, length 1460: HTTP
10:29:59.251101 IP 62.210.138.100.80 > 192.168.108.128.59490: Flags [P.], seq 44114:45574, ack 379, win 64240, length 1460: HTTP
10:29:59.251104 IP 192.168.108.128.59490 > 62.210.138.100.80: Flags [.], ack 45574, win 64240, length 0
10:29:59.252024 IP 62.210.138.100.80 > 192.168.108.128.59490: Flags [.], seq 45574:47034, ack 379, win 64240, length 1460: HTTP
10:29:59.252034 IP 62.210.138.100.80 > 192.168.108.128.59490: Flags [.], seq 47034:48494, ack 379, win 64240, length 1460: HTTP
10:29:59.252039 IP 192.168.108.128.59490 > 62.210.138.100.80: Flags [.], ack 48494, win 64240, length 0
10:29:59.252067 IP 62.210.138.100.80 > 192.168.108.128.59490: Flags [.], seq 48494:49954, ack 379, win 64240, length 1460: HTTP
10:29:59.252072 IP 62.210.138.100.80 > 192.168.108.128.59490: Flags [P.], seq 49954:51414, ack 379, win 64240, length 1460: HTTP
10:29:59.252075 IP 192.168.108.128.59490 > 62.210.138.100.80: Flags [.], ack 51414, win 64240, length 0
10:29:59.252092 IP 62.210.138.100.80 > 192.168.108.128.59490: Flags [.], seq 51414:52874, ack 379, win 64240, length 1460: HTTP
10:29:59.252097 IP 62.210.138.100.80 > 192.168.108.128.59490: Flags [.], seq 52874:54334, ack 379, win 64240, length 1460: HTTP
10:29:59.252100 IP 192.168.108.128.59490 > 62.210.138.100.80: Flags [.], ack 54334, win 64240, length 0
10:29:59.252117 IP 62.210.138.100.80 > 192.168.108.128.59490: Flags [.], seq 54334:55794, ack 379, win 64240, length 1460: HTTP
10:29:59.252121 IP 62.210.138.100.80 > 192.168.108.128.59490: Flags [P.], seq 55794:57254, ack 379, win 64240, length 1460: HTTP
10:29:59.252124 IP 192.168.108.128.59490 > 62.210.138.100.80: Flags [.], ack 57254, win 64240, length 0
10:29:59.252518 IP 62.210.138.100.80 > 192.168.108.128.59490: Flags [P.], seq 57254:58714, ack 379, win 64240, length 1460: HTTP
10:29:59.259467 IP 62.210.138.100.80 > 192.168.108.128.59490: Flags [.], seq 58714:60174, ack 379, win 64240, length 1460: HTTP
10:29:59.259490 IP 192.168.108.128.59490 > 62.210.138.100.80: Flags [.], ack 60174, win 64240, length 0
10:29:59.259526 IP 62.210.138.100.80 > 192.168.108.128.59490: Flags [.], seq 60174:61634, ack 379, win 64240, length 1460: HTTP
10:29:59.259533 IP 62.210.138.100.80 > 192.168.108.128.59490: Flags [.], seq 61634:63094, ack 379, win 64240, length 1460: HTTP
10:29:59.259537 IP 192.168.108.128.59490 > 62.210.138.100.80: Flags [.], ack 63094, win 64240, length 0
10:29:59.259556 IP 62.210.138.100.80 > 192.168.108.128.59490: Flags [P.], seq 63094:64554, ack 379, win 64240, length 1460: HTTP
10:29:59.298922 IP 192.168.108.128.59490 > 62.210.138.100.80: Flags [.], ack 64554, win 64240, length 0
10:29:59.338973 IP 62.210.138.100.80 > 192.168.108.128.59490: Flags [.], seq 64554:66014, ack 379, win 64240, length 1460: HTTP
10:29:59.338995 IP 62.210.138.100.80 > 192.168.108.128.59490: Flags [.], seq 66014:67474, ack 379, win 64240, length 1460: HTTP
10:29:59.339006 IP 192.168.108.128.59490 > 62.210.138.100.80: Flags [.], ack 67474, win 64240, length 0
10:29:59.339037 IP 62.210.138.100.80 > 192.168.108.128.59490: Flags [.], seq 67474:68934, ack 379, win 64240, length 1460: HTTP
10:29:59.339043 IP 62.210.138.100.80 > 192.168.108.128.59490: Flags [.], seq 68934:70394, ack 379, win 64240, length 1460: HTTP
10:29:59.339046 IP 192.168.108.128.59490 > 62.210.138.100.80: Flags [.], ack 70394, win 64240, length 0
10:29:59.339064 IP 62.210.138.100.80 > 192.168.108.128.59490: Flags [P.], seq 70394:71854, ack 379, win 64240, length 1460: HTTP
10:29:59.339434 IP 62.210.138.100.80 > 192.168.108.128.59490: Flags [.], seq 71854:73314, ack 379, win 64240, length 1460: HTTP
10:29:59.339445 IP 192.168.108.128.59490 > 62.210.138.100.80: Flags [.], ack 73314, win 64240, length 0
10:29:59.339487 IP 62.210.138.100.80 > 192.168.108.128.59490: Flags [.], seq 73314:74774, ack 379, win 64240, length 1460: HTTP
10:29:59.339493 IP 62.210.138.100.80 > 192.168.108.128.59490: Flags [.], seq 74774:76234, ack 379, win 64240, length 1460: HTTP
10:29:59.339497 IP 192.168.108.128.59490 > 62.210.138.100.80: Flags [.], ack 76234, win 64240, length 0
10:29:59.339532 IP 62.210.138.100.80 > 192.168.108.128.59490: Flags [P.], seq 76234:77694, ack 379, win 64240, length 1460: HTTP
10:29:59.339538 IP 62.210.138.100.80 > 192.168.108.128.59490: Flags [.], seq 77694:79154, ack 379, win 64240, length 1460: HTTP
10:29:59.339542 IP 192.168.108.128.59490 > 62.210.138.100.80: Flags [.], ack 79154, win 64240, length 0
10:29:59.339560 IP 62.210.138.100.80 > 192.168.108.128.59490: Flags [.], seq 79154:80614, ack 379, win 64240, length 1460: HTTP
10:29:59.339564 IP 62.210.138.100.80 > 192.168.108.128.59490: Flags [.], seq 80614:82074, ack 379, win 64240, length 1460: HTTP
10:29:59.339567 IP 192.168.108.128.59490 > 62.210.138.100.80: Flags [.], ack 82074, win 64240, length 0
10:29:59.339584 IP 62.210.138.100.80 > 192.168.108.128.59490: Flags [P.], seq 82074:83534, ack 379, win 64240, length 1460: HTTP
10:29:59.339930 IP 62.210.138.100.80 > 192.168.108.128.59490: Flags [.], seq 83534:84994, ack 379, win 64240, length 1460: HTTP
10:29:59.339938 IP 192.168.108.128.59490 > 62.210.138.100.80: Flags [.], ack 84994, win 64240, length 0
10:29:59.339968 IP 62.210.138.100.80 > 192.168.108.128.59490: Flags [.], seq 84994:86454, ack 379, win 64240, length 1460: HTTP
10:29:59.339973 IP 62.210.138.100.80 > 192.168.108.128.59490: Flags [P.], seq 86454:87914, ack 379, win 64240, length 1460: HTTP
10:29:59.339976 IP 192.168.108.128.59490 > 62.210.138.100.80: Flags [.], ack 87914, win 64240, length 0
10:29:59.345888 IP 62.210.138.100.80 > 192.168.108.128.59490: Flags [.], seq 87914:89374, ack 379, win 64240, length 1460: HTTP
10:29:59.345903 IP 62.210.138.100.80 > 192.168.108.128.59490: Flags [.], seq 89374:90834, ack 379, win 64240, length 1460: HTTP
10:29:59.345910 IP 192.168.108.128.59490 > 62.210.138.100.80: Flags [.], ack 90834, win 64240, length 0
10:29:59.345930 IP 62.210.138.100.80 > 192.168.108.128.59490: Flags [.], seq 90834:92294, ack 379, win 64240, length 1460: HTTP
10:29:59.345932 IP 62.210.138.100.80 > 192.168.108.128.59490: Flags [P.], seq 92294:93754, ack 379, win 64240, length 1460: HTTP
10:29:59.345934 IP 192.168.108.128.59490 > 62.210.138.100.80: Flags [.], ack 93754, win 64240, length 0
10:29:59.345944 IP 62.210.138.100.80 > 192.168.108.128.59490: Flags [.], seq 93754:95214, ack 379, win 64240, length 1460: HTTP
10:29:59.345947 IP 62.210.138.100.80 > 192.168.108.128.59490: Flags [P.], seq 95214:96674, ack 379, win 64240, length 1460: HTTP
10:29:59.345948 IP 192.168.108.128.59490 > 62.210.138.100.80: Flags [.], ack 96674, win 64240, length 0
10:29:59.405388 IP 192.168.108.128.45807 > 192.168.108.2.53: 50940+ A? www.google.com. (32)
10:29:59.405486 IP 192.168.108.128.55415 > 192.168.108.2.53: 57743+ AAAA? www.google.com. (32)
10:29:59.405886 IP 192.168.108.128.41308 > 65.199.32.23.443: Flags [P.], seq 2437980792:2437980898, ack 728986940, win 65535, length 106
10:29:59.406252 IP 65.199.32.23.443 > 192.168.108.128.41308: Flags [.], ack 106, win 64240, length 0
10:29:59.409191 IP 192.168.108.2.53 > 192.168.108.128.45807: 50940 8/0/0 A 65.199.32.87, A 65.199.32.84, A 65.199.32.90, A 65.199.32.86, A 65.199.32.88, A 65.199.32.91, A 65.199.32.89, A 65.199.32.85 (174)
10:29:59.419225 IP 192.168.108.2.53 > 192.168.108.128.55415: 57743 1/0/0 AAAA 2607:f8b0:4006:80b::2004 (60)
10:29:59.424796 IP 62.210.138.100.80 > 192.168.108.128.59490: Flags [.], seq 96674:98134, ack 379, win 64240, length 1460: HTTP
10:29:59.424807 IP 192.168.108.128.59490 > 62.210.138.100.80: Flags [.], ack 98134, win 65535, length 0
10:29:59.424829 IP 62.210.138.100.80 > 192.168.108.128.59490: Flags [.], seq 98134:99594, ack 379, win 64240, length 1460: HTTP
10:29:59.424834 IP 192.168.108.128.59490 > 62.210.138.100.80: Flags [.], ack 99594, win 65535, length 0
10:29:59.424845 IP 62.210.138.100.80 > 192.168.108.128.59490: Flags [.], seq 99594:101054, ack 379, win 64240, length 1460: HTTP
10:29:59.424849 IP 192.168.108.128.59490 > 62.210.138.100.80: Flags [.], ack 101054, win 65535, length 0
10:29:59.424859 IP 62.210.138.100.80 > 192.168.108.128.59490: Flags [P.], seq 101054:102514, ack 379, win 64240, length 1460: HTTP
10:29:59.424862 IP 192.168.108.128.59490 > 62.210.138.100.80: Flags [.], ack 102514, win 65535, length 0
10:29:59.425773 IP 62.210.138.100.80 > 192.168.108.128.59490: Flags [.], seq 102514:103974, ack 379, win 64240, length 1460: HTTP
10:29:59.425778 IP 192.168.108.128.59490 > 62.210.138.100.80: Flags [.], ack 103974, win 65535, length 0
10:29:59.425795 IP 62.210.138.100.80 > 192.168.108.128.59490: Flags [.], seq 103974:105434, ack 379, win 64240, length 1460: HTTP
10:29:59.425799 IP 192.168.108.128.59490 > 62.210.138.100.80: Flags [.], ack 105434, win 65535, length 0
10:29:59.425809 IP 62.210.138.100.80 > 192.168.108.128.59490: Flags [.], seq 105434:106894, ack 379, win 64240, length 1460: HTTP
10:29:59.425812 IP 192.168.108.128.59490 > 62.210.138.100.80: Flags [.], ack 106894, win 65535, length 0
10:29:59.425821 IP 62.210.138.100.80 > 192.168.108.128.59490: Flags [P.], seq 106894:108354, ack 379, win 64240, length 1460: HTTP
10:29:59.425823 IP 192.168.108.128.59490 > 62.210.138.100.80: Flags [.], ack 108354, win 65535, length 0
10:29:59.425833 IP 62.210.138.100.80 > 192.168.108.128.59490: Flags [.], seq 108354:109814, ack 379, win 64240, length 1460: HTTP
10:29:59.425836 IP 192.168.108.128.59490 > 62.210.138.100.80: Flags [.], ack 109814, win 65535, length 0
10:29:59.425853 IP 62.210.138.100.80 > 192.168.108.128.59490: Flags [.], seq 109814:111274, ack 379, win 64240, length 1460: HTTP
10:29:59.425855 IP 192.168.108.128.59490 > 62.210.138.100.80: Flags [.], ack 111274, win 65535, length 0
10:29:59.425865 IP 62.210.138.100.80 > 192.168.108.128.59490: Flags [P.], seq 111274:112734, ack 379, win 64240, length 1460: HTTP
10:29:59.425868 IP 192.168.108.128.59490 > 62.210.138.100.80: Flags [.], ack 112734, win 65535, length 0
10:29:59.425878 IP 62.210.138.100.80 > 192.168.108.128.59490: Flags [.], seq 112734:114194, ack 379, win 64240, length 1460: HTTP
10:29:59.425881 IP 192.168.108.128.59490 > 62.210.138.100.80: Flags [.], ack 114194, win 65535, length 0
10:29:59.425891 IP 62.210.138.100.80 > 192.168.108.128.59490: Flags [P.], seq 114194:115654, ack 379, win 64240, length 1460: HTTP
10:29:59.425894 IP 192.168.108.128.59490 > 62.210.138.100.80: Flags [.], ack 115654, win 65535, length 0
10:29:59.426782 IP 62.210.138.100.80 > 192.168.108.128.59490: Flags [.], seq 115654:117114, ack 379, win 64240, length 1460: HTTP
10:29:59.426786 IP 192.168.108.128.59490 > 62.210.138.100.80: Flags [.], ack 117114, win 65535, length 0
10:29:59.426804 IP 62.210.138.100.80 > 192.168.108.128.59490: Flags [.], seq 117114:118574, ack 379, win 64240, length 1460: HTTP
10:29:59.426807 IP 192.168.108.128.59490 > 62.210.138.100.80: Flags [.], ack 118574, win 65535, length 0
10:29:59.426817 IP 62.210.138.100.80 > 192.168.108.128.59490: Flags [P.], seq 118574:120034, ack 379, win 64240, length 1460: HTTP
10:29:59.426820 IP 192.168.108.128.59490 > 62.210.138.100.80: Flags [.], ack 120034, win 65535, length 0
10:29:59.428402 IP 62.210.138.100.80 > 192.168.108.128.59490: Flags [.], seq 120034:121494, ack 379, win 64240, length 1460: HTTP
10:29:59.428408 IP 192.168.108.128.59490 > 62.210.138.100.80: Flags [.], ack 121494, win 65535, length 0
10:29:59.428430 IP 62.210.138.100.80 > 192.168.108.128.59490: Flags [P.], seq 121494:122954, ack 379, win 64240, length 1460: HTTP
10:29:59.428434 IP 192.168.108.128.59490 > 62.210.138.100.80: Flags [.], ack 122954, win 65535, length 0
10:29:59.436390 IP 62.210.138.100.80 > 192.168.108.128.59490: Flags [.], seq 122954:124414, ack 379, win 64240, length 1460: HTTP
10:29:59.436406 IP 192.168.108.128.59490 > 62.210.138.100.80: Flags [.], ack 124414, win 65535, length 0
10:29:59.436430 IP 62.210.138.100.80 > 192.168.108.128.59490: Flags [.], seq 124414:125874, ack 379, win 64240, length 1460: HTTP
10:29:59.436435 IP 192.168.108.128.59490 > 62.210.138.100.80: Flags [.], ack 125874, win 65535, length 0
10:29:59.436450 IP 62.210.138.100.80 > 192.168.108.128.59490: Flags [.], seq 125874:127334, ack 379, win 64240, length 1460: HTTP
10:29:59.436454 IP 192.168.108.128.59490 > 62.210.138.100.80: Flags [.], ack 127334, win 65535, length 0
10:29:59.436467 IP 62.210.138.100.80 > 192.168.108.128.59490: Flags [.], seq 127334:128794, ack 379, win 64240, length 1460: HTTP
10:29:59.436470 IP 192.168.108.128.59490 > 62.210.138.100.80: Flags [.], ack 128794, win 65535, length 0
10:29:59.436483 IP 62.210.138.100.80 > 192.168.108.128.59490: Flags [P.], seq 128794:130254, ack 379, win 64240, length 1460: HTTP
10:29:59.436486 IP 192.168.108.128.59490 > 62.210.138.100.80: Flags [.], ack 130254, win 65535, length 0
10:29:59.437398 IP 62.210.138.100.80 > 192.168.108.128.59490: Flags [.], seq 130254:131714, ack 379, win 64240, length 1460: HTTP
10:29:59.437405 IP 192.168.108.128.59490 > 62.210.138.100.80: Flags [.], ack 131714, win 65535, length 0
10:29:59.437428 IP 62.210.138.100.80 > 192.168.108.128.59490: Flags [.], seq 131714:133174, ack 379, win 64240, length 1460: HTTP
10:29:59.437432 IP 192.168.108.128.59490 > 62.210.138.100.80: Flags [.], ack 133174, win 65535, length 0
10:29:59.437445 IP 62.210.138.100.80 > 192.168.108.128.59490: Flags [.], seq 133174:134634, ack 379, win 64240, length 1460: HTTP
10:29:59.437448 IP 192.168.108.128.59490 > 62.210.138.100.80: Flags [.], ack 134634, win 65535, length 0
10:29:59.437460 IP 62.210.138.100.80 > 192.168.108.128.59490: Flags [P.], seq 134634:136094, ack 379, win 64240, length 1460: HTTP
10:29:59.437463 IP 192.168.108.128.59490 > 62.210.138.100.80: Flags [.], ack 136094, win 65535, length 0
10:29:59.437481 IP 62.210.138.100.80 > 192.168.108.128.59490: Flags [P.], seq 136094:137554, ack 379, win 64240, length 1460: HTTP
10:29:59.437487 IP 192.168.108.128.59490 > 62.210.138.100.80: Flags [.], ack 137554, win 65535, length 0
10:29:59.459218 IP 65.199.32.23.443 > 192.168.108.128.41308: Flags [P.], seq 1:502, ack 106, win 64240, length 501
10:29:59.459237 IP 192.168.108.128.41308 > 65.199.32.23.443: Flags [.], ack 502, win 65535, length 0
10:29:59.459648 IP 192.168.108.128.41308 > 65.199.32.23.443: Flags [P.], seq 106:152, ack 502, win 65535, length 46
10:29:59.460024 IP 65.199.32.23.443 > 192.168.108.128.41308: Flags [.], ack 152, win 64240, length 0
10:29:59.510948 IP 62.210.138.100.80 > 192.168.108.128.59490: Flags [.], seq 137554:139014, ack 379, win 64240, length 1460: HTTP
10:29:59.510968 IP 192.168.108.128.59490 > 62.210.138.100.80: Flags [.], ack 139014, win 65535, length 0
10:29:59.511004 IP 62.210.138.100.80 > 192.168.108.128.59490: Flags [.], seq 139014:140474, ack 379, win 64240, length 1460: HTTP
10:29:59.511009 IP 192.168.108.128.59490 > 62.210.138.100.80: Flags [.], ack 140474, win 65535, length 0
10:29:59.511022 IP 62.210.138.100.80 > 192.168.108.128.59490: Flags [.], seq 140474:141934, ack 379, win 64240, length 1460: HTTP
10:29:59.511025 IP 192.168.108.128.59490 > 62.210.138.100.80: Flags [.], ack 141934, win 65535, length 0
10:29:59.511036 IP 62.210.138.100.80 > 192.168.108.128.59490: Flags [P.], seq 141934:143394, ack 379, win 64240, length 1460: HTTP
10:29:59.511039 IP 192.168.108.128.59490 > 62.210.138.100.80: Flags [.], ack 143394, win 65535, length 0
10:29:59.511050 IP 62.210.138.100.80 > 192.168.108.128.59490: Flags [.], seq 143394:144854, ack 379, win 64240, length 1460: HTTP
10:29:59.511052 IP 192.168.108.128.59490 > 62.210.138.100.80: Flags [.], ack 144854, win 65535, length 0
10:29:59.511063 IP 62.210.138.100.80 > 192.168.108.128.59490: Flags [P.], seq 144854:146314, ack 379, win 64240, length 1460: HTTP
10:29:59.511066 IP 192.168.108.128.59490 > 62.210.138.100.80: Flags [.], ack 146314, win 65535, length 0
10:29:59.511076 IP 62.210.138.100.80 > 192.168.108.128.59490: Flags [P.], seq 146314:147774, ack 379, win 64240, length 1460: HTTP
10:29:59.511078 IP 192.168.108.128.59490 > 62.210.138.100.80: Flags [.], ack 147774, win 65535, length 0
10:29:59.511925 IP 62.210.138.100.80 > 192.168.108.128.59490: Flags [.], seq 147774:149234, ack 379, win 64240, length 1460: HTTP
10:29:59.511931 IP 192.168.108.128.59490 > 62.210.138.100.80: Flags [.], ack 149234, win 65535, length 0
10:29:59.511960 IP 62.210.138.100.80 > 192.168.108.128.59490: Flags [.], seq 149234:150694, ack 379, win 64240, length 1460: HTTP
10:29:59.511963 IP 192.168.108.128.59490 > 62.210.138.100.80: Flags [.], ack 150694, win 65535, length 0
10:29:59.511974 IP 62.210.138.100.80 > 192.168.108.128.59490: Flags [.], seq 150694:152154, ack 379, win 64240, length 1460: HTTP
10:29:59.511977 IP 192.168.108.128.59490 > 62.210.138.100.80: Flags [.], ack 152154, win 65535, length 0
10:29:59.511987 IP 62.210.138.100.80 > 192.168.108.128.59490: Flags [P.], seq 152154:153614, ack 379, win 64240, length 1460: HTTP
10:29:59.511990 IP 192.168.108.128.59490 > 62.210.138.100.80: Flags [.], ack 153614, win 65535, length 0
10:29:59.512000 IP 62.210.138.100.80 > 192.168.108.128.59490: Flags [.], seq 153614:155074, ack 379, win 64240, length 1460: HTTP
10:29:59.512003 IP 192.168.108.128.59490 > 62.210.138.100.80: Flags [.], ack 155074, win 65535, length 0
10:29:59.512013 IP 62.210.138.100.80 > 192.168.108.128.59490: Flags [.], seq 155074:156534, ack 379, win 64240, length 1460: HTTP
10:29:59.512015 IP 192.168.108.128.59490 > 62.210.138.100.80: Flags [.], ack 156534, win 65535, length 0
10:29:59.512025 IP 62.210.138.100.80 > 192.168.108.128.59490: Flags [P.], seq 156534:157994, ack 379, win 64240, length 1460: HTTP
10:29:59.512028 IP 192.168.108.128.59490 > 62.210.138.100.80: Flags [.], ack 157994, win 65535, length 0
10:29:59.515423 IP 62.210.138.100.80 > 192.168.108.128.59490: Flags [P.], seq 157994:159454, ack 379, win 64240, length 1460: HTTP
10:29:59.515432 IP 192.168.108.128.59490 > 62.210.138.100.80: Flags [.], ack 159454, win 65535, length 0
10:29:59.515455 IP 62.210.138.100.80 > 192.168.108.128.59490: Flags [.], seq 159454:160914, ack 379, win 64240, length 1460: HTTP
10:29:59.515460 IP 192.168.108.128.59490 > 62.210.138.100.80: Flags [.], ack 160914, win 65535, length 0
10:29:59.515471 IP 62.210.138.100.80 > 192.168.108.128.59490: Flags [.], seq 160914:162374, ack 379, win 64240, length 1460: HTTP
10:29:59.515474 IP 192.168.108.128.59490 > 62.210.138.100.80: Flags [.], ack 162374, win 65535, length 0
10:29:59.515484 IP 62.210.138.100.80 > 192.168.108.128.59490: Flags [P.], seq 162374:163834, ack 379, win 64240, length 1460: HTTP
10:29:59.515487 IP 192.168.108.128.59490 > 62.210.138.100.80: Flags [.], ack 163834, win 65535, length 0
10:29:59.515497 IP 62.210.138.100.80 > 192.168.108.128.59490: Flags [.], seq 163834:165294, ack 379, win 64240, length 1460: HTTP
10:29:59.515500 IP 192.168.108.128.59490 > 62.210.138.100.80: Flags [.], ack 165294, win 65535, length 0
10:29:59.515510 IP 62.210.138.100.80 > 192.168.108.128.59490: Flags [.], seq 165294:166754, ack 379, win 64240, length 1460: HTTP
10:29:59.515512 IP 192.168.108.128.59490 > 62.210.138.100.80: Flags [.], ack 166754, win 65535, length 0
10:29:59.515522 IP 62.210.138.100.80 > 192.168.108.128.59490: Flags [P.], seq 166754:168214, ack 379, win 64240, length 1460: HTTP
10:29:59.515525 IP 192.168.108.128.59490 > 62.210.138.100.80: Flags [.], ack 168214, win 65535, length 0
10:29:59.515535 IP 62.210.138.100.80 > 192.168.108.128.59490: Flags [P.], seq 168214:169674, ack 379, win 64240, length 1460: HTTP
10:29:59.515538 IP 62.210.138.100.80 > 192.168.108.128.59490: Flags [P.], seq 169674:171134, ack 379, win 64240, length 1460: HTTP
10:29:59.515541 IP 192.168.108.128.59490 > 62.210.138.100.80: Flags [.], ack 171134, win 65535, length 0
10:29:59.515551 IP 62.210.138.100.80 > 192.168.108.128.59490: Flags [P.], seq 171134:172594, ack 379, win 64240, length 1460: HTTP
10:29:59.523266 IP 62.210.138.100.80 > 192.168.108.128.59490: Flags [.], seq 172594:174054, ack 379, win 64240, length 1460: HTTP
10:29:59.523277 IP 192.168.108.128.59490 > 62.210.138.100.80: Flags [.], ack 174054, win 65535, length 0
10:29:59.523299 IP 62.210.138.100.80 > 192.168.108.128.59490: Flags [.], seq 174054:175514, ack 379, win 64240, length 1460: HTTP
10:29:59.523303 IP 192.168.108.128.59490 > 62.210.138.100.80: Flags [.], ack 175514, win 65535, length 0
10:29:59.523324 IP 62.210.138.100.80 > 192.168.108.128.59490: Flags [.], seq 175514:176974, ack 379, win 64240, length 1460: HTTP
10:29:59.523327 IP 192.168.108.128.59490 > 62.210.138.100.80: Flags [.], ack 176974, win 65535, length 0
10:29:59.523337 IP 62.210.138.100.80 > 192.168.108.128.59490: Flags [P.], seq 176974:178434, ack 379, win 64240, length 1460: HTTP
10:29:59.523340 IP 192.168.108.128.59490 > 62.210.138.100.80: Flags [.], ack 178434, win 65535, length 0
10:29:59.523349 IP 62.210.138.100.80 > 192.168.108.128.59490: Flags [.], seq 178434:179894, ack 379, win 64240, length 1460: HTTP
10:29:59.523352 IP 192.168.108.128.59490 > 62.210.138.100.80: Flags [.], ack 179894, win 65535, length 0
10:29:59.523362 IP 62.210.138.100.80 > 192.168.108.128.59490: Flags [P.], seq 179894:181354, ack 379, win 64240, length 1460: HTTP
10:29:59.523364 IP 192.168.108.128.59490 > 62.210.138.100.80: Flags [.], ack 181354, win 65535, length 0
10:29:59.524433 IP 62.210.138.100.80 > 192.168.108.128.59490: Flags [.], seq 181354:182814, ack 379, win 64240, length 1460: HTTP
10:29:59.524447 IP 192.168.108.128.59490 > 62.210.138.100.80: Flags [.], ack 182814, win 65535, length 0
10:29:59.524514 IP 62.210.138.100.80 > 192.168.108.128.59490: Flags [.], seq 182814:184274, ack 379, win 64240, length 1460: HTTP
10:29:59.524523 IP 192.168.108.128.59490 > 62.210.138.100.80: Flags [.], ack 184274, win 65535, length 0
10:29:59.524551 IP 62.210.138.100.80 > 192.168.108.128.59490: Flags [.], seq 184274:185734, ack 379, win 64240, length 1460: HTTP
10:29:59.524558 IP 192.168.108.128.59490 > 62.210.138.100.80: Flags [.], ack 185734, win 65535, length 0
10:29:59.524586 IP 62.210.138.100.80 > 192.168.108.128.59490: Flags [P.], seq 185734:187194, ack 379, win 64240, length 1460: HTTP
10:29:59.524592 IP 192.168.108.128.59490 > 62.210.138.100.80: Flags [.], ack 187194, win 65535, length 0
10:29:59.524620 IP 62.210.138.100.80 > 192.168.108.128.59490: Flags [.], seq 187194:188654, ack 379, win 64240, length 1460: HTTP
10:29:59.524631 IP 192.168.108.128.59490 > 62.210.138.100.80: Flags [.], ack 188654, win 65535, length 0
10:29:59.524668 IP 62.210.138.100.80 > 192.168.108.128.59490: Flags [P.], seq 188654:190114, ack 379, win 64240, length 1460: HTTP
10:29:59.524679 IP 192.168.108.128.59490 > 62.210.138.100.80: Flags [.], ack 190114, win 65535, length 0
10:29:59.598700 IP 62.210.138.100.80 > 192.168.108.128.59490: Flags [.], seq 190114:191574, ack 379, win 64240, length 1460: HTTP
10:29:59.598736 IP 192.168.108.128.59490 > 62.210.138.100.80: Flags [.], ack 191574, win 65535, length 0
10:29:59.598790 IP 62.210.138.100.80 > 192.168.108.128.59490: Flags [.], seq 191574:193034, ack 379, win 64240, length 1460: HTTP
10:29:59.598801 IP 192.168.108.128.59490 > 62.210.138.100.80: Flags [.], ack 193034, win 65535, length 0
10:29:59.598831 IP 62.210.138.100.80 > 192.168.108.128.59490: Flags [P.], seq 193034:194494, ack 379, win 64240, length 1460: HTTP
10:29:59.598841 IP 192.168.108.128.59490 > 62.210.138.100.80: Flags [.], ack 194494, win 65535, length 0
10:29:59.598867 IP 62.210.138.100.80 > 192.168.108.128.59490: Flags [.], seq 194494:195954, ack 379, win 64240, length 1460: HTTP
10:29:59.598875 IP 192.168.108.128.59490 > 62.210.138.100.80: Flags [.], ack 195954, win 65535, length 0
10:29:59.598900 IP 62.210.138.100.80 > 192.168.108.128.59490: Flags [.], seq 195954:197414, ack 379, win 64240, length 1460: HTTP
10:29:59.598908 IP 192.168.108.128.59490 > 62.210.138.100.80: Flags [.], ack 197414, win 65535, length 0
10:29:59.598934 IP 62.210.138.100.80 > 192.168.108.128.59490: Flags [P.], seq 197414:198874, ack 379, win 64240, length 1460: HTTP
10:29:59.598941 IP 192.168.108.128.59490 > 62.210.138.100.80: Flags [.], ack 198874, win 65535, length 0
10:29:59.599667 IP 62.210.138.100.80 > 192.168.108.128.59490: Flags [.], seq 198874:200334, ack 379, win 64240, length 1460: HTTP
10:29:59.599680 IP 192.168.108.128.59490 > 62.210.138.100.80: Flags [.], ack 200334, win 65535, length 0
10:29:59.599735 IP 62.210.138.100.80 > 192.168.108.128.59490: Flags [.], seq 200334:201794, ack 379, win 64240, length 1460: HTTP
10:29:59.599746 IP 192.168.108.128.59490 > 62.210.138.100.80: Flags [.], ack 201794, win 65535, length 0
10:29:59.599786 IP 62.210.138.100.80 > 192.168.108.128.59490: Flags [.], seq 201794:203254, ack 379, win 64240, length 1460: HTTP
10:29:59.599798 IP 62.210.138.100.80 > 192.168.108.128.59490: Flags [P.], seq 203254:204714, ack 379, win 64240, length 1460: HTTP
10:29:59.599807 IP 192.168.108.128.59490 > 62.210.138.100.80: Flags [.], ack 204714, win 65535, length 0
10:29:59.599939 IP 62.210.138.100.80 > 192.168.108.128.59490: Flags [.], seq 204714:206174, ack 379, win 64240, length 1460: HTTP
10:29:59.599951 IP 62.210.138.100.80 > 192.168.108.128.59490: Flags [.], seq 206174:207634, ack 379, win 64240, length 1460: HTTP
10:29:59.599960 IP 192.168.108.128.59490 > 62.210.138.100.80: Flags [.], ack 207634, win 65535, length 0
10:29:59.599994 IP 62.210.138.100.80 > 192.168.108.128.59490: Flags [.], seq 207634:209094, ack 379, win 64240, length 1460: HTTP
10:29:59.600001 IP 62.210.138.100.80 > 192.168.108.128.59490: Flags [P.], seq 209094:210554, ack 379, win 64240, length 1460: HTTP
10:29:59.600008 IP 192.168.108.128.59490 > 62.210.138.100.80: Flags [.], ack 210554, win 65535, length 0
10:29:59.600214 IP 62.210.138.100.80 > 192.168.108.128.59490: Flags [.], seq 210554:212014, ack 379, win 64240, length 1460: HTTP
10:29:59.600223 IP 62.210.138.100.80 > 192.168.108.128.59490: Flags [.], seq 212014:213474, ack 379, win 64240, length 1460: HTTP
10:29:59.600228 IP 192.168.108.128.59490 > 62.210.138.100.80: Flags [.], ack 213474, win 65535, length 0
10:29:59.600258 IP 62.210.138.100.80 > 192.168.108.128.59490: Flags [.], seq 213474:214934, ack 379, win 64240, length 1460: HTTP
10:29:59.600264 IP 62.210.138.100.80 > 192.168.108.128.59490: Flags [P.], seq 214934:216394, ack 379, win 64240, length 1460: HTTP
10:29:59.600267 IP 62.210.138.100.80 > 192.168.108.128.59490: Flags [.], seq 216394:217854, ack 379, win 64240, length 1460: HTTP
10:29:59.600270 IP 62.210.138.100.80 > 192.168.108.128.59490: Flags [P.], seq 217854:219314, ack 379, win 64240, length 1460: HTTP
10:29:59.600671 IP 192.168.108.128.59490 > 62.210.138.100.80: Flags [.], ack 219314, win 65535, length 0
10:29:59.601146 IP 62.210.138.100.80 > 192.168.108.128.59490: Flags [.], seq 219314:220774, ack 379, win 64240, length 1460: HTTP
10:29:59.601161 IP 62.210.138.100.80 > 192.168.108.128.59490: Flags [P.], seq 220774:222234, ack 379, win 64240, length 1460: HTTP
10:29:59.601169 IP 192.168.108.128.59490 > 62.210.138.100.80: Flags [.], ack 222234, win 65535, length 0
10:29:59.601212 IP 62.210.138.100.80 > 192.168.108.128.59490: Flags [P.], seq 222234:223694, ack 379, win 64240, length 1460: HTTP
10:29:59.602002 IP 62.210.138.100.80 > 192.168.108.128.59490: Flags [.], seq 223694:225154, ack 379, win 64240, length 1460: HTTP
10:29:59.602038 IP 192.168.108.128.59490 > 62.210.138.100.80: Flags [.], ack 225154, win 65535, length 0
10:29:59.602101 IP 62.210.138.100.80 > 192.168.108.128.59490: Flags [P.], seq 225154:226614, ack 379, win 64240, length 1460: HTTP
10:29:59.602112 IP 62.210.138.100.80 > 192.168.108.128.59490: Flags [.], seq 226614:228074, ack 379, win 64240, length 1460: HTTP
10:29:59.602122 IP 192.168.108.128.59490 > 62.210.138.100.80: Flags [.], ack 228074, win 65535, length 0
10:29:59.602225 IP 62.210.138.100.80 > 192.168.108.128.59490: Flags [P.], seq 228074:229534, ack 379, win 64240, length 1460: HTTP
10:29:59.602233 IP 62.210.138.100.80 > 192.168.108.128.59490: Flags [.], seq 229534:230994, ack 379, win 64240, length 1460: HTTP
10:29:59.602239 IP 192.168.108.128.59490 > 62.210.138.100.80: Flags [.], ack 230994, win 65535, length 0
10:29:59.602295 IP 62.210.138.100.80 > 192.168.108.128.59490: Flags [P.], seq 230994:232454, ack 379, win 64240, length 1460: HTTP
10:29:59.602302 IP 62.210.138.100.80 > 192.168.108.128.59490: Flags [.], seq 232454:233914, ack 379, win 64240, length 1460: HTTP
10:29:59.602307 IP 192.168.108.128.59490 > 62.210.138.100.80: Flags [.], ack 233914, win 65535, length 0
10:29:59.602335 IP 62.210.138.100.80 > 192.168.108.128.59490: Flags [P.], seq 233914:235374, ack 379, win 64240, length 1460: HTTP
10:29:59.602341 IP 62.210.138.100.80 > 192.168.108.128.59490: Flags [P.], seq 235374:236834, ack 379, win 64240, length 1460: HTTP
10:29:59.602345 IP 192.168.108.128.59490 > 62.210.138.100.80: Flags [.], ack 236834, win 65535, length 0
10:29:59.609535 IP 62.210.138.100.80 > 192.168.108.128.59490: Flags [.], seq 236834:238294, ack 379, win 64240, length 1460: HTTP
10:29:59.609561 IP 62.210.138.100.80 > 192.168.108.128.59490: Flags [.], seq 238294:239754, ack 379, win 64240, length 1460: HTTP
10:29:59.609574 IP 192.168.108.128.59490 > 62.210.138.100.80: Flags [.], ack 239754, win 65535, length 0
10:29:59.609621 IP 62.210.138.100.80 > 192.168.108.128.59490: Flags [P.], seq 239754:241214, ack 379, win 64240, length 1460: HTTP
10:29:59.609628 IP 62.210.138.100.80 > 192.168.108.128.59490: Flags [.], seq 241214:242674, ack 379, win 64240, length 1460: HTTP
10:29:59.609633 IP 192.168.108.128.59490 > 62.210.138.100.80: Flags [.], ack 242674, win 65535, length 0
10:29:59.609661 IP 62.210.138.100.80 > 192.168.108.128.59490: Flags [.], seq 242674:244134, ack 379, win 64240, length 1460: HTTP
10:29:59.609667 IP 62.210.138.100.80 > 192.168.108.128.59490: Flags [P.], seq 244134:245594, ack 379, win 64240, length 1460: HTTP
10:29:59.609671 IP 192.168.108.128.59490 > 62.210.138.100.80: Flags [.], ack 245594, win 65535, length 0
10:29:59.614073 IP 62.210.138.100.80 > 192.168.108.128.59490: Flags [.], seq 245594:247054, ack 379, win 64240, length 1460: HTTP
10:29:59.614082 IP 62.210.138.100.80 > 192.168.108.128.59490: Flags [.], seq 247054:248514, ack 379, win 64240, length 1460: HTTP
10:29:59.614087 IP 192.168.108.128.59490 > 62.210.138.100.80: Flags [.], ack 248514, win 65535, length 0
10:29:59.614115 IP 62.210.138.100.80 > 192.168.108.128.59490: Flags [.], seq 248514:249974, ack 379, win 64240, length 1460: HTTP
10:29:59.614118 IP 62.210.138.100.80 > 192.168.108.128.59490: Flags [P.], seq 249974:251434, ack 379, win 64240, length 1460: HTTP
10:29:59.614121 IP 192.168.108.128.59490 > 62.210.138.100.80: Flags [.], ack 251434, win 65535, length 0
10:29:59.614137 IP 62.210.138.100.80 > 192.168.108.128.59490: Flags [.], seq 251434:252894, ack 379, win 64240, length 1460: HTTP
10:29:59.614140 IP 62.210.138.100.80 > 192.168.108.128.59490: Flags [P.], seq 252894:254354, ack 379, win 64240, length 1460: HTTP
10:29:59.614143 IP 192.168.108.128.59490 > 62.210.138.100.80: Flags [.], ack 254354, win 65535, length 0
10:29:59.684156 IP 62.210.138.100.80 > 192.168.108.128.59490: Flags [.], seq 254354:255814, ack 379, win 64240, length 1460: HTTP
10:29:59.684184 IP 62.210.138.100.80 > 192.168.108.128.59490: Flags [.], seq 255814:257274, ack 379, win 64240, length 1460: HTTP
10:29:59.684200 IP 192.168.108.128.59490 > 62.210.138.100.80: Flags [.], ack 257274, win 65535, length 0
10:29:59.684248 IP 62.210.138.100.80 > 192.168.108.128.59490: Flags [.], seq 257274:258734, ack 379, win 64240, length 1460: HTTP
