frame.number;eth.src;ip.src;eth.dst;ip.dst;_ws.col.Protocol;_ws.col.Info
1;;127.0.0.1;;127.0.0.1;TCP;45674 → 8080 [ACK] Seq=1 Ack=1 Win=3637 Len=0 TSval=805862 TSecr=805862
2;;127.0.0.1;;127.0.0.1;TCP;8080 → 45674 [PSH, ACK] Seq=1 Ack=1 Win=350 Len=8192 TSval=805862 TSecr=805862
3;;127.0.0.1;;127.0.0.1;TCP;45674 → 8080 [ACK] Seq=1 Ack=8193 Win=3637 Len=0 TSval=805862 TSecr=805862
4;;127.0.0.1;;127.0.0.1;TCP;8080 → 45674 [PSH, ACK] Seq=8193 Ack=1 Win=350 Len=8192 TSval=805862 TSecr=805862
5;;127.0.0.1;;127.0.0.1;TCP;45674 → 8080 [ACK] Seq=1 Ack=16385 Win=3637 Len=0 TSval=805862 TSecr=805862
6;;127.0.0.1;;127.0.0.1;TCP;8080 → 45674 [PSH, ACK] Seq=16385 Ack=1 Win=350 Len=8192 TSval=805862 TSecr=805862
7;;127.0.0.1;;127.0.0.1;TCP;45674 → 8080 [ACK] Seq=1 Ack=24577 Win=3637 Len=0 TSval=805862 TSecr=805862
8;;127.0.0.1;;127.0.0.1;TCP;8080 → 45674 [PSH, ACK] Seq=24577 Ack=1 Win=350 Len=8192 TSval=805862 TSecr=805862
9;;127.0.0.1;;127.0.0.1;TCP;45674 → 8080 [ACK] Seq=1 Ack=32769 Win=3637 Len=0 TSval=805862 TSecr=805862
10;;127.0.0.1;;127.0.0.1;TCP;8080 → 45674 [PSH, ACK] Seq=32769 Ack=1 Win=350 Len=16384 TSval=805862 TSecr=805862
11;;127.0.0.1;;127.0.0.1;TCP;45674 → 8080 [ACK] Seq=1 Ack=49153 Win=3637 Len=0 TSval=805862 TSecr=805862
12;;127.0.0.1;;127.0.0.1;TCP;8080 → 45674 [PSH, ACK] Seq=49153 Ack=1 Win=350 Len=7068 TSval=805862 TSecr=805862
13;;127.0.0.1;;127.0.0.1;TCP;45674 → 8080 [ACK] Seq=1 Ack=56221 Win=3637 Len=0 TSval=805862 TSecr=805862
14;;127.0.0.1;;127.0.0.1;TCP;8080 → 45674 [FIN, ACK] Seq=56221 Ack=1 Win=350 Len=0 TSval=805862 TSecr=805862
15;;127.0.0.1;;127.0.0.1;TCP;45674 → 8080 [FIN, ACK] Seq=1 Ack=56222 Win=3637 Len=0 TSval=805862 TSecr=805862
16;;127.0.0.1;;127.0.0.1;TCP;8080 → 45674 [ACK] Seq=56222 Ack=2 Win=350 Len=0 TSval=805862 TSecr=805862
17;;127.0.0.1;;127.0.0.1;TCP;45676 → 8080 [SYN] Seq=0 Win=43690 Len=0 MSS=65495 SACK_PERM=1 TSval=805921 TSecr=0 WS=128
18;;127.0.0.1;;127.0.0.1;TCP;8080 → 45676 [SYN, ACK] Seq=0 Ack=1 Win=43690 Len=0 MSS=65495 SACK_PERM=1 TSval=805921 TSecr=805921 WS=128
19;;127.0.0.1;;127.0.0.1;TCP;45676 → 8080 [ACK] Seq=1 Ack=1 Win=43776 Len=0 TSval=805921 TSecr=805921
20;;127.0.0.1;;127.0.0.1;HTTP;GET /capture_00001_20170304180024.csv HTTP/1.1 
21;;127.0.0.1;;127.0.0.1;TCP;8080 → 45676 [ACK] Seq=1 Ack=198 Win=44800 Len=0 TSval=805921 TSecr=805921
22;;127.0.0.1;;127.0.0.1;TCP;[TCP segment of a reassembled PDU]
23;;127.0.0.1;;127.0.0.1;TCP;45676 → 8080 [ACK] Seq=198 Ack=18 Win=43776 Len=0 TSval=805922 TSecr=805922
24;;127.0.0.1;;127.0.0.1;TCP;[TCP segment of a reassembled PDU]
25;;127.0.0.1;;127.0.0.1;TCP;45676 → 8080 [ACK] Seq=198 Ack=56 Win=43776 Len=0 TSval=805922 TSecr=805922
26;;127.0.0.1;;127.0.0.1;TCP;[TCP segment of a reassembled PDU]
27;;127.0.0.1;;127.0.0.1;TCP;45676 → 8080 [ACK] Seq=198 Ack=93 Win=43776 Len=0 TSval=805922 TSecr=805922
28;;127.0.0.1;;127.0.0.1;TCP;[TCP segment of a reassembled PDU]
29;;127.0.0.1;;127.0.0.1;TCP;45676 → 8080 [ACK] Seq=198 Ack=117 Win=43776 Len=0 TSval=805922 TSecr=805922
30;;127.0.0.1;;127.0.0.1;TCP;[TCP segment of a reassembled PDU]
31;;127.0.0.1;;127.0.0.1;TCP;45676 → 8080 [ACK] Seq=198 Ack=140 Win=43776 Len=0 TSval=805922 TSecr=805922
32;;127.0.0.1;;127.0.0.1;TCP;[TCP segment of a reassembled PDU]
33;;127.0.0.1;;127.0.0.1;TCP;45676 → 8080 [ACK] Seq=198 Ack=186 Win=43776 Len=0 TSval=805922 TSecr=805922
34;;127.0.0.1;;127.0.0.1;TCP;[TCP segment of a reassembled PDU]
35;;127.0.0.1;;127.0.0.1;TCP;45676 → 8080 [ACK] Seq=198 Ack=188 Win=43776 Len=0 TSval=805922 TSecr=805922
36;;127.0.0.1;;127.0.0.1;TCP;[TCP segment of a reassembled PDU]
37;;127.0.0.1;;127.0.0.1;TCP;45676 → 8080 [ACK] Seq=198 Ack=8380 Win=174720 Len=0 TSval=805922 TSecr=805922
38;;127.0.0.1;;127.0.0.1;TCP;[TCP segment of a reassembled PDU]
39;;127.0.0.1;;127.0.0.1;TCP;45676 → 8080 [ACK] Seq=198 Ack=16572 Win=305664 Len=0 TSval=805922 TSecr=805922
40;;127.0.0.1;;127.0.0.1;TCP;[TCP segment of a reassembled PDU]
41;;127.0.0.1;;127.0.0.1;TCP;45676 → 8080 [ACK] Seq=198 Ack=24764 Win=436608 Len=0 TSval=805922 TSecr=805922
42;;127.0.0.1;;127.0.0.1;TCP;[TCP segment of a reassembled PDU]
43;;127.0.0.1;;127.0.0.1;TCP;45676 → 8080 [ACK] Seq=198 Ack=32956 Win=465536 Len=0 TSval=805922 TSecr=805922
44;;127.0.0.1;;127.0.0.1;TCP;[TCP segment of a reassembled PDU]
45;;127.0.0.1;;127.0.0.1;TCP;45676 → 8080 [ACK] Seq=198 Ack=41148 Win=465536 Len=0 TSval=805922 TSecr=805922
46;;127.0.0.1;;127.0.0.1;TCP;[TCP segment of a reassembled PDU]
47;;127.0.0.1;;127.0.0.1;TCP;45676 → 8080 [ACK] Seq=198 Ack=49340 Win=465536 Len=0 TSval=805922 TSecr=805922
48;;127.0.0.1;;127.0.0.1;TCP;[TCP segment of a reassembled PDU]
49;;127.0.0.1;;127.0.0.1;TCP;45676 → 8080 [ACK] Seq=198 Ack=57532 Win=465536 Len=0 TSval=805922 TSecr=805922
50;;127.0.0.1;;127.0.0.1;TCP;[TCP segment of a reassembled PDU]
51;;127.0.0.1;;127.0.0.1;TCP;45676 → 8080 [ACK] Seq=198 Ack=65724 Win=465536 Len=0 TSval=805922 TSecr=805922
52;;127.0.0.1;;127.0.0.1;TCP;[TCP segment of a reassembled PDU]
53;;127.0.0.1;;127.0.0.1;TCP;45676 → 8080 [ACK] Seq=198 Ack=73916 Win=465536 Len=0 TSval=805922 TSecr=805922
54;;127.0.0.1;;127.0.0.1;TCP;[TCP segment of a reassembled PDU]
55;;127.0.0.1;;127.0.0.1;TCP;45676 → 8080 [ACK] Seq=198 Ack=82108 Win=465536 Len=0 TSval=805922 TSecr=805922
56;;127.0.0.1;;127.0.0.1;HTTP;HTTP/1.0 200 OK  (text/csv)
57;;127.0.0.1;;127.0.0.1;TCP;45676 → 8080 [ACK] Seq=198 Ack=89176 Win=465536 Len=0 TSval=805922 TSecr=805922
58;;127.0.0.1;;127.0.0.1;TCP;8080 → 45676 [FIN, ACK] Seq=89176 Ack=198 Win=44800 Len=0 TSval=805922 TSecr=805922
59;;127.0.0.1;;127.0.0.1;TCP;45676 → 8080 [FIN, ACK] Seq=198 Ack=89177 Win=465536 Len=0 TSval=805922 TSecr=805922
60;;127.0.0.1;;127.0.0.1;TCP;8080 → 45676 [ACK] Seq=89177 Ack=199 Win=44800 Len=0 TSval=805922 TSecr=805922
61;;127.0.0.1;;127.0.0.1;TCP;45678 → 8080 [SYN] Seq=0 Win=43690 Len=0 MSS=65495 SACK_PERM=1 TSval=805953 TSecr=0 WS=128
62;;127.0.0.1;;127.0.0.1;TCP;8080 → 45678 [SYN, ACK] Seq=0 Ack=1 Win=43690 Len=0 MSS=65495 SACK_PERM=1 TSval=805953 TSecr=805953 WS=128
63;;127.0.0.1;;127.0.0.1;TCP;45678 → 8080 [ACK] Seq=1 Ack=1 Win=43776 Len=0 TSval=805953 TSecr=805953
64;;127.0.0.1;;127.0.0.1;HTTP;GET /capture_00001_20170304180024.csv HTTP/1.1 
65;;127.0.0.1;;127.0.0.1;TCP;8080 → 45678 [ACK] Seq=1 Ack=198 Win=44800 Len=0 TSval=805953 TSecr=805953
66;;127.0.0.1;;127.0.0.1;TCP;[TCP segment of a reassembled PDU]
67;;127.0.0.1;;127.0.0.1;TCP;45678 → 8080 [ACK] Seq=198 Ack=18 Win=43776 Len=0 TSval=805953 TSecr=805953
68;;127.0.0.1;;127.0.0.1;TCP;[TCP segment of a reassembled PDU]
69;;127.0.0.1;;127.0.0.1;TCP;45678 → 8080 [ACK] Seq=198 Ack=56 Win=43776 Len=0 TSval=805953 TSecr=805953
70;;127.0.0.1;;127.0.0.1;TCP;[TCP segment of a reassembled PDU]
71;;127.0.0.1;;127.0.0.1;TCP;45678 → 8080 [ACK] Seq=198 Ack=93 Win=43776 Len=0 TSval=805953 TSecr=805953
72;;127.0.0.1;;127.0.0.1;TCP;[TCP segment of a reassembled PDU]
73;;127.0.0.1;;127.0.0.1;TCP;45678 → 8080 [ACK] Seq=198 Ack=117 Win=43776 Len=0 TSval=805953 TSecr=805953
74;;127.0.0.1;;127.0.0.1;TCP;[TCP segment of a reassembled PDU]
75;;127.0.0.1;;127.0.0.1;TCP;45678 → 8080 [ACK] Seq=198 Ack=140 Win=43776 Len=0 TSval=805953 TSecr=805953
76;;127.0.0.1;;127.0.0.1;TCP;[TCP segment of a reassembled PDU]
77;;127.0.0.1;;127.0.0.1;TCP;45678 → 8080 [ACK] Seq=198 Ack=186 Win=43776 Len=0 TSval=805953 TSecr=805953
78;;127.0.0.1;;127.0.0.1;TCP;[TCP segment of a reassembled PDU]
79;;127.0.0.1;;127.0.0.1;TCP;45678 → 8080 [ACK] Seq=198 Ack=188 Win=43776 Len=0 TSval=805953 TSecr=805953
80;;127.0.0.1;;127.0.0.1;TCP;[TCP segment of a reassembled PDU]
81;;127.0.0.1;;127.0.0.1;TCP;45678 → 8080 [ACK] Seq=198 Ack=8380 Win=174720 Len=0 TSval=805953 TSecr=805953
82;;127.0.0.1;;127.0.0.1;TCP;[TCP segment of a reassembled PDU]
83;;127.0.0.1;;127.0.0.1;TCP;45678 → 8080 [ACK] Seq=198 Ack=16572 Win=305664 Len=0 TSval=805953 TSecr=805953
84;;127.0.0.1;;127.0.0.1;TCP;[TCP segment of a reassembled PDU]
85;;127.0.0.1;;127.0.0.1;TCP;45678 → 8080 [ACK] Seq=198 Ack=24764 Win=436608 Len=0 TSval=805953 TSecr=805953
86;;127.0.0.1;;127.0.0.1;TCP;[TCP segment of a reassembled PDU]
87;;127.0.0.1;;127.0.0.1;TCP;45678 → 8080 [ACK] Seq=198 Ack=32956 Win=465536 Len=0 TSval=805953 TSecr=805953
88;;127.0.0.1;;127.0.0.1;TCP;[TCP segment of a reassembled PDU]
89;;127.0.0.1;;127.0.0.1;TCP;45678 → 8080 [ACK] Seq=198 Ack=41148 Win=465536 Len=0 TSval=805953 TSecr=805953
90;;127.0.0.1;;127.0.0.1;TCP;[TCP segment of a reassembled PDU]
91;;127.0.0.1;;127.0.0.1;TCP;45678 → 8080 [ACK] Seq=198 Ack=49340 Win=465536 Len=0 TSval=805953 TSecr=805953
92;;127.0.0.1;;127.0.0.1;TCP;[TCP segment of a reassembled PDU]
93;;127.0.0.1;;127.0.0.1;TCP;45678 → 8080 [ACK] Seq=198 Ack=57532 Win=465536 Len=0 TSval=805953 TSecr=805953
94;;127.0.0.1;;127.0.0.1;TCP;[TCP segment of a reassembled PDU]
95;;127.0.0.1;;127.0.0.1;TCP;45678 → 8080 [ACK] Seq=198 Ack=65724 Win=465536 Len=0 TSval=805953 TSecr=805953
96;;127.0.0.1;;127.0.0.1;TCP;[TCP segment of a reassembled PDU]
97;;127.0.0.1;;127.0.0.1;TCP;45678 → 8080 [ACK] Seq=198 Ack=73916 Win=465536 Len=0 TSval=805953 TSecr=805953
98;;127.0.0.1;;127.0.0.1;TCP;[TCP segment of a reassembled PDU]
99;;127.0.0.1;;127.0.0.1;TCP;45678 → 8080 [ACK] Seq=198 Ack=82108 Win=465536 Len=0 TSval=805953 TSecr=805953
100;;127.0.0.1;;127.0.0.1;HTTP;HTTP/1.0 200 OK  (text/csv)
101;;127.0.0.1;;127.0.0.1;TCP;45678 → 8080 [ACK] Seq=198 Ack=89176 Win=465536 Len=0 TSval=805953 TSecr=805953
102;;127.0.0.1;;127.0.0.1;TCP;8080 → 45678 [FIN, ACK] Seq=89176 Ack=198 Win=44800 Len=0 TSval=805953 TSecr=805953
103;;127.0.0.1;;127.0.0.1;TCP;45678 → 8080 [FIN, ACK] Seq=198 Ack=89177 Win=465536 Len=0 TSval=805953 TSecr=805953
104;;127.0.0.1;;127.0.0.1;TCP;8080 → 45678 [ACK] Seq=89177 Ack=199 Win=44800 Len=0 TSval=805953 TSecr=805953
105;;127.0.0.1;;127.0.0.1;TCP;45680 → 8080 [SYN] Seq=0 Win=43690 Len=0 MSS=65495 SACK_PERM=1 TSval=806015 TSecr=0 WS=128
106;;127.0.0.1;;127.0.0.1;TCP;8080 → 45680 [SYN, ACK] Seq=0 Ack=1 Win=43690 Len=0 MSS=65495 SACK_PERM=1 TSval=806015 TSecr=806015 WS=128
107;;127.0.0.1;;127.0.0.1;TCP;45680 → 8080 [ACK] Seq=1 Ack=1 Win=43776 Len=0 TSval=806015 TSecr=806015
108;;127.0.0.1;;127.0.0.1;HTTP;GET /capture_00001_20170304180024.csv HTTP/1.1 
109;;127.0.0.1;;127.0.0.1;TCP;8080 → 45680 [ACK] Seq=1 Ack=198 Win=44800 Len=0 TSval=806015 TSecr=806015
110;;127.0.0.1;;127.0.0.1;TCP;[TCP segment of a reassembled PDU]
111;;127.0.0.1;;127.0.0.1;TCP;45680 → 8080 [ACK] Seq=198 Ack=18 Win=43776 Len=0 TSval=806015 TSecr=806015
112;;127.0.0.1;;127.0.0.1;TCP;[TCP segment of a reassembled PDU]
113;;127.0.0.1;;127.0.0.1;TCP;45680 → 8080 [ACK] Seq=198 Ack=56 Win=43776 Len=0 TSval=806015 TSecr=806015
114;;127.0.0.1;;127.0.0.1;TCP;[TCP segment of a reassembled PDU]
115;;127.0.0.1;;127.0.0.1;TCP;45680 → 8080 [ACK] Seq=198 Ack=93 Win=43776 Len=0 TSval=806015 TSecr=806015
116;;127.0.0.1;;127.0.0.1;TCP;[TCP segment of a reassembled PDU]
117;;127.0.0.1;;127.0.0.1;TCP;45680 → 8080 [ACK] Seq=198 Ack=117 Win=43776 Len=0 TSval=806015 TSecr=806015
118;;127.0.0.1;;127.0.0.1;TCP;[TCP segment of a reassembled PDU]
119;;127.0.0.1;;127.0.0.1;TCP;45680 → 8080 [ACK] Seq=198 Ack=140 Win=43776 Len=0 TSval=806015 TSecr=806015
120;;127.0.0.1;;127.0.0.1;TCP;[TCP segment of a reassembled PDU]
121;;127.0.0.1;;127.0.0.1;TCP;45680 → 8080 [ACK] Seq=198 Ack=186 Win=43776 Len=0 TSval=806015 TSecr=806015
122;;127.0.0.1;;127.0.0.1;TCP;[TCP segment of a reassembled PDU]
123;;127.0.0.1;;127.0.0.1;TCP;45680 → 8080 [ACK] Seq=198 Ack=188 Win=43776 Len=0 TSval=806015 TSecr=806015
124;;127.0.0.1;;127.0.0.1;TCP;[TCP segment of a reassembled PDU]
125;;127.0.0.1;;127.0.0.1;TCP;45680 → 8080 [ACK] Seq=198 Ack=8380 Win=174720 Len=0 TSval=806015 TSecr=806015
126;;127.0.0.1;;127.0.0.1;TCP;[TCP segment of a reassembled PDU]
127;;127.0.0.1;;127.0.0.1;TCP;45680 → 8080 [ACK] Seq=198 Ack=16572 Win=305664 Len=0 TSval=806015 TSecr=806015
128;;127.0.0.1;;127.0.0.1;TCP;[TCP segment of a reassembled PDU]
129;;127.0.0.1;;127.0.0.1;TCP;45680 → 8080 [ACK] Seq=198 Ack=24764 Win=436608 Len=0 TSval=806015 TSecr=806015
130;;127.0.0.1;;127.0.0.1;TCP;[TCP segment of a reassembled PDU]
131;;127.0.0.1;;127.0.0.1;TCP;45680 → 8080 [ACK] Seq=198 Ack=32956 Win=465536 Len=0 TSval=806015 TSecr=806015
132;;127.0.0.1;;127.0.0.1;TCP;[TCP segment of a reassembled PDU]
133;;127.0.0.1;;127.0.0.1;TCP;45680 → 8080 [ACK] Seq=198 Ack=41148 Win=465536 Len=0 TSval=806015 TSecr=806015
134;;127.0.0.1;;127.0.0.1;TCP;[TCP segment of a reassembled PDU]
135;;127.0.0.1;;127.0.0.1;TCP;45680 → 8080 [ACK] Seq=198 Ack=49340 Win=465536 Len=0 TSval=806015 TSecr=806015
136;;127.0.0.1;;127.0.0.1;TCP;[TCP segment of a reassembled PDU]
137;;127.0.0.1;;127.0.0.1;TCP;45680 → 8080 [ACK] Seq=198 Ack=57532 Win=465536 Len=0 TSval=806015 TSecr=806015
138;;127.0.0.1;;127.0.0.1;TCP;[TCP segment of a reassembled PDU]
139;;127.0.0.1;;127.0.0.1;TCP;45680 → 8080 [ACK] Seq=198 Ack=65724 Win=465536 Len=0 TSval=806015 TSecr=806015
140;;127.0.0.1;;127.0.0.1;TCP;[TCP segment of a reassembled PDU]
141;;127.0.0.1;;127.0.0.1;TCP;45680 → 8080 [ACK] Seq=198 Ack=73916 Win=465536 Len=0 TSval=806015 TSecr=806015
142;;127.0.0.1;;127.0.0.1;TCP;[TCP segment of a reassembled PDU]
143;;127.0.0.1;;127.0.0.1;TCP;45680 → 8080 [ACK] Seq=198 Ack=82108 Win=465536 Len=0 TSval=806015 TSecr=806015
144;;127.0.0.1;;127.0.0.1;HTTP;HTTP/1.0 200 OK  (text/csv)
145;;127.0.0.1;;127.0.0.1;TCP;45680 → 8080 [ACK] Seq=198 Ack=89176 Win=465536 Len=0 TSval=806015 TSecr=806015
146;;127.0.0.1;;127.0.0.1;TCP;8080 → 45680 [FIN, ACK] Seq=89176 Ack=198 Win=44800 Len=0 TSval=806015 TSecr=806015
147;;127.0.0.1;;127.0.0.1;TCP;45680 → 8080 [FIN, ACK] Seq=198 Ack=89177 Win=465536 Len=0 TSval=806015 TSecr=806015
148;;127.0.0.1;;127.0.0.1;TCP;8080 → 45680 [ACK] Seq=89177 Ack=199 Win=44800 Len=0 TSval=806015 TSecr=806015
149;;127.0.0.1;;127.0.0.1;TCP;45682 → 8080 [SYN] Seq=0 Win=43690 Len=0 MSS=65495 SACK_PERM=1 TSval=806065 TSecr=0 WS=128
150;;127.0.0.1;;127.0.0.1;TCP;8080 → 45682 [SYN, ACK] Seq=0 Ack=1 Win=43690 Len=0 MSS=65495 SACK_PERM=1 TSval=806065 TSecr=806065 WS=128
151;;127.0.0.1;;127.0.0.1;TCP;45682 → 8080 [ACK] Seq=1 Ack=1 Win=43776 Len=0 TSval=806065 TSecr=806065
152;;127.0.0.1;;127.0.0.1;HTTP;GET /capture_00001_20170304180024.csv HTTP/1.1 
153;;127.0.0.1;;127.0.0.1;TCP;8080 → 45682 [ACK] Seq=1 Ack=198 Win=44800 Len=0 TSval=806065 TSecr=806065
154;;127.0.0.1;;127.0.0.1;TCP;[TCP segment of a reassembled PDU]
155;;127.0.0.1;;127.0.0.1;TCP;45682 → 8080 [ACK] Seq=198 Ack=18 Win=43776 Len=0 TSval=806065 TSecr=806065
156;;127.0.0.1;;127.0.0.1;TCP;[TCP segment of a reassembled PDU]
157;;127.0.0.1;;127.0.0.1;TCP;45682 → 8080 [ACK] Seq=198 Ack=56 Win=43776 Len=0 TSval=806065 TSecr=806065
158;;127.0.0.1;;127.0.0.1;TCP;[TCP segment of a reassembled PDU]
159;;127.0.0.1;;127.0.0.1;TCP;45682 → 8080 [ACK] Seq=198 Ack=93 Win=43776 Len=0 TSval=806065 TSecr=806065
160;;127.0.0.1;;127.0.0.1;TCP;[TCP segment of a reassembled PDU]
161;;127.0.0.1;;127.0.0.1;TCP;45682 → 8080 [ACK] Seq=198 Ack=117 Win=43776 Len=0 TSval=806065 TSecr=806065
162;;127.0.0.1;;127.0.0.1;TCP;[TCP segment of a reassembled PDU]
163;;127.0.0.1;;127.0.0.1;TCP;45682 → 8080 [ACK] Seq=198 Ack=140 Win=43776 Len=0 TSval=806065 TSecr=806065
164;;127.0.0.1;;127.0.0.1;TCP;[TCP segment of a reassembled PDU]
165;;127.0.0.1;;127.0.0.1;TCP;45682 → 8080 [ACK] Seq=198 Ack=186 Win=43776 Len=0 TSval=806065 TSecr=806065
166;;127.0.0.1;;127.0.0.1;TCP;[TCP segment of a reassembled PDU]
167;;127.0.0.1;;127.0.0.1;TCP;45682 → 8080 [ACK] Seq=198 Ack=188 Win=43776 Len=0 TSval=806065 TSecr=806065
168;;127.0.0.1;;127.0.0.1;TCP;[TCP segment of a reassembled PDU]
169;;127.0.0.1;;127.0.0.1;TCP;45682 → 8080 [ACK] Seq=198 Ack=8380 Win=174720 Len=0 TSval=806065 TSecr=806065
170;;127.0.0.1;;127.0.0.1;TCP;[TCP segment of a reassembled PDU]
171;;127.0.0.1;;127.0.0.1;TCP;45682 → 8080 [ACK] Seq=198 Ack=16572 Win=305664 Len=0 TSval=806065 TSecr=806065
172;;127.0.0.1;;127.0.0.1;TCP;[TCP segment of a reassembled PDU]
173;;127.0.0.1;;127.0.0.1;TCP;45682 → 8080 [ACK] Seq=198 Ack=24764 Win=436608 Len=0 TSval=806065 TSecr=806065
174;;127.0.0.1;;127.0.0.1;TCP;[TCP segment of a reassembled PDU]
175;;127.0.0.1;;127.0.0.1;TCP;45682 → 8080 [ACK] Seq=198 Ack=32956 Win=465536 Len=0 TSval=806065 TSecr=806065
176;;127.0.0.1;;127.0.0.1;TCP;[TCP segment of a reassembled PDU]
177;;127.0.0.1;;127.0.0.1;TCP;45682 → 8080 [ACK] Seq=198 Ack=41148 Win=465536 Len=0 TSval=806065 TSecr=806065
178;;127.0.0.1;;127.0.0.1;TCP;[TCP segment of a reassembled PDU]
179;;127.0.0.1;;127.0.0.1;TCP;45682 → 8080 [ACK] Seq=198 Ack=49340 Win=465536 Len=0 TSval=806065 TSecr=806065
180;;127.0.0.1;;127.0.0.1;TCP;[TCP segment of a reassembled PDU]
181;;127.0.0.1;;127.0.0.1;TCP;45682 → 8080 [ACK] Seq=198 Ack=57532 Win=465536 Len=0 TSval=806065 TSecr=806065
182;;127.0.0.1;;127.0.0.1;TCP;[TCP segment of a reassembled PDU]
183;;127.0.0.1;;127.0.0.1;TCP;45682 → 8080 [ACK] Seq=198 Ack=65724 Win=465536 Len=0 TSval=806065 TSecr=806065
184;;127.0.0.1;;127.0.0.1;TCP;[TCP segment of a reassembled PDU]
185;;127.0.0.1;;127.0.0.1;TCP;45682 → 8080 [ACK] Seq=198 Ack=73916 Win=465536 Len=0 TSval=806065 TSecr=806065
186;;127.0.0.1;;127.0.0.1;TCP;[TCP segment of a reassembled PDU]
187;;127.0.0.1;;127.0.0.1;TCP;45682 → 8080 [ACK] Seq=198 Ack=82108 Win=465536 Len=0 TSval=806066 TSecr=806066
188;;127.0.0.1;;127.0.0.1;HTTP;HTTP/1.0 200 OK  (text/csv)
189;;127.0.0.1;;127.0.0.1;TCP;45682 → 8080 [ACK] Seq=198 Ack=89176 Win=465536 Len=0 TSval=806066 TSecr=806066
190;;127.0.0.1;;127.0.0.1;TCP;8080 → 45682 [FIN, ACK] Seq=89176 Ack=198 Win=44800 Len=0 TSval=806066 TSecr=806066
191;;127.0.0.1;;127.0.0.1;TCP;45682 → 8080 [FIN, ACK] Seq=198 Ack=89177 Win=465536 Len=0 TSval=806066 TSecr=806066
192;;127.0.0.1;;127.0.0.1;TCP;8080 → 45682 [ACK] Seq=89177 Ack=199 Win=44800 Len=0 TSval=806066 TSecr=806066
193;;127.0.0.1;;127.0.0.1;TCP;45684 → 8080 [SYN] Seq=0 Win=43690 Len=0 MSS=65495 SACK_PERM=1 TSval=806115 TSecr=0 WS=128
194;;127.0.0.1;;127.0.0.1;TCP;8080 → 45684 [SYN, ACK] Seq=0 Ack=1 Win=43690 Len=0 MSS=65495 SACK_PERM=1 TSval=806115 TSecr=806115 WS=128
195;;127.0.0.1;;127.0.0.1;TCP;45684 → 8080 [ACK] Seq=1 Ack=1 Win=43776 Len=0 TSval=806115 TSecr=806115
196;;127.0.0.1;;127.0.0.1;HTTP;GET /capture_00001_20170304180024.csv HTTP/1.1 
197;;127.0.0.1;;127.0.0.1;TCP;8080 → 45684 [ACK] Seq=1 Ack=198 Win=44800 Len=0 TSval=806115 TSecr=806115
198;;127.0.0.1;;127.0.0.1;TCP;[TCP segment of a reassembled PDU]
199;;127.0.0.1;;127.0.0.1;TCP;45684 → 8080 [ACK] Seq=198 Ack=18 Win=43776 Len=0 TSval=806115 TSecr=806115
200;;127.0.0.1;;127.0.0.1;TCP;[TCP segment of a reassembled PDU]
201;;127.0.0.1;;127.0.0.1;TCP;45684 → 8080 [ACK] Seq=198 Ack=56 Win=43776 Len=0 TSval=806115 TSecr=806115
202;;127.0.0.1;;127.0.0.1;TCP;[TCP segment of a reassembled PDU]
203;;127.0.0.1;;127.0.0.1;TCP;45684 → 8080 [ACK] Seq=198 Ack=93 Win=43776 Len=0 TSval=806115 TSecr=806115
204;;127.0.0.1;;127.0.0.1;TCP;[TCP segment of a reassembled PDU]
205;;127.0.0.1;;127.0.0.1;TCP;45684 → 8080 [ACK] Seq=198 Ack=117 Win=43776 Len=0 TSval=806115 TSecr=806115
206;;127.0.0.1;;127.0.0.1;TCP;[TCP segment of a reassembled PDU]
207;;127.0.0.1;;127.0.0.1;TCP;45684 → 8080 [ACK] Seq=198 Ack=140 Win=43776 Len=0 TSval=806115 TSecr=806115
208;;127.0.0.1;;127.0.0.1;TCP;[TCP segment of a reassembled PDU]
209;;127.0.0.1;;127.0.0.1;TCP;45684 → 8080 [ACK] Seq=198 Ack=186 Win=43776 Len=0 TSval=806115 TSecr=806115
210;;127.0.0.1;;127.0.0.1;TCP;[TCP segment of a reassembled PDU]
211;;127.0.0.1;;127.0.0.1;TCP;45684 → 8080 [ACK] Seq=198 Ack=188 Win=43776 Len=0 TSval=806115 TSecr=806115
212;;127.0.0.1;;127.0.0.1;TCP;[TCP segment of a reassembled PDU]
213;;127.0.0.1;;127.0.0.1;TCP;45684 → 8080 [ACK] Seq=198 Ack=8380 Win=174720 Len=0 TSval=806115 TSecr=806115
214;;127.0.0.1;;127.0.0.1;TCP;[TCP segment of a reassembled PDU]
215;;127.0.0.1;;127.0.0.1;TCP;45684 → 8080 [ACK] Seq=198 Ack=16572 Win=305664 Len=0 TSval=806115 TSecr=806115
216;;127.0.0.1;;127.0.0.1;TCP;[TCP segment of a reassembled PDU]
217;;127.0.0.1;;127.0.0.1;TCP;45684 → 8080 [ACK] Seq=198 Ack=24764 Win=436608 Len=0 TSval=806115 TSecr=806115
218;;127.0.0.1;;127.0.0.1;TCP;[TCP segment of a reassembled PDU]
219;;127.0.0.1;;127.0.0.1;TCP;45684 → 8080 [ACK] Seq=198 Ack=32956 Win=465536 Len=0 TSval=806115 TSecr=806115
220;;127.0.0.1;;127.0.0.1;TCP;[TCP segment of a reassembled PDU]
221;;127.0.0.1;;127.0.0.1;TCP;45684 → 8080 [ACK] Seq=198 Ack=41148 Win=465536 Len=0 TSval=806115 TSecr=806115
222;;127.0.0.1;;127.0.0.1;TCP;[TCP segment of a reassembled PDU]
223;;127.0.0.1;;127.0.0.1;TCP;45684 → 8080 [ACK] Seq=198 Ack=49340 Win=465536 Len=0 TSval=806115 TSecr=806115
224;;127.0.0.1;;127.0.0.1;TCP;[TCP segment of a reassembled PDU]
225;;127.0.0.1;;127.0.0.1;TCP;45684 → 8080 [ACK] Seq=198 Ack=57532 Win=465536 Len=0 TSval=806115 TSecr=806115
226;;127.0.0.1;;127.0.0.1;TCP;[TCP segment of a reassembled PDU]
227;;127.0.0.1;;127.0.0.1;TCP;45684 → 8080 [ACK] Seq=198 Ack=65724 Win=465536 Len=0 TSval=806115 TSecr=806115
228;;127.0.0.1;;127.0.0.1;TCP;[TCP segment of a reassembled PDU]
229;;127.0.0.1;;127.0.0.1;TCP;45684 → 8080 [ACK] Seq=198 Ack=73916 Win=465536 Len=0 TSval=806115 TSecr=806115
230;;127.0.0.1;;127.0.0.1;TCP;[TCP segment of a reassembled PDU]
231;;127.0.0.1;;127.0.0.1;TCP;45684 → 8080 [ACK] Seq=198 Ack=82108 Win=465536 Len=0 TSval=806115 TSecr=806115
232;;127.0.0.1;;127.0.0.1;HTTP;HTTP/1.0 200 OK  (text/csv)
233;;127.0.0.1;;127.0.0.1;TCP;45684 → 8080 [ACK] Seq=198 Ack=89176 Win=465536 Len=0 TSval=806115 TSecr=806115
234;;127.0.0.1;;127.0.0.1;TCP;8080 → 45684 [FIN, ACK] Seq=89176 Ack=198 Win=44800 Len=0 TSval=806115 TSecr=806115
235;;127.0.0.1;;127.0.0.1;TCP;45684 → 8080 [FIN, ACK] Seq=198 Ack=89177 Win=465536 Len=0 TSval=806115 TSecr=806115
236;;127.0.0.1;;127.0.0.1;TCP;8080 → 45684 [ACK] Seq=89177 Ack=199 Win=44800 Len=0 TSval=806115 TSecr=806115
237;;127.0.0.1;;127.0.0.1;TCP;7687 → 41592 [PSH, ACK] Seq=1 Ack=1 Win=1382 Len=585 TSval=806141 TSecr=805837
238;;127.0.0.1;;127.0.0.1;TCP;41592 → 7687 [FIN, ACK] Seq=1 Ack=586 Win=377 Len=0 TSval=806141 TSecr=806141
239;;127.0.0.1;;127.0.0.1;TCP;7687 → 41592 [FIN, ACK] Seq=586 Ack=2 Win=1382 Len=0 TSval=806141 TSecr=806141
240;;127.0.0.1;;127.0.0.1;TCP;41592 → 7687 [ACK] Seq=2 Ack=587 Win=377 Len=0 TSval=806141 TSecr=806141
241;;127.0.0.1;;127.0.0.1;TCP;48472 → 8000 [SYN] Seq=0 Win=43690 Len=0 MSS=65495 SACK_PERM=1 TSval=808664 TSecr=0 WS=128
242;;127.0.0.1;;127.0.0.1;TCP;8000 → 48472 [SYN, ACK] Seq=0 Ack=1 Win=43690 Len=0 MSS=65495 SACK_PERM=1 TSval=808664 TSecr=808664 WS=128
243;;127.0.0.1;;127.0.0.1;TCP;48472 → 8000 [ACK] Seq=1 Ack=1 Win=43776 Len=0 TSval=808664 TSecr=808664
244;;127.0.0.1;;127.0.0.1;HTTP;GET / HTTP/1.1 
245;;127.0.0.1;;127.0.0.1;TCP;8000 → 48472 [ACK] Seq=1 Ack=456 Win=44800 Len=0 TSval=808664 TSecr=808664
246;;127.0.0.1;;127.0.0.1;TCP;[TCP segment of a reassembled PDU]
247;;127.0.0.1;;127.0.0.1;TCP;48472 → 8000 [ACK] Seq=456 Ack=18 Win=43776 Len=0 TSval=808664 TSecr=808664
248;;127.0.0.1;;127.0.0.1;TCP;[TCP segment of a reassembled PDU]
249;;127.0.0.1;;127.0.0.1;TCP;48472 → 8000 [ACK] Seq=456 Ack=56 Win=43776 Len=0 TSval=808664 TSecr=808664
250;;127.0.0.1;;127.0.0.1;TCP;[TCP segment of a reassembled PDU]
251;;127.0.0.1;;127.0.0.1;TCP;48472 → 8000 [ACK] Seq=456 Ack=93 Win=43776 Len=0 TSval=808664 TSecr=808664
252;;127.0.0.1;;127.0.0.1;TCP;[TCP segment of a reassembled PDU]
253;;127.0.0.1;;127.0.0.1;TCP;48472 → 8000 [ACK] Seq=456 Ack=118 Win=43776 Len=0 TSval=808664 TSecr=808664
254;;127.0.0.1;;127.0.0.1;TCP;[TCP segment of a reassembled PDU]
255;;127.0.0.1;;127.0.0.1;TCP;48472 → 8000 [ACK] Seq=456 Ack=140 Win=43776 Len=0 TSval=808664 TSecr=808664
256;;127.0.0.1;;127.0.0.1;TCP;[TCP segment of a reassembled PDU]
257;;127.0.0.1;;127.0.0.1;TCP;48472 → 8000 [ACK] Seq=456 Ack=186 Win=43776 Len=0 TSval=808664 TSecr=808664
258;;127.0.0.1;;127.0.0.1;TCP;[TCP segment of a reassembled PDU]
259;;127.0.0.1;;127.0.0.1;TCP;48472 → 8000 [ACK] Seq=456 Ack=188 Win=43776 Len=0 TSval=808664 TSecr=808664
260;;127.0.0.1;;127.0.0.1;HTTP;HTTP/1.0 200 OK  (text/html)
261;;127.0.0.1;;127.0.0.1;TCP;48472 → 8000 [ACK] Seq=456 Ack=4960 Win=174720 Len=0 TSval=808664 TSecr=808664
262;;127.0.0.1;;127.0.0.1;TCP;8000 → 48472 [FIN, ACK] Seq=4960 Ack=456 Win=44800 Len=0 TSval=808664 TSecr=808664
263;;127.0.0.1;;127.0.0.1;TCP;48472 → 8000 [FIN, ACK] Seq=456 Ack=4961 Win=174720 Len=0 TSval=808664 TSecr=808664
264;;127.0.0.1;;127.0.0.1;TCP;8000 → 48472 [ACK] Seq=4961 Ack=457 Win=44800 Len=0 TSval=808664 TSecr=808664
265;;127.0.0.1;;127.0.0.1;DNS;Standard query 0x10a5 A ntp.ubuntu.com
266;;127.0.0.1,127.0.0.1;;127.0.0.1,127.0.0.1;ICMP;Destination unreachable (Port unreachable)
267;;127.0.0.1;;127.0.0.1;DNS;Standard query 0x3d2a AAAA ntp.ubuntu.com
268;;127.0.0.1,127.0.0.1;;127.0.0.1,127.0.0.1;ICMP;Destination unreachable (Port unreachable)
269;;127.0.0.1;;127.0.0.1;DNS;Standard query 0x10a5 A ntp.ubuntu.com
270;;127.0.0.1,127.0.0.1;;127.0.0.1,127.0.0.1;ICMP;Destination unreachable (Port unreachable)
271;;127.0.0.1;;127.0.0.1;DNS;Standard query 0x3d2a AAAA ntp.ubuntu.com
272;;127.0.0.1,127.0.0.1;;127.0.0.1,127.0.0.1;ICMP;Destination unreachable (Port unreachable)
273;;127.0.0.1;;127.0.0.1;DNS;Standard query 0xd553 A ntp.ubuntu.com
274;;127.0.0.1,127.0.0.1;;127.0.0.1,127.0.0.1;ICMP;Destination unreachable (Port unreachable)
275;;127.0.0.1;;127.0.0.1;DNS;Standard query 0x8f81 AAAA ntp.ubuntu.com
276;;127.0.0.1,127.0.0.1;;127.0.0.1,127.0.0.1;ICMP;Destination unreachable (Port unreachable)
277;;127.0.0.1;;127.0.0.1;DNS;Standard query 0xd553 A ntp.ubuntu.com
278;;127.0.0.1,127.0.0.1;;127.0.0.1,127.0.0.1;ICMP;Destination unreachable (Port unreachable)
279;;127.0.0.1;;127.0.0.1;DNS;Standard query 0x8f81 AAAA ntp.ubuntu.com
280;;127.0.0.1,127.0.0.1;;127.0.0.1,127.0.0.1;ICMP;Destination unreachable (Port unreachable)
281;;127.0.0.1;;127.0.0.1;DNS;Standard query 0x0240 A ntp.ubuntu.com
282;;127.0.0.1,127.0.0.1;;127.0.0.1,127.0.0.1;ICMP;Destination unreachable (Port unreachable)
283;;127.0.0.1;;127.0.0.1;DNS;Standard query 0xaf01 AAAA ntp.ubuntu.com
284;;127.0.0.1,127.0.0.1;;127.0.0.1,127.0.0.1;ICMP;Destination unreachable (Port unreachable)
285;;127.0.0.1;;127.0.0.1;DNS;Standard query 0x0240 A ntp.ubuntu.com
286;;127.0.0.1,127.0.0.1;;127.0.0.1,127.0.0.1;ICMP;Destination unreachable (Port unreachable)
287;;127.0.0.1;;127.0.0.1;DNS;Standard query 0xaf01 AAAA ntp.ubuntu.com
288;;127.0.0.1,127.0.0.1;;127.0.0.1,127.0.0.1;ICMP;Destination unreachable (Port unreachable)
289;;127.0.0.1;;127.0.0.1;DNS;Standard query 0xfc24 A ntp.ubuntu.com
290;;127.0.0.1,127.0.0.1;;127.0.0.1,127.0.0.1;ICMP;Destination unreachable (Port unreachable)
291;;127.0.0.1;;127.0.0.1;DNS;Standard query 0x7a4a AAAA ntp.ubuntu.com
292;;127.0.0.1,127.0.0.1;;127.0.0.1,127.0.0.1;ICMP;Destination unreachable (Port unreachable)
293;;127.0.0.1;;127.0.0.1;DNS;Standard query 0xfc24 A ntp.ubuntu.com
294;;127.0.0.1,127.0.0.1;;127.0.0.1,127.0.0.1;ICMP;Destination unreachable (Port unreachable)
295;;127.0.0.1;;127.0.0.1;DNS;Standard query 0x7a4a AAAA ntp.ubuntu.com
296;;127.0.0.1,127.0.0.1;;127.0.0.1,127.0.0.1;ICMP;Destination unreachable (Port unreachable)
297;;127.0.0.1;;127.0.0.1;DNS;Standard query 0x68aa A ntp.ubuntu.com
298;;127.0.0.1,127.0.0.1;;127.0.0.1,127.0.0.1;ICMP;Destination unreachable (Port unreachable)
299;;127.0.0.1;;127.0.0.1;DNS;Standard query 0xc50d AAAA ntp.ubuntu.com
300;;127.0.0.1,127.0.0.1;;127.0.0.1,127.0.0.1;ICMP;Destination unreachable (Port unreachable)
301;;127.0.0.1;;127.0.0.1;DNS;Standard query 0x68aa A ntp.ubuntu.com
302;;127.0.0.1,127.0.0.1;;127.0.0.1,127.0.0.1;ICMP;Destination unreachable (Port unreachable)
303;;127.0.0.1;;127.0.0.1;DNS;Standard query 0xc50d AAAA ntp.ubuntu.com
304;;127.0.0.1,127.0.0.1;;127.0.0.1,127.0.0.1;ICMP;Destination unreachable (Port unreachable)
305;;127.0.0.1;;127.0.0.1;DNS;Standard query 0xcb2f A ntp.ubuntu.com
306;;127.0.0.1,127.0.0.1;;127.0.0.1,127.0.0.1;ICMP;Destination unreachable (Port unreachable)
307;;127.0.0.1;;127.0.0.1;DNS;Standard query 0x4154 AAAA ntp.ubuntu.com
308;;127.0.0.1,127.0.0.1;;127.0.0.1,127.0.0.1;ICMP;Destination unreachable (Port unreachable)
309;;127.0.0.1;;127.0.0.1;DNS;Standard query 0xcb2f A ntp.ubuntu.com
310;;127.0.0.1,127.0.0.1;;127.0.0.1,127.0.0.1;ICMP;Destination unreachable (Port unreachable)
311;;127.0.0.1;;127.0.0.1;DNS;Standard query 0x4154 AAAA ntp.ubuntu.com
312;;127.0.0.1,127.0.0.1;;127.0.0.1,127.0.0.1;ICMP;Destination unreachable (Port unreachable)
313;;127.0.0.1;;127.0.0.1;DNS;Standard query 0x5317 A ntp.ubuntu.com
314;;127.0.0.1,127.0.0.1;;127.0.0.1,127.0.0.1;ICMP;Destination unreachable (Port unreachable)
315;;127.0.0.1;;127.0.0.1;DNS;Standard query 0xf1dd AAAA ntp.ubuntu.com
316;;127.0.0.1,127.0.0.1;;127.0.0.1,127.0.0.1;ICMP;Destination unreachable (Port unreachable)
317;;127.0.0.1;;127.0.0.1;DNS;Standard query 0x5317 A ntp.ubuntu.com
318;;127.0.0.1,127.0.0.1;;127.0.0.1,127.0.0.1;ICMP;Destination unreachable (Port unreachable)
319;;127.0.0.1;;127.0.0.1;DNS;Standard query 0xf1dd AAAA ntp.ubuntu.com
320;;127.0.0.1,127.0.0.1;;127.0.0.1,127.0.0.1;ICMP;Destination unreachable (Port unreachable)
321;;127.0.0.1;;127.0.0.1;DNS;Standard query 0x8b2e A ntp.ubuntu.com
322;;127.0.0.1,127.0.0.1;;127.0.0.1,127.0.0.1;ICMP;Destination unreachable (Port unreachable)
323;;127.0.0.1;;127.0.0.1;DNS;Standard query 0xb581 AAAA ntp.ubuntu.com
324;;127.0.0.1,127.0.0.1;;127.0.0.1,127.0.0.1;ICMP;Destination unreachable (Port unreachable)
325;;127.0.0.1;;127.0.0.1;DNS;Standard query 0x8b2e A ntp.ubuntu.com
326;;127.0.0.1,127.0.0.1;;127.0.0.1,127.0.0.1;ICMP;Destination unreachable (Port unreachable)
327;;127.0.0.1;;127.0.0.1;DNS;Standard query 0xb581 AAAA ntp.ubuntu.com
328;;127.0.0.1,127.0.0.1;;127.0.0.1,127.0.0.1;ICMP;Destination unreachable (Port unreachable)
329;;127.0.0.1;;127.0.0.1;DNS;Standard query 0xd76b A ntp.ubuntu.com
330;;127.0.0.1,127.0.0.1;;127.0.0.1,127.0.0.1;ICMP;Destination unreachable (Port unreachable)
331;;127.0.0.1;;127.0.0.1;DNS;Standard query 0x9d59 AAAA ntp.ubuntu.com
332;;127.0.0.1,127.0.0.1;;127.0.0.1,127.0.0.1;ICMP;Destination unreachable (Port unreachable)
333;;127.0.0.1;;127.0.0.1;DNS;Standard query 0xd76b A ntp.ubuntu.com
334;;127.0.0.1,127.0.0.1;;127.0.0.1,127.0.0.1;ICMP;Destination unreachable (Port unreachable)
335;;127.0.0.1;;127.0.0.1;DNS;Standard query 0x9d59 AAAA ntp.ubuntu.com
336;;127.0.0.1,127.0.0.1;;127.0.0.1,127.0.0.1;ICMP;Destination unreachable (Port unreachable)
337;;127.0.0.1;;127.0.0.1;DNS;Standard query 0xf3c4 A ntp.ubuntu.com
338;;127.0.0.1,127.0.0.1;;127.0.0.1,127.0.0.1;ICMP;Destination unreachable (Port unreachable)
339;;127.0.0.1;;127.0.0.1;DNS;Standard query 0xbd32 AAAA ntp.ubuntu.com
340;;127.0.0.1,127.0.0.1;;127.0.0.1,127.0.0.1;ICMP;Destination unreachable (Port unreachable)
341;;127.0.0.1;;127.0.0.1;DNS;Standard query 0xf3c4 A ntp.ubuntu.com
342;;127.0.0.1,127.0.0.1;;127.0.0.1,127.0.0.1;ICMP;Destination unreachable (Port unreachable)
343;;127.0.0.1;;127.0.0.1;DNS;Standard query 0xbd32 AAAA ntp.ubuntu.com
344;;127.0.0.1,127.0.0.1;;127.0.0.1,127.0.0.1;ICMP;Destination unreachable (Port unreachable)
345;;127.0.0.1;;127.0.0.1;DNS;Standard query 0x9b37 A ntp.ubuntu.com
346;;127.0.0.1,127.0.0.1;;127.0.0.1,127.0.0.1;ICMP;Destination unreachable (Port unreachable)
347;;127.0.0.1;;127.0.0.1;DNS;Standard query 0x0d40 AAAA ntp.ubuntu.com
348;;127.0.0.1,127.0.0.1;;127.0.0.1,127.0.0.1;ICMP;Destination unreachable (Port unreachable)
349;;127.0.0.1;;127.0.0.1;DNS;Standard query 0x9b37 A ntp.ubuntu.com
350;;127.0.0.1,127.0.0.1;;127.0.0.1,127.0.0.1;ICMP;Destination unreachable (Port unreachable)
351;;127.0.0.1;;127.0.0.1;DNS;Standard query 0x0d40 AAAA ntp.ubuntu.com
352;;127.0.0.1,127.0.0.1;;127.0.0.1,127.0.0.1;ICMP;Destination unreachable (Port unreachable)
353;;127.0.0.1;;127.0.0.1;DNS;Standard query 0xa7bc A ntp.ubuntu.com
354;;127.0.0.1,127.0.0.1;;127.0.0.1,127.0.0.1;ICMP;Destination unreachable (Port unreachable)
355;;127.0.0.1;;127.0.0.1;DNS;Standard query 0x913b AAAA ntp.ubuntu.com
356;;127.0.0.1,127.0.0.1;;127.0.0.1,127.0.0.1;ICMP;Destination unreachable (Port unreachable)
357;;127.0.0.1;;127.0.0.1;DNS;Standard query 0xa7bc A ntp.ubuntu.com
358;;127.0.0.1,127.0.0.1;;127.0.0.1,127.0.0.1;ICMP;Destination unreachable (Port unreachable)
359;;127.0.0.1;;127.0.0.1;DNS;Standard query 0x913b AAAA ntp.ubuntu.com
360;;127.0.0.1,127.0.0.1;;127.0.0.1,127.0.0.1;ICMP;Destination unreachable (Port unreachable)
361;;127.0.0.1;;127.0.0.1;DNS;Standard query 0x0b2e A ntp.ubuntu.com
362;;127.0.0.1,127.0.0.1;;127.0.0.1,127.0.0.1;ICMP;Destination unreachable (Port unreachable)
363;;127.0.0.1;;127.0.0.1;DNS;Standard query 0xed23 AAAA ntp.ubuntu.com
364;;127.0.0.1,127.0.0.1;;127.0.0.1,127.0.0.1;ICMP;Destination unreachable (Port unreachable)
365;;127.0.0.1;;127.0.0.1;DNS;Standard query 0x0b2e A ntp.ubuntu.com
366;;127.0.0.1,127.0.0.1;;127.0.0.1,127.0.0.1;ICMP;Destination unreachable (Port unreachable)
367;;127.0.0.1;;127.0.0.1;DNS;Standard query 0xed23 AAAA ntp.ubuntu.com
368;;127.0.0.1,127.0.0.1;;127.0.0.1,127.0.0.1;ICMP;Destination unreachable (Port unreachable)
369;;127.0.0.1;;127.0.0.1;DNS;Standard query 0xe786 A ntp.ubuntu.com
370;;127.0.0.1,127.0.0.1;;127.0.0.1,127.0.0.1;ICMP;Destination unreachable (Port unreachable)
371;;127.0.0.1;;127.0.0.1;DNS;Standard query 0x21ec AAAA ntp.ubuntu.com
372;;127.0.0.1,127.0.0.1;;127.0.0.1,127.0.0.1;ICMP;Destination unreachable (Port unreachable)
373;;127.0.0.1;;127.0.0.1;DNS;Standard query 0xe786 A ntp.ubuntu.com
374;;127.0.0.1,127.0.0.1;;127.0.0.1,127.0.0.1;ICMP;Destination unreachable (Port unreachable)
375;;127.0.0.1;;127.0.0.1;DNS;Standard query 0x21ec AAAA ntp.ubuntu.com
376;;127.0.0.1,127.0.0.1;;127.0.0.1,127.0.0.1;ICMP;Destination unreachable (Port unreachable)
377;;127.0.0.1;;127.0.0.1;DNS;Standard query 0x8bdd A ntp.ubuntu.com
378;;127.0.0.1,127.0.0.1;;127.0.0.1,127.0.0.1;ICMP;Destination unreachable (Port unreachable)
379;;127.0.0.1;;127.0.0.1;DNS;Standard query 0xa5d2 AAAA ntp.ubuntu.com
380;;127.0.0.1,127.0.0.1;;127.0.0.1,127.0.0.1;ICMP;Destination unreachable (Port unreachable)
381;;127.0.0.1;;127.0.0.1;DNS;Standard query 0x8bdd A ntp.ubuntu.com
382;;127.0.0.1,127.0.0.1;;127.0.0.1,127.0.0.1;ICMP;Destination unreachable (Port unreachable)
383;;127.0.0.1;;127.0.0.1;DNS;Standard query 0xa5d2 AAAA ntp.ubuntu.com
384;;127.0.0.1,127.0.0.1;;127.0.0.1,127.0.0.1;ICMP;Destination unreachable (Port unreachable)
385;;127.0.0.1;;127.0.0.1;DNS;Standard query 0xdf47 A ntp.ubuntu.com
386;;127.0.0.1,127.0.0.1;;127.0.0.1,127.0.0.1;ICMP;Destination unreachable (Port unreachable)
387;;127.0.0.1;;127.0.0.1;DNS;Standard query 0x6dbf AAAA ntp.ubuntu.com
388;;127.0.0.1,127.0.0.1;;127.0.0.1,127.0.0.1;ICMP;Destination unreachable (Port unreachable)
389;;127.0.0.1;;127.0.0.1;DNS;Standard query 0xdf47 A ntp.ubuntu.com
390;;127.0.0.1,127.0.0.1;;127.0.0.1,127.0.0.1;ICMP;Destination unreachable (Port unreachable)
391;;127.0.0.1;;127.0.0.1;DNS;Standard query 0x6dbf AAAA ntp.ubuntu.com
392;;127.0.0.1,127.0.0.1;;127.0.0.1,127.0.0.1;ICMP;Destination unreachable (Port unreachable)
393;;127.0.0.1;;127.0.0.1;DNS;Standard query 0x2fc3 A ntp.ubuntu.com
394;;127.0.0.1,127.0.0.1;;127.0.0.1,127.0.0.1;ICMP;Destination unreachable (Port unreachable)
395;;127.0.0.1;;127.0.0.1;DNS;Standard query 0x49ca AAAA ntp.ubuntu.com
396;;127.0.0.1,127.0.0.1;;127.0.0.1,127.0.0.1;ICMP;Destination unreachable (Port unreachable)
397;;127.0.0.1;;127.0.0.1;DNS;Standard query 0x2fc3 A ntp.ubuntu.com
398;;127.0.0.1,127.0.0.1;;127.0.0.1,127.0.0.1;ICMP;Destination unreachable (Port unreachable)
399;;127.0.0.1;;127.0.0.1;DNS;Standard query 0x49ca AAAA ntp.ubuntu.com
400;;127.0.0.1,127.0.0.1;;127.0.0.1,127.0.0.1;ICMP;Destination unreachable (Port unreachable)
401;;127.0.0.1;;127.0.0.1;DNS;Standard query 0x4340 A ntp.ubuntu.com
402;;127.0.0.1,127.0.0.1;;127.0.0.1,127.0.0.1;ICMP;Destination unreachable (Port unreachable)
403;;127.0.0.1;;127.0.0.1;DNS;Standard query 0x91b8 AAAA ntp.ubuntu.com
404;;127.0.0.1,127.0.0.1;;127.0.0.1,127.0.0.1;ICMP;Destination unreachable (Port unreachable)
405;;127.0.0.1;;127.0.0.1;DNS;Standard query 0x4340 A ntp.ubuntu.com
406;;127.0.0.1,127.0.0.1;;127.0.0.1,127.0.0.1;ICMP;Destination unreachable (Port unreachable)
407;;127.0.0.1;;127.0.0.1;DNS;Standard query 0x91b8 AAAA ntp.ubuntu.com
408;;127.0.0.1,127.0.0.1;;127.0.0.1,127.0.0.1;ICMP;Destination unreachable (Port unreachable)
409;;127.0.0.1;;127.0.0.1;DNS;Standard query 0xe3da A ntp.ubuntu.com
410;;127.0.0.1,127.0.0.1;;127.0.0.1,127.0.0.1;ICMP;Destination unreachable (Port unreachable)
411;;127.0.0.1;;127.0.0.1;DNS;Standard query 0x7d00 AAAA ntp.ubuntu.com
412;;127.0.0.1,127.0.0.1;;127.0.0.1,127.0.0.1;ICMP;Destination unreachable (Port unreachable)
413;;127.0.0.1;;127.0.0.1;DNS;Standard query 0xe3da A ntp.ubuntu.com
414;;127.0.0.1,127.0.0.1;;127.0.0.1,127.0.0.1;ICMP;Destination unreachable (Port unreachable)
415;;127.0.0.1;;127.0.0.1;DNS;Standard query 0x7d00 AAAA ntp.ubuntu.com
416;;127.0.0.1,127.0.0.1;;127.0.0.1,127.0.0.1;ICMP;Destination unreachable (Port unreachable)
417;;127.0.0.1;;127.0.0.1;DNS;Standard query 0xa7a0 A ntp.ubuntu.com
418;;127.0.0.1,127.0.0.1;;127.0.0.1,127.0.0.1;ICMP;Destination unreachable (Port unreachable)
419;;127.0.0.1;;127.0.0.1;DNS;Standard query 0xed42 AAAA ntp.ubuntu.com
420;;127.0.0.1,127.0.0.1;;127.0.0.1,127.0.0.1;ICMP;Destination unreachable (Port unreachable)
421;;127.0.0.1;;127.0.0.1;DNS;Standard query 0xa7a0 A ntp.ubuntu.com
422;;127.0.0.1,127.0.0.1;;127.0.0.1,127.0.0.1;ICMP;Destination unreachable (Port unreachable)
423;;127.0.0.1;;127.0.0.1;DNS;Standard query 0xed42 AAAA ntp.ubuntu.com
424;;127.0.0.1,127.0.0.1;;127.0.0.1,127.0.0.1;ICMP;Destination unreachable (Port unreachable)
425;;127.0.0.1;;127.0.0.1;TCP;41610 → 7687 [SYN] Seq=0 Win=43690 Len=0 MSS=65495 SACK_PERM=1 TSval=813716 TSecr=0 WS=128
426;;127.0.0.1;;127.0.0.1;TCP;7687 → 41610 [SYN, ACK] Seq=0 Ack=1 Win=43690 Len=0 MSS=65495 SACK_PERM=1 TSval=813716 TSecr=813716 WS=128
427;;127.0.0.1;;127.0.0.1;TCP;41610 → 7687 [ACK] Seq=1 Ack=1 Win=43776 Len=0 TSval=813716 TSecr=813716
428;;127.0.0.1;;127.0.0.1;TCP;41610 → 7687 [PSH, ACK] Seq=1 Ack=1 Win=43776 Len=517 TSval=813716 TSecr=813716
429;;127.0.0.1;;127.0.0.1;TCP;7687 → 41610 [ACK] Seq=1 Ack=518 Win=44800 Len=0 TSval=813716 TSecr=813716
430;;127.0.0.1;;127.0.0.1;TCP;7687 → 41610 [PSH, ACK] Seq=1 Ack=518 Win=44800 Len=1120 TSval=813719 TSecr=813716
431;;127.0.0.1;;127.0.0.1;TCP;41610 → 7687 [ACK] Seq=518 Ack=1121 Win=45952 Len=0 TSval=813719 TSecr=813719
432;;127.0.0.1;;127.0.0.1;TCP;41610 → 7687 [PSH, ACK] Seq=518 Ack=1121 Win=45952 Len=126 TSval=813719 TSecr=813719
433;;127.0.0.1;;127.0.0.1;TCP;7687 → 41610 [PSH, ACK] Seq=1121 Ack=644 Win=44800 Len=51 TSval=813719 TSecr=813719
434;;127.0.0.1;;127.0.0.1;TCP;41610 → 7687 [PSH, ACK] Seq=644 Ack=1172 Win=45952 Len=49 TSval=813719 TSecr=813719
435;;127.0.0.1;;127.0.0.1;TCP;7687 → 41610 [PSH, ACK] Seq=1172 Ack=693 Win=44800 Len=33 TSval=813720 TSecr=813719
436;;127.0.0.1;;127.0.0.1;TCP;41610 → 7687 [PSH, ACK] Seq=693 Ack=1205 Win=45952 Len=108 TSval=813720 TSecr=813720
437;;127.0.0.1;;127.0.0.1;TCP;7687 → 41610 [PSH, ACK] Seq=1205 Ack=801 Win=44800 Len=55 TSval=813720 TSecr=813720
438;;127.0.0.1;;127.0.0.1;TCP;41610 → 7687 [PSH, ACK] Seq=801 Ack=1260 Win=45952 Len=287 TSval=813720 TSecr=813720
439;;127.0.0.1;;127.0.0.1;TCP;45690 → 8080 [SYN] Seq=0 Win=43690 Len=0 MSS=65495 SACK_PERM=1 TSval=813725 TSecr=0 WS=128
440;;127.0.0.1;;127.0.0.1;TCP;8080 → 45690 [SYN, ACK] Seq=0 Ack=1 Win=43690 Len=0 MSS=65495 SACK_PERM=1 TSval=813725 TSecr=813725 WS=128
441;;127.0.0.1;;127.0.0.1;TCP;45690 → 8080 [ACK] Seq=1 Ack=1 Win=43776 Len=0 TSval=813725 TSecr=813725
442;;127.0.0.1;;127.0.0.1;HTTP;GET /capture_00003_20170304180058.csv HTTP/1.1 
443;;127.0.0.1;;127.0.0.1;TCP;8080 → 45690 [ACK] Seq=1 Ack=198 Win=44800 Len=0 TSval=813725 TSecr=813725
444;;127.0.0.1;;127.0.0.1;TCP;[TCP segment of a reassembled PDU]
445;;127.0.0.1;;127.0.0.1;TCP;45690 → 8080 [ACK] Seq=198 Ack=18 Win=43776 Len=0 TSval=813725 TSecr=813725
446;;127.0.0.1;;127.0.0.1;TCP;[TCP segment of a reassembled PDU]
447;;127.0.0.1;;127.0.0.1;TCP;45690 → 8080 [ACK] Seq=198 Ack=56 Win=43776 Len=0 TSval=813725 TSecr=813725
448;;127.0.0.1;;127.0.0.1;TCP;[TCP segment of a reassembled PDU]
449;;127.0.0.1;;127.0.0.1;TCP;45690 → 8080 [ACK] Seq=198 Ack=93 Win=43776 Len=0 TSval=813725 TSecr=813725
450;;127.0.0.1;;127.0.0.1;TCP;[TCP segment of a reassembled PDU]
451;;127.0.0.1;;127.0.0.1;TCP;45690 → 8080 [ACK] Seq=198 Ack=117 Win=43776 Len=0 TSval=813725 TSecr=813725
452;;127.0.0.1;;127.0.0.1;TCP;[TCP segment of a reassembled PDU]
453;;127.0.0.1;;127.0.0.1;TCP;45690 → 8080 [ACK] Seq=198 Ack=140 Win=43776 Len=0 TSval=813725 TSecr=813725
454;;127.0.0.1;;127.0.0.1;TCP;[TCP segment of a reassembled PDU]
455;;127.0.0.1;;127.0.0.1;TCP;45690 → 8080 [ACK] Seq=198 Ack=186 Win=43776 Len=0 TSval=813725 TSecr=813725
456;;127.0.0.1;;127.0.0.1;TCP;[TCP segment of a reassembled PDU]
457;;127.0.0.1;;127.0.0.1;TCP;45690 → 8080 [ACK] Seq=198 Ack=188 Win=43776 Len=0 TSval=813725 TSecr=813725
458;;127.0.0.1;;127.0.0.1;TCP;[TCP segment of a reassembled PDU]
459;;127.0.0.1;;127.0.0.1;TCP;45690 → 8080 [ACK] Seq=198 Ack=8380 Win=174720 Len=0 TSval=813725 TSecr=813725
460;;127.0.0.1;;127.0.0.1;TCP;[TCP segment of a reassembled PDU]
461;;127.0.0.1;;127.0.0.1;TCP;45690 → 8080 [ACK] Seq=198 Ack=16572 Win=305664 Len=0 TSval=813725 TSecr=813725
462;;127.0.0.1;;127.0.0.1;TCP;[TCP segment of a reassembled PDU]
463;;127.0.0.1;;127.0.0.1;TCP;45690 → 8080 [ACK] Seq=198 Ack=24764 Win=436608 Len=0 TSval=813725 TSecr=813725
464;;127.0.0.1;;127.0.0.1;TCP;[TCP segment of a reassembled PDU]
465;;127.0.0.1;;127.0.0.1;TCP;45690 → 8080 [ACK] Seq=198 Ack=32956 Win=465536 Len=0 TSval=813725 TSecr=813725
466;;127.0.0.1;;127.0.0.1;HTTP;HTTP/1.0 200 OK  (text/csv)
467;;127.0.0.1;;127.0.0.1;TCP;45690 → 8080 [ACK] Seq=198 Ack=38027 Win=465536 Len=0 TSval=813725 TSecr=813725
468;;127.0.0.1;;127.0.0.1;TCP;8080 → 45690 [FIN, ACK] Seq=38027 Ack=198 Win=44800 Len=0 TSval=813725 TSecr=813725
469;;127.0.0.1;;127.0.0.1;TCP;45690 → 8080 [FIN, ACK] Seq=198 Ack=38028 Win=465536 Len=0 TSval=813726 TSecr=813725
470;;127.0.0.1;;127.0.0.1;TCP;8080 → 45690 [ACK] Seq=38028 Ack=199 Win=44800 Len=0 TSval=813726 TSecr=813726
471;;127.0.0.1;;127.0.0.1;TCP;7687 → 41610 [ACK] Seq=1260 Ack=1088 Win=45952 Len=0 TSval=813730 TSecr=813720
472;;127.0.0.1;;127.0.0.1;TCP;41610 → 7687 [PSH, ACK] Seq=1088 Ack=1260 Win=45952 Len=1963 TSval=813730 TSecr=813730
473;;127.0.0.1;;127.0.0.1;TCP;7687 → 41610 [ACK] Seq=1260 Ack=3051 Win=176896 Len=0 TSval=813730 TSecr=813730
474;;127.0.0.1;;127.0.0.1;TCP;45692 → 8080 [SYN] Seq=0 Win=43690 Len=0 MSS=65495 SACK_PERM=1 TSval=813755 TSecr=0 WS=128
475;;127.0.0.1;;127.0.0.1;TCP;8080 → 45692 [SYN, ACK] Seq=0 Ack=1 Win=43690 Len=0 MSS=65495 SACK_PERM=1 TSval=813755 TSecr=813755 WS=128
476;;127.0.0.1;;127.0.0.1;TCP;45692 → 8080 [ACK] Seq=1 Ack=1 Win=43776 Len=0 TSval=813755 TSecr=813755
477;;127.0.0.1;;127.0.0.1;HTTP;GET /capture_00003_20170304180058.csv HTTP/1.1 
478;;127.0.0.1;;127.0.0.1;TCP;8080 → 45692 [ACK] Seq=1 Ack=198 Win=44800 Len=0 TSval=813755 TSecr=813755
479;;127.0.0.1;;127.0.0.1;TCP;[TCP segment of a reassembled PDU]
480;;127.0.0.1;;127.0.0.1;TCP;45692 → 8080 [ACK] Seq=198 Ack=18 Win=43776 Len=0 TSval=813755 TSecr=813755
481;;127.0.0.1;;127.0.0.1;TCP;[TCP segment of a reassembled PDU]
482;;127.0.0.1;;127.0.0.1;TCP;45692 → 8080 [ACK] Seq=198 Ack=56 Win=43776 Len=0 TSval=813755 TSecr=813755
483;;127.0.0.1;;127.0.0.1;TCP;[TCP segment of a reassembled PDU]
484;;127.0.0.1;;127.0.0.1;TCP;45692 → 8080 [ACK] Seq=198 Ack=93 Win=43776 Len=0 TSval=813755 TSecr=813755
485;;127.0.0.1;;127.0.0.1;TCP;[TCP segment of a reassembled PDU]
486;;127.0.0.1;;127.0.0.1;TCP;45692 → 8080 [ACK] Seq=198 Ack=117 Win=43776 Len=0 TSval=813755 TSecr=813755
487;;127.0.0.1;;127.0.0.1;TCP;[TCP segment of a reassembled PDU]
488;;127.0.0.1;;127.0.0.1;TCP;45692 → 8080 [ACK] Seq=198 Ack=140 Win=43776 Len=0 TSval=813755 TSecr=813755
489;;127.0.0.1;;127.0.0.1;TCP;[TCP segment of a reassembled PDU]
490;;127.0.0.1;;127.0.0.1;TCP;45692 → 8080 [ACK] Seq=198 Ack=186 Win=43776 Len=0 TSval=813755 TSecr=813755
491;;127.0.0.1;;127.0.0.1;TCP;[TCP segment of a reassembled PDU]
492;;127.0.0.1;;127.0.0.1;TCP;45692 → 8080 [ACK] Seq=198 Ack=188 Win=43776 Len=0 TSval=813755 TSecr=813755
493;;127.0.0.1;;127.0.0.1;TCP;[TCP segment of a reassembled PDU]
494;;127.0.0.1;;127.0.0.1;TCP;45692 → 8080 [ACK] Seq=198 Ack=8380 Win=174720 Len=0 TSval=813755 TSecr=813755
495;;127.0.0.1;;127.0.0.1;TCP;[TCP segment of a reassembled PDU]
496;;127.0.0.1;;127.0.0.1;TCP;45692 → 8080 [ACK] Seq=198 Ack=16572 Win=305664 Len=0 TSval=813755 TSecr=813755
497;;127.0.0.1;;127.0.0.1;TCP;[TCP segment of a reassembled PDU]
498;;127.0.0.1;;127.0.0.1;TCP;45692 → 8080 [ACK] Seq=198 Ack=24764 Win=436608 Len=0 TSval=813755 TSecr=813755
499;;127.0.0.1;;127.0.0.1;TCP;[TCP segment of a reassembled PDU]
500;;127.0.0.1;;127.0.0.1;TCP;45692 → 8080 [ACK] Seq=198 Ack=32956 Win=465536 Len=0 TSval=813755 TSecr=813755
501;;127.0.0.1;;127.0.0.1;HTTP;HTTP/1.0 200 OK  (text/csv)
502;;127.0.0.1;;127.0.0.1;TCP;45692 → 8080 [ACK] Seq=198 Ack=38027 Win=465536 Len=0 TSval=813755 TSecr=813755
503;;127.0.0.1;;127.0.0.1;TCP;8080 → 45692 [FIN, ACK] Seq=38027 Ack=198 Win=44800 Len=0 TSval=813755 TSecr=813755
504;;127.0.0.1;;127.0.0.1;TCP;45692 → 8080 [FIN, ACK] Seq=198 Ack=38028 Win=465536 Len=0 TSval=813755 TSecr=813755
505;;127.0.0.1;;127.0.0.1;TCP;8080 → 45692 [ACK] Seq=38028 Ack=199 Win=44800 Len=0 TSval=813755 TSecr=813755
506;;127.0.0.1;;127.0.0.1;TCP;45694 → 8080 [SYN] Seq=0 Win=43690 Len=0 MSS=65495 SACK_PERM=1 TSval=813795 TSecr=0 WS=128
507;;127.0.0.1;;127.0.0.1;TCP;8080 → 45694 [SYN, ACK] Seq=0 Ack=1 Win=43690 Len=0 MSS=65495 SACK_PERM=1 TSval=813795 TSecr=813795 WS=128
508;;127.0.0.1;;127.0.0.1;TCP;45694 → 8080 [ACK] Seq=1 Ack=1 Win=43776 Len=0 TSval=813795 TSecr=813795
509;;127.0.0.1;;127.0.0.1;HTTP;GET /capture_00003_20170304180058.csv HTTP/1.1 
510;;127.0.0.1;;127.0.0.1;TCP;8080 → 45694 [ACK] Seq=1 Ack=198 Win=44800 Len=0 TSval=813795 TSecr=813795
511;;127.0.0.1;;127.0.0.1;TCP;[TCP segment of a reassembled PDU]
512;;127.0.0.1;;127.0.0.1;TCP;45694 → 8080 [ACK] Seq=198 Ack=18 Win=43776 Len=0 TSval=813795 TSecr=813795
513;;127.0.0.1;;127.0.0.1;TCP;[TCP segment of a reassembled PDU]
514;;127.0.0.1;;127.0.0.1;TCP;45694 → 8080 [ACK] Seq=198 Ack=56 Win=43776 Len=0 TSval=813795 TSecr=813795
515;;127.0.0.1;;127.0.0.1;TCP;[TCP segment of a reassembled PDU]
516;;127.0.0.1;;127.0.0.1;TCP;45694 → 8080 [ACK] Seq=198 Ack=93 Win=43776 Len=0 TSval=813795 TSecr=813795
517;;127.0.0.1;;127.0.0.1;TCP;[TCP segment of a reassembled PDU]
518;;127.0.0.1;;127.0.0.1;TCP;45694 → 8080 [ACK] Seq=198 Ack=117 Win=43776 Len=0 TSval=813795 TSecr=813795
519;;127.0.0.1;;127.0.0.1;TCP;[TCP segment of a reassembled PDU]
520;;127.0.0.1;;127.0.0.1;TCP;45694 → 8080 [ACK] Seq=198 Ack=140 Win=43776 Len=0 TSval=813795 TSecr=813795
521;;127.0.0.1;;127.0.0.1;TCP;[TCP segment of a reassembled PDU]
522;;127.0.0.1;;127.0.0.1;TCP;45694 → 8080 [ACK] Seq=198 Ack=186 Win=43776 Len=0 TSval=813795 TSecr=813795
523;;127.0.0.1;;127.0.0.1;TCP;[TCP segment of a reassembled PDU]
524;;127.0.0.1;;127.0.0.1;TCP;45694 → 8080 [ACK] Seq=198 Ack=188 Win=43776 Len=0 TSval=813795 TSecr=813795
525;;127.0.0.1;;127.0.0.1;TCP;[TCP segment of a reassembled PDU]
526;;127.0.0.1;;127.0.0.1;TCP;45694 → 8080 [ACK] Seq=198 Ack=8380 Win=174720 Len=0 TSval=813795 TSecr=813795
527;;127.0.0.1;;127.0.0.1;TCP;[TCP segment of a reassembled PDU]
528;;127.0.0.1;;127.0.0.1;TCP;45694 → 8080 [ACK] Seq=198 Ack=16572 Win=305664 Len=0 TSval=813795 TSecr=813795
529;;127.0.0.1;;127.0.0.1;TCP;[TCP segment of a reassembled PDU]
530;;127.0.0.1;;127.0.0.1;TCP;45694 → 8080 [ACK] Seq=198 Ack=24764 Win=436608 Len=0 TSval=813795 TSecr=813795
531;;127.0.0.1;;127.0.0.1;TCP;[TCP segment of a reassembled PDU]
532;;127.0.0.1;;127.0.0.1;TCP;45694 → 8080 [ACK] Seq=198 Ack=32956 Win=465536 Len=0 TSval=813795 TSecr=813795
533;;127.0.0.1;;127.0.0.1;HTTP;HTTP/1.0 200 OK  (text/csv)
534;;127.0.0.1;;127.0.0.1;TCP;45694 → 8080 [ACK] Seq=198 Ack=38027 Win=465536 Len=0 TSval=813795 TSecr=813795
535;;127.0.0.1;;127.0.0.1;TCP;8080 → 45694 [FIN, ACK] Seq=38027 Ack=198 Win=44800 Len=0 TSval=813795 TSecr=813795
536;;127.0.0.1;;127.0.0.1;TCP;45694 → 8080 [FIN, ACK] Seq=198 Ack=38028 Win=465536 Len=0 TSval=813796 TSecr=813795
537;;127.0.0.1;;127.0.0.1;TCP;8080 → 45694 [ACK] Seq=38028 Ack=199 Win=44800 Len=0 TSval=813796 TSecr=813796
538;;127.0.0.1;;127.0.0.1;TCP;45696 → 8080 [SYN] Seq=0 Win=43690 Len=0 MSS=65495 SACK_PERM=1 TSval=813825 TSecr=0 WS=128
539;;127.0.0.1;;127.0.0.1;TCP;8080 → 45696 [SYN, ACK] Seq=0 Ack=1 Win=43690 Len=0 MSS=65495 SACK_PERM=1 TSval=813825 TSecr=813825 WS=128
540;;127.0.0.1;;127.0.0.1;TCP;45696 → 8080 [ACK] Seq=1 Ack=1 Win=43776 Len=0 TSval=813825 TSecr=813825
541;;127.0.0.1;;127.0.0.1;HTTP;GET /capture_00003_20170304180058.csv HTTP/1.1 
542;;127.0.0.1;;127.0.0.1;TCP;8080 → 45696 [ACK] Seq=1 Ack=198 Win=44800 Len=0 TSval=813825 TSecr=813825
543;;127.0.0.1;;127.0.0.1;TCP;[TCP segment of a reassembled PDU]
544;;127.0.0.1;;127.0.0.1;TCP;45696 → 8080 [ACK] Seq=198 Ack=18 Win=43776 Len=0 TSval=813825 TSecr=813825
545;;127.0.0.1;;127.0.0.1;TCP;[TCP segment of a reassembled PDU]
546;;127.0.0.1;;127.0.0.1;TCP;45696 → 8080 [ACK] Seq=198 Ack=56 Win=43776 Len=0 TSval=813825 TSecr=813825
547;;127.0.0.1;;127.0.0.1;TCP;[TCP segment of a reassembled PDU]
548;;127.0.0.1;;127.0.0.1;TCP;45696 → 8080 [ACK] Seq=198 Ack=93 Win=43776 Len=0 TSval=813825 TSecr=813825
549;;127.0.0.1;;127.0.0.1;TCP;[TCP segment of a reassembled PDU]
550;;127.0.0.1;;127.0.0.1;TCP;45696 → 8080 [ACK] Seq=198 Ack=117 Win=43776 Len=0 TSval=813825 TSecr=813825
551;;127.0.0.1;;127.0.0.1;TCP;[TCP segment of a reassembled PDU]
552;;127.0.0.1;;127.0.0.1;TCP;45696 → 8080 [ACK] Seq=198 Ack=140 Win=43776 Len=0 TSval=813825 TSecr=813825
553;;127.0.0.1;;127.0.0.1;TCP;[TCP segment of a reassembled PDU]
554;;127.0.0.1;;127.0.0.1;TCP;45696 → 8080 [ACK] Seq=198 Ack=186 Win=43776 Len=0 TSval=813825 TSecr=813825
555;;127.0.0.1;;127.0.0.1;TCP;[TCP segment of a reassembled PDU]
556;;127.0.0.1;;127.0.0.1;TCP;45696 → 8080 [ACK] Seq=198 Ack=188 Win=43776 Len=0 TSval=813825 TSecr=813825
557;;127.0.0.1;;127.0.0.1;TCP;[TCP segment of a reassembled PDU]
558;;127.0.0.1;;127.0.0.1;TCP;45696 → 8080 [ACK] Seq=198 Ack=8380 Win=174720 Len=0 TSval=813825 TSecr=813825
559;;127.0.0.1;;127.0.0.1;TCP;[TCP segment of a reassembled PDU]
560;;127.0.0.1;;127.0.0.1;TCP;45696 → 8080 [ACK] Seq=198 Ack=16572 Win=305664 Len=0 TSval=813825 TSecr=813825
561;;127.0.0.1;;127.0.0.1;TCP;[TCP segment of a reassembled PDU]
562;;127.0.0.1;;127.0.0.1;TCP;45696 → 8080 [ACK] Seq=198 Ack=24764 Win=436608 Len=0 TSval=813825 TSecr=813825
563;;127.0.0.1;;127.0.0.1;TCP;[TCP segment of a reassembled PDU]
564;;127.0.0.1;;127.0.0.1;TCP;45696 → 8080 [ACK] Seq=198 Ack=32956 Win=465536 Len=0 TSval=813825 TSecr=813825
565;;127.0.0.1;;127.0.0.1;HTTP;HTTP/1.0 200 OK  (text/csv)
566;;127.0.0.1;;127.0.0.1;TCP;45696 → 8080 [ACK] Seq=198 Ack=38027 Win=465536 Len=0 TSval=813825 TSecr=813825
567;;127.0.0.1;;127.0.0.1;TCP;8080 → 45696 [FIN, ACK] Seq=38027 Ack=198 Win=44800 Len=0 TSval=813825 TSecr=813825
568;;127.0.0.1;;127.0.0.1;TCP;45696 → 8080 [FIN, ACK] Seq=198 Ack=38028 Win=465536 Len=0 TSval=813825 TSecr=813825
569;;127.0.0.1;;127.0.0.1;TCP;8080 → 45696 [ACK] Seq=38028 Ack=199 Win=44800 Len=0 TSval=813825 TSecr=813825
570;;127.0.0.1;;127.0.0.1;TCP;45698 → 8080 [SYN] Seq=0 Win=43690 Len=0 MSS=65495 SACK_PERM=1 TSval=813870 TSecr=0 WS=128
571;;127.0.0.1;;127.0.0.1;TCP;8080 → 45698 [SYN, ACK] Seq=0 Ack=1 Win=43690 Len=0 MSS=65495 SACK_PERM=1 TSval=813870 TSecr=813870 WS=128
572;;127.0.0.1;;127.0.0.1;TCP;45698 → 8080 [ACK] Seq=1 Ack=1 Win=43776 Len=0 TSval=813870 TSecr=813870
573;;127.0.0.1;;127.0.0.1;HTTP;GET /capture_00003_20170304180058.csv HTTP/1.1 
574;;127.0.0.1;;127.0.0.1;TCP;8080 → 45698 [ACK] Seq=1 Ack=198 Win=44800 Len=0 TSval=813870 TSecr=813870
575;;127.0.0.1;;127.0.0.1;TCP;[TCP segment of a reassembled PDU]
576;;127.0.0.1;;127.0.0.1;TCP;45698 → 8080 [ACK] Seq=198 Ack=18 Win=43776 Len=0 TSval=813870 TSecr=813870
577;;127.0.0.1;;127.0.0.1;TCP;[TCP segment of a reassembled PDU]
578;;127.0.0.1;;127.0.0.1;TCP;45698 → 8080 [ACK] Seq=198 Ack=56 Win=43776 Len=0 TSval=813870 TSecr=813870
579;;127.0.0.1;;127.0.0.1;TCP;[TCP segment of a reassembled PDU]
580;;127.0.0.1;;127.0.0.1;TCP;45698 → 8080 [ACK] Seq=198 Ack=93 Win=43776 Len=0 TSval=813870 TSecr=813870
581;;127.0.0.1;;127.0.0.1;TCP;[TCP segment of a reassembled PDU]
582;;127.0.0.1;;127.0.0.1;TCP;45698 → 8080 [ACK] Seq=198 Ack=117 Win=43776 Len=0 TSval=813870 TSecr=813870
583;;127.0.0.1;;127.0.0.1;TCP;[TCP segment of a reassembled PDU]
584;;127.0.0.1;;127.0.0.1;TCP;45698 → 8080 [ACK] Seq=198 Ack=140 Win=43776 Len=0 TSval=813870 TSecr=813870
585;;127.0.0.1;;127.0.0.1;TCP;[TCP segment of a reassembled PDU]
586;;127.0.0.1;;127.0.0.1;TCP;45698 → 8080 [ACK] Seq=198 Ack=186 Win=43776 Len=0 TSval=813870 TSecr=813870
587;;127.0.0.1;;127.0.0.1;TCP;[TCP segment of a reassembled PDU]
588;;127.0.0.1;;127.0.0.1;TCP;45698 → 8080 [ACK] Seq=198 Ack=188 Win=43776 Len=0 TSval=813870 TSecr=813870
589;;127.0.0.1;;127.0.0.1;TCP;[TCP segment of a reassembled PDU]
590;;127.0.0.1;;127.0.0.1;TCP;45698 → 8080 [ACK] Seq=198 Ack=8380 Win=174720 Len=0 TSval=813870 TSecr=813870
591;;127.0.0.1;;127.0.0.1;TCP;[TCP segment of a reassembled PDU]
592;;127.0.0.1;;127.0.0.1;TCP;45698 → 8080 [ACK] Seq=198 Ack=16572 Win=305664 Len=0 TSval=813870 TSecr=813870
593;;127.0.0.1;;127.0.0.1;TCP;[TCP segment of a reassembled PDU]
594;;127.0.0.1;;127.0.0.1;TCP;45698 → 8080 [ACK] Seq=198 Ack=24764 Win=436608 Len=0 TSval=813870 TSecr=813870
595;;127.0.0.1;;127.0.0.1;TCP;[TCP segment of a reassembled PDU]
596;;127.0.0.1;;127.0.0.1;TCP;45698 → 8080 [ACK] Seq=198 Ack=32956 Win=465536 Len=0 TSval=813870 TSecr=813870
597;;127.0.0.1;;127.0.0.1;HTTP;HTTP/1.0 200 OK  (text/csv)
598;;127.0.0.1;;127.0.0.1;TCP;45698 → 8080 [ACK] Seq=198 Ack=38027 Win=465536 Len=0 TSval=813870 TSecr=813870
599;;127.0.0.1;;127.0.0.1;TCP;8080 → 45698 [FIN, ACK] Seq=38027 Ack=198 Win=44800 Len=0 TSval=813870 TSecr=813870
600;;127.0.0.1;;127.0.0.1;TCP;45698 → 8080 [FIN, ACK] Seq=198 Ack=38028 Win=465536 Len=0 TSval=813870 TSecr=813870
601;;127.0.0.1;;127.0.0.1;TCP;8080 → 45698 [ACK] Seq=38028 Ack=199 Win=44800 Len=0 TSval=813870 TSecr=813870
602;;127.0.0.1;;127.0.0.1;TCP;45700 → 8080 [SYN] Seq=0 Win=43690 Len=0 MSS=65495 SACK_PERM=1 TSval=813912 TSecr=0 WS=128
603;;127.0.0.1;;127.0.0.1;TCP;8080 → 45700 [SYN, ACK] Seq=0 Ack=1 Win=43690 Len=0 MSS=65495 SACK_PERM=1 TSval=813912 TSecr=813912 WS=128
604;;127.0.0.1;;127.0.0.1;TCP;45700 → 8080 [ACK] Seq=1 Ack=1 Win=43776 Len=0 TSval=813912 TSecr=813912
605;;127.0.0.1;;127.0.0.1;HTTP;GET /capture_00003_20170304180058.csv HTTP/1.1 
606;;127.0.0.1;;127.0.0.1;TCP;8080 → 45700 [ACK] Seq=1 Ack=198 Win=44800 Len=0 TSval=813912 TSecr=813912
607;;127.0.0.1;;127.0.0.1;TCP;[TCP segment of a reassembled PDU]
608;;127.0.0.1;;127.0.0.1;TCP;45700 → 8080 [ACK] Seq=198 Ack=18 Win=43776 Len=0 TSval=813912 TSecr=813912
609;;127.0.0.1;;127.0.0.1;TCP;[TCP segment of a reassembled PDU]
610;;127.0.0.1;;127.0.0.1;TCP;45700 → 8080 [ACK] Seq=198 Ack=56 Win=43776 Len=0 TSval=813912 TSecr=813912
611;;127.0.0.1;;127.0.0.1;TCP;[TCP segment of a reassembled PDU]
612;;127.0.0.1;;127.0.0.1;TCP;45700 → 8080 [ACK] Seq=198 Ack=93 Win=43776 Len=0 TSval=813912 TSecr=813912
613;;127.0.0.1;;127.0.0.1;TCP;[TCP segment of a reassembled PDU]
614;;127.0.0.1;;127.0.0.1;TCP;45700 → 8080 [ACK] Seq=198 Ack=117 Win=43776 Len=0 TSval=813912 TSecr=813912
615;;127.0.0.1;;127.0.0.1;TCP;[TCP segment of a reassembled PDU]
616;;127.0.0.1;;127.0.0.1;TCP;45700 → 8080 [ACK] Seq=198 Ack=140 Win=43776 Len=0 TSval=813912 TSecr=813912
617;;127.0.0.1;;127.0.0.1;TCP;[TCP segment of a reassembled PDU]
618;;127.0.0.1;;127.0.0.1;TCP;45700 → 8080 [ACK] Seq=198 Ack=186 Win=43776 Len=0 TSval=813912 TSecr=813912
619;;127.0.0.1;;127.0.0.1;TCP;[TCP segment of a reassembled PDU]
620;;127.0.0.1;;127.0.0.1;TCP;45700 → 8080 [ACK] Seq=198 Ack=188 Win=43776 Len=0 TSval=813912 TSecr=813912
621;;127.0.0.1;;127.0.0.1;TCP;[TCP segment of a reassembled PDU]
622;;127.0.0.1;;127.0.0.1;TCP;45700 → 8080 [ACK] Seq=198 Ack=8380 Win=174720 Len=0 TSval=813912 TSecr=813912
623;;127.0.0.1;;127.0.0.1;TCP;[TCP segment of a reassembled PDU]
624;;127.0.0.1;;127.0.0.1;TCP;45700 → 8080 [ACK] Seq=198 Ack=16572 Win=305664 Len=0 TSval=813912 TSecr=813912
625;;127.0.0.1;;127.0.0.1;TCP;[TCP segment of a reassembled PDU]
626;;127.0.0.1;;127.0.0.1;TCP;45700 → 8080 [ACK] Seq=198 Ack=24764 Win=436608 Len=0 TSval=813912 TSecr=813912
627;;127.0.0.1;;127.0.0.1;TCP;[TCP segment of a reassembled PDU]
628;;127.0.0.1;;127.0.0.1;TCP;45700 → 8080 [ACK] Seq=198 Ack=32956 Win=465536 Len=0 TSval=813912 TSecr=813912
629;;127.0.0.1;;127.0.0.1;HTTP;HTTP/1.0 200 OK  (text/csv)
630;;127.0.0.1;;127.0.0.1;TCP;45700 → 8080 [ACK] Seq=198 Ack=38027 Win=465536 Len=0 TSval=813912 TSecr=813912
631;;127.0.0.1;;127.0.0.1;TCP;8080 → 45700 [FIN, ACK] Seq=38027 Ack=198 Win=44800 Len=0 TSval=813912 TSecr=813912
632;;127.0.0.1;;127.0.0.1;TCP;45700 → 8080 [FIN, ACK] Seq=198 Ack=38028 Win=465536 Len=0 TSval=813913 TSecr=813912
633;;127.0.0.1;;127.0.0.1;TCP;8080 → 45700 [ACK] Seq=38028 Ack=199 Win=44800 Len=0 TSval=813913 TSecr=813913
634;;127.0.0.1;;127.0.0.1;TCP;45702 → 8080 [SYN] Seq=0 Win=43690 Len=0 MSS=65495 SACK_PERM=1 TSval=813950 TSecr=0 WS=128
635;;127.0.0.1;;127.0.0.1;TCP;8080 → 45702 [SYN, ACK] Seq=0 Ack=1 Win=43690 Len=0 MSS=65495 SACK_PERM=1 TSval=813950 TSecr=813950 WS=128
636;;127.0.0.1;;127.0.0.1;TCP;45702 → 8080 [ACK] Seq=1 Ack=1 Win=43776 Len=0 TSval=813950 TSecr=813950
637;;127.0.0.1;;127.0.0.1;HTTP;GET /capture_00003_20170304180058.csv HTTP/1.1 
638;;127.0.0.1;;127.0.0.1;TCP;8080 → 45702 [ACK] Seq=1 Ack=198 Win=44800 Len=0 TSval=813950 TSecr=813950
639;;127.0.0.1;;127.0.0.1;TCP;[TCP segment of a reassembled PDU]
640;;127.0.0.1;;127.0.0.1;TCP;45702 → 8080 [ACK] Seq=198 Ack=18 Win=43776 Len=0 TSval=813950 TSecr=813950
641;;127.0.0.1;;127.0.0.1;TCP;[TCP segment of a reassembled PDU]
642;;127.0.0.1;;127.0.0.1;TCP;45702 → 8080 [ACK] Seq=198 Ack=56 Win=43776 Len=0 TSval=813950 TSecr=813950
643;;127.0.0.1;;127.0.0.1;TCP;[TCP segment of a reassembled PDU]
644;;127.0.0.1;;127.0.0.1;TCP;45702 → 8080 [ACK] Seq=198 Ack=93 Win=43776 Len=0 TSval=813950 TSecr=813950
645;;127.0.0.1;;127.0.0.1;TCP;[TCP segment of a reassembled PDU]
646;;127.0.0.1;;127.0.0.1;TCP;45702 → 8080 [ACK] Seq=198 Ack=117 Win=43776 Len=0 TSval=813950 TSecr=813950
647;;127.0.0.1;;127.0.0.1;TCP;[TCP segment of a reassembled PDU]
648;;127.0.0.1;;127.0.0.1;TCP;45702 → 8080 [ACK] Seq=198 Ack=140 Win=43776 Len=0 TSval=813950 TSecr=813950
649;;127.0.0.1;;127.0.0.1;TCP;[TCP segment of a reassembled PDU]
650;;127.0.0.1;;127.0.0.1;TCP;45702 → 8080 [ACK] Seq=198 Ack=186 Win=43776 Len=0 TSval=813950 TSecr=813950
651;;127.0.0.1;;127.0.0.1;TCP;[TCP segment of a reassembled PDU]
652;;127.0.0.1;;127.0.0.1;TCP;45702 → 8080 [ACK] Seq=198 Ack=188 Win=43776 Len=0 TSval=813950 TSecr=813950
653;;127.0.0.1;;127.0.0.1;TCP;[TCP segment of a reassembled PDU]
654;;127.0.0.1;;127.0.0.1;TCP;45702 → 8080 [ACK] Seq=198 Ack=8380 Win=174720 Len=0 TSval=813950 TSecr=813950
655;;127.0.0.1;;127.0.0.1;TCP;[TCP segment of a reassembled PDU]
656;;127.0.0.1;;127.0.0.1;TCP;45702 → 8080 [ACK] Seq=198 Ack=16572 Win=305664 Len=0 TSval=813950 TSecr=813950
657;;127.0.0.1;;127.0.0.1;TCP;[TCP segment of a reassembled PDU]
658;;127.0.0.1;;127.0.0.1;TCP;45702 → 8080 [ACK] Seq=198 Ack=24764 Win=436608 Len=0 TSval=813950 TSecr=813950
659;;127.0.0.1;;127.0.0.1;TCP;[TCP segment of a reassembled PDU]
660;;127.0.0.1;;127.0.0.1;TCP;45702 → 8080 [ACK] Seq=198 Ack=32956 Win=465536 Len=0 TSval=813950 TSecr=813950
661;;127.0.0.1;;127.0.0.1;HTTP;HTTP/1.0 200 OK  (text/csv)
662;;127.0.0.1;;127.0.0.1;TCP;45702 → 8080 [ACK] Seq=198 Ack=38027 Win=465536 Len=0 TSval=813950 TSecr=813950
663;;127.0.0.1;;127.0.0.1;TCP;8080 → 45702 [FIN, ACK] Seq=38027 Ack=198 Win=44800 Len=0 TSval=813950 TSecr=813950
664;;127.0.0.1;;127.0.0.1;TCP;45702 → 8080 [FIN, ACK] Seq=198 Ack=38028 Win=465536 Len=0 TSval=813951 TSecr=813950
665;;127.0.0.1;;127.0.0.1;TCP;8080 → 45702 [ACK] Seq=38028 Ack=199 Win=44800 Len=0 TSval=813951 TSecr=813951
666;;127.0.0.1;;127.0.0.1;TCP;7687 → 41610 [PSH, ACK] Seq=1260 Ack=3051 Win=176896 Len=585 TSval=813976 TSecr=813730
667;;127.0.0.1;;127.0.0.1;TCP;41610 → 7687 [FIN, ACK] Seq=3051 Ack=1845 Win=48256 Len=0 TSval=813976 TSecr=813976
668;;127.0.0.1;;127.0.0.1;TCP;7687 → 41610 [FIN, ACK] Seq=1845 Ack=3052 Win=176896 Len=0 TSval=813976 TSecr=813976
669;;127.0.0.1;;127.0.0.1;TCP;41610 → 7687 [ACK] Seq=3052 Ack=1846 Win=48256 Len=0 TSval=813976 TSecr=813976
670;;127.0.0.1;;127.0.0.1;TCP;41626 → 7687 [SYN] Seq=0 Win=43690 Len=0 MSS=65495 SACK_PERM=1 TSval=813977 TSecr=0 WS=128
671;;127.0.0.1;;127.0.0.1;TCP;7687 → 41626 [SYN, ACK] Seq=0 Ack=1 Win=43690 Len=0 MSS=65495 SACK_PERM=1 TSval=813977 TSecr=813977 WS=128
672;;127.0.0.1;;127.0.0.1;TCP;41626 → 7687 [ACK] Seq=1 Ack=1 Win=43776 Len=0 TSval=813977 TSecr=813977
673;;127.0.0.1;;127.0.0.1;TCP;41626 → 7687 [PSH, ACK] Seq=1 Ack=1 Win=43776 Len=517 TSval=813977 TSecr=813977
674;;127.0.0.1;;127.0.0.1;TCP;7687 → 41626 [ACK] Seq=1 Ack=518 Win=44800 Len=0 TSval=813977 TSecr=813977
675;;127.0.0.1;;127.0.0.1;TCP;7687 → 41626 [PSH, ACK] Seq=1 Ack=518 Win=44800 Len=1120 TSval=813980 TSecr=813977
676;;127.0.0.1;;127.0.0.1;TCP;41626 → 7687 [ACK] Seq=518 Ack=1121 Win=45952 Len=0 TSval=813980 TSecr=813980
677;;127.0.0.1;;127.0.0.1;TCP;41626 → 7687 [PSH, ACK] Seq=518 Ack=1121 Win=45952 Len=126 TSval=813980 TSecr=813980
678;;127.0.0.1;;127.0.0.1;TCP;7687 → 41626 [PSH, ACK] Seq=1121 Ack=644 Win=44800 Len=51 TSval=813981 TSecr=813980
679;;127.0.0.1;;127.0.0.1;TCP;41626 → 7687 [PSH, ACK] Seq=644 Ack=1172 Win=45952 Len=49 TSval=813981 TSecr=813981
680;;127.0.0.1;;127.0.0.1;TCP;7687 → 41626 [PSH, ACK] Seq=1172 Ack=693 Win=44800 Len=33 TSval=813981 TSecr=813981
681;;127.0.0.1;;127.0.0.1;TCP;41626 → 7687 [PSH, ACK] Seq=693 Ack=1205 Win=45952 Len=108 TSval=813982 TSecr=813981
682;;127.0.0.1;;127.0.0.1;TCP;7687 → 41626 [PSH, ACK] Seq=1205 Ack=801 Win=44800 Len=55 TSval=813982 TSecr=813982
683;;127.0.0.1;;127.0.0.1;TCP;41626 → 7687 [PSH, ACK] Seq=801 Ack=1260 Win=45952 Len=287 TSval=813982 TSecr=813982
684;;127.0.0.1;;127.0.0.1;TCP;45706 → 8080 [SYN] Seq=0 Win=43690 Len=0 MSS=65495 SACK_PERM=1 TSval=813985 TSecr=0 WS=128
685;;127.0.0.1;;127.0.0.1;TCP;8080 → 45706 [SYN, ACK] Seq=0 Ack=1 Win=43690 Len=0 MSS=65495 SACK_PERM=1 TSval=813985 TSecr=813985 WS=128
686;;127.0.0.1;;127.0.0.1;TCP;45706 → 8080 [ACK] Seq=1 Ack=1 Win=43776 Len=0 TSval=813985 TSecr=813985
687;;127.0.0.1;;127.0.0.1;HTTP;GET /capture_00002_20170304180056.csv HTTP/1.1 
688;;127.0.0.1;;127.0.0.1;TCP;8080 → 45706 [ACK] Seq=1 Ack=198 Win=44800 Len=0 TSval=813985 TSecr=813985
689;;127.0.0.1;;127.0.0.1;TCP;[TCP segment of a reassembled PDU]
690;;127.0.0.1;;127.0.0.1;TCP;45706 → 8080 [ACK] Seq=198 Ack=18 Win=43776 Len=0 TSval=813985 TSecr=813985
691;;127.0.0.1;;127.0.0.1;TCP;[TCP segment of a reassembled PDU]
692;;127.0.0.1;;127.0.0.1;TCP;45706 → 8080 [ACK] Seq=198 Ack=56 Win=43776 Len=0 TSval=813985 TSecr=813985
693;;127.0.0.1;;127.0.0.1;TCP;[TCP segment of a reassembled PDU]
694;;127.0.0.1;;127.0.0.1;TCP;45706 → 8080 [ACK] Seq=198 Ack=93 Win=43776 Len=0 TSval=813985 TSecr=813985
695;;127.0.0.1;;127.0.0.1;TCP;[TCP segment of a reassembled PDU]
696;;127.0.0.1;;127.0.0.1;TCP;45706 → 8080 [ACK] Seq=198 Ack=117 Win=43776 Len=0 TSval=813985 TSecr=813985
697;;127.0.0.1;;127.0.0.1;TCP;[TCP segment of a reassembled PDU]
698;;127.0.0.1;;127.0.0.1;TCP;45706 → 8080 [ACK] Seq=198 Ack=140 Win=43776 Len=0 TSval=813985 TSecr=813985
699;;127.0.0.1;;127.0.0.1;TCP;[TCP segment of a reassembled PDU]
700;;127.0.0.1;;127.0.0.1;TCP;45706 → 8080 [ACK] Seq=198 Ack=186 Win=43776 Len=0 TSval=813985 TSecr=813985
701;;127.0.0.1;;127.0.0.1;TCP;[TCP segment of a reassembled PDU]
702;;127.0.0.1;;127.0.0.1;TCP;45706 → 8080 [ACK] Seq=198 Ack=188 Win=43776 Len=0 TSval=813985 TSecr=813985
703;;127.0.0.1;;127.0.0.1;TCP;[TCP segment of a reassembled PDU]
704;;127.0.0.1;;127.0.0.1;TCP;45706 → 8080 [ACK] Seq=198 Ack=8380 Win=174720 Len=0 TSval=813985 TSecr=813985
705;;127.0.0.1;;127.0.0.1;TCP;[TCP segment of a reassembled PDU]
706;;127.0.0.1;;127.0.0.1;TCP;45706 → 8080 [ACK] Seq=198 Ack=16572 Win=305664 Len=0 TSval=813985 TSecr=813985
707;;127.0.0.1;;127.0.0.1;TCP;[TCP segment of a reassembled PDU]
708;;127.0.0.1;;127.0.0.1;TCP;45706 → 8080 [ACK] Seq=198 Ack=24764 Win=436608 Len=0 TSval=813985 TSecr=813985
709;;127.0.0.1;;127.0.0.1;TCP;[TCP segment of a reassembled PDU]
710;;127.0.0.1;;127.0.0.1;TCP;45706 → 8080 [ACK] Seq=198 Ack=32956 Win=465536 Len=0 TSval=813985 TSecr=813985
711;;127.0.0.1;;127.0.0.1;TCP;[TCP segment of a reassembled PDU]
712;;127.0.0.1;;127.0.0.1;TCP;45706 → 8080 [ACK] Seq=198 Ack=41148 Win=465536 Len=0 TSval=813985 TSecr=813985
713;;127.0.0.1;;127.0.0.1;HTTP;HTTP/1.0 200 OK  (text/csv)
714;;127.0.0.1;;127.0.0.1;TCP;45706 → 8080 [ACK] Seq=198 Ack=45382 Win=465536 Len=0 TSval=813985 TSecr=813985
715;;127.0.0.1;;127.0.0.1;TCP;8080 → 45706 [FIN, ACK] Seq=45382 Ack=198 Win=44800 Len=0 TSval=813985 TSecr=813985
716;;127.0.0.1;;127.0.0.1;TCP;45706 → 8080 [FIN, ACK] Seq=198 Ack=45383 Win=465536 Len=0 TSval=813986 TSecr=813985
717;;127.0.0.1;;127.0.0.1;TCP;8080 → 45706 [ACK] Seq=45383 Ack=199 Win=44800 Len=0 TSval=813986 TSecr=813986
718;;127.0.0.1;;127.0.0.1;TCP;7687 → 41626 [ACK] Seq=1260 Ack=1088 Win=45952 Len=0 TSval=813992 TSecr=813982
719;;127.0.0.1;;127.0.0.1;TCP;41626 → 7687 [PSH, ACK] Seq=1088 Ack=1260 Win=45952 Len=1963 TSval=813992 TSecr=813992
720;;127.0.0.1;;127.0.0.1;TCP;7687 → 41626 [ACK] Seq=1260 Ack=3051 Win=176896 Len=0 TSval=813992 TSecr=813992
721;;127.0.0.1;;127.0.0.1;TCP;45708 → 8080 [SYN] Seq=0 Win=43690 Len=0 MSS=65495 SACK_PERM=1 TSval=814016 TSecr=0 WS=128
722;;127.0.0.1;;127.0.0.1;TCP;8080 → 45708 [SYN, ACK] Seq=0 Ack=1 Win=43690 Len=0 MSS=65495 SACK_PERM=1 TSval=814016 TSecr=814016 WS=128
723;;127.0.0.1;;127.0.0.1;TCP;45708 → 8080 [ACK] Seq=1 Ack=1 Win=43776 Len=0 TSval=814016 TSecr=814016
724;;127.0.0.1;;127.0.0.1;HTTP;GET /capture_00002_20170304180056.csv HTTP/1.1 
725;;127.0.0.1;;127.0.0.1;TCP;8080 → 45708 [ACK] Seq=1 Ack=198 Win=44800 Len=0 TSval=814016 TSecr=814016
726;;127.0.0.1;;127.0.0.1;TCP;[TCP segment of a reassembled PDU]
727;;127.0.0.1;;127.0.0.1;TCP;45708 → 8080 [ACK] Seq=198 Ack=18 Win=43776 Len=0 TSval=814016 TSecr=814016
728;;127.0.0.1;;127.0.0.1;TCP;[TCP segment of a reassembled PDU]
729;;127.0.0.1;;127.0.0.1;TCP;45708 → 8080 [ACK] Seq=198 Ack=56 Win=43776 Len=0 TSval=814016 TSecr=814016
730;;127.0.0.1;;127.0.0.1;TCP;[TCP segment of a reassembled PDU]
731;;127.0.0.1;;127.0.0.1;TCP;45708 → 8080 [ACK] Seq=198 Ack=93 Win=43776 Len=0 TSval=814016 TSecr=814016
732;;127.0.0.1;;127.0.0.1;TCP;[TCP segment of a reassembled PDU]
733;;127.0.0.1;;127.0.0.1;TCP;45708 → 8080 [ACK] Seq=198 Ack=117 Win=43776 Len=0 TSval=814016 TSecr=814016
734;;127.0.0.1;;127.0.0.1;TCP;[TCP segment of a reassembled PDU]
735;;127.0.0.1;;127.0.0.1;TCP;45708 → 8080 [ACK] Seq=198 Ack=140 Win=43776 Len=0 TSval=814016 TSecr=814016
736;;127.0.0.1;;127.0.0.1;TCP;[TCP segment of a reassembled PDU]
737;;127.0.0.1;;127.0.0.1;TCP;45708 → 8080 [ACK] Seq=198 Ack=186 Win=43776 Len=0 TSval=814016 TSecr=814016
738;;127.0.0.1;;127.0.0.1;TCP;[TCP segment of a reassembled PDU]
739;;127.0.0.1;;127.0.0.1;TCP;45708 → 8080 [ACK] Seq=198 Ack=188 Win=43776 Len=0 TSval=814016 TSecr=814016
740;;127.0.0.1;;127.0.0.1;TCP;[TCP segment of a reassembled PDU]
741;;127.0.0.1;;127.0.0.1;TCP;45708 → 8080 [ACK] Seq=198 Ack=8380 Win=174720 Len=0 TSval=814016 TSecr=814016
742;;127.0.0.1;;127.0.0.1;TCP;[TCP segment of a reassembled PDU]
743;;127.0.0.1;;127.0.0.1;TCP;45708 → 8080 [ACK] Seq=198 Ack=16572 Win=305664 Len=0 TSval=814016 TSecr=814016
744;;127.0.0.1;;127.0.0.1;TCP;[TCP segment of a reassembled PDU]
745;;127.0.0.1;;127.0.0.1;TCP;45708 → 8080 [ACK] Seq=198 Ack=24764 Win=436608 Len=0 TSval=814016 TSecr=814016
746;;127.0.0.1;;127.0.0.1;TCP;[TCP segment of a reassembled PDU]
747;;127.0.0.1;;127.0.0.1;TCP;45708 → 8080 [ACK] Seq=198 Ack=32956 Win=465536 Len=0 TSval=814016 TSecr=814016
748;;127.0.0.1;;127.0.0.1;TCP;[TCP segment of a reassembled PDU]
749;;127.0.0.1;;127.0.0.1;TCP;45708 → 8080 [ACK] Seq=198 Ack=41148 Win=465536 Len=0 TSval=814016 TSecr=814016
750;;127.0.0.1;;127.0.0.1;HTTP;HTTP/1.0 200 OK  (text/csv)
751;;127.0.0.1;;127.0.0.1;TCP;45708 → 8080 [ACK] Seq=198 Ack=45382 Win=465536 Len=0 TSval=814016 TSecr=814016
752;;127.0.0.1;;127.0.0.1;TCP;8080 → 45708 [FIN, ACK] Seq=45382 Ack=198 Win=44800 Len=0 TSval=814016 TSecr=814016
753;;127.0.0.1;;127.0.0.1;TCP;45708 → 8080 [FIN, ACK] Seq=198 Ack=45383 Win=465536 Len=0 TSval=814016 TSecr=814016
754;;127.0.0.1;;127.0.0.1;TCP;8080 → 45708 [ACK] Seq=45383 Ack=199 Win=44800 Len=0 TSval=814016 TSecr=814016
755;;127.0.0.1;;127.0.0.1;TCP;45710 → 8080 [SYN] Seq=0 Win=43690 Len=0 MSS=65495 SACK_PERM=1 TSval=814058 TSecr=0 WS=128
756;;127.0.0.1;;127.0.0.1;TCP;8080 → 45710 [SYN, ACK] Seq=0 Ack=1 Win=43690 Len=0 MSS=65495 SACK_PERM=1 TSval=814058 TSecr=814058 WS=128
757;;127.0.0.1;;127.0.0.1;TCP;45710 → 8080 [ACK] Seq=1 Ack=1 Win=43776 Len=0 TSval=814058 TSecr=814058
758;;127.0.0.1;;127.0.0.1;HTTP;GET /capture_00002_20170304180056.csv HTTP/1.1 
759;;127.0.0.1;;127.0.0.1;TCP;8080 → 45710 [ACK] Seq=1 Ack=198 Win=44800 Len=0 TSval=814058 TSecr=814058
760;;127.0.0.1;;127.0.0.1;TCP;[TCP segment of a reassembled PDU]
761;;127.0.0.1;;127.0.0.1;TCP;45710 → 8080 [ACK] Seq=198 Ack=18 Win=43776 Len=0 TSval=814058 TSecr=814058
762;;127.0.0.1;;127.0.0.1;TCP;[TCP segment of a reassembled PDU]
763;;127.0.0.1;;127.0.0.1;TCP;45710 → 8080 [ACK] Seq=198 Ack=56 Win=43776 Len=0 TSval=814058 TSecr=814058
764;;127.0.0.1;;127.0.0.1;TCP;[TCP segment of a reassembled PDU]
765;;127.0.0.1;;127.0.0.1;TCP;45710 → 8080 [ACK] Seq=198 Ack=93 Win=43776 Len=0 TSval=814058 TSecr=814058
766;;127.0.0.1;;127.0.0.1;TCP;[TCP segment of a reassembled PDU]
767;;127.0.0.1;;127.0.0.1;TCP;45710 → 8080 [ACK] Seq=198 Ack=117 Win=43776 Len=0 TSval=814058 TSecr=814058
768;;127.0.0.1;;127.0.0.1;TCP;[TCP segment of a reassembled PDU]
769;;127.0.0.1;;127.0.0.1;TCP;45710 → 8080 [ACK] Seq=198 Ack=140 Win=43776 Len=0 TSval=814058 TSecr=814058
770;;127.0.0.1;;127.0.0.1;TCP;[TCP segment of a reassembled PDU]
771;;127.0.0.1;;127.0.0.1;TCP;45710 → 8080 [ACK] Seq=198 Ack=186 Win=43776 Len=0 TSval=814058 TSecr=814058
772;;127.0.0.1;;127.0.0.1;TCP;[TCP segment of a reassembled PDU]
773;;127.0.0.1;;127.0.0.1;TCP;45710 → 8080 [ACK] Seq=198 Ack=188 Win=43776 Len=0 TSval=814058 TSecr=814058
774;;127.0.0.1;;127.0.0.1;TCP;[TCP segment of a reassembled PDU]
775;;127.0.0.1;;127.0.0.1;TCP;45710 → 8080 [ACK] Seq=198 Ack=8380 Win=174720 Len=0 TSval=814058 TSecr=814058
776;;127.0.0.1;;127.0.0.1;TCP;[TCP segment of a reassembled PDU]
777;;127.0.0.1;;127.0.0.1;TCP;45710 → 8080 [ACK] Seq=198 Ack=16572 Win=305664 Len=0 TSval=814058 TSecr=814058
778;;127.0.0.1;;127.0.0.1;TCP;[TCP segment of a reassembled PDU]
779;;127.0.0.1;;127.0.0.1;TCP;45710 → 8080 [ACK] Seq=198 Ack=24764 Win=436608 Len=0 TSval=814058 TSecr=814058
780;;127.0.0.1;;127.0.0.1;TCP;[TCP segment of a reassembled PDU]
781;;127.0.0.1;;127.0.0.1;TCP;45710 → 8080 [ACK] Seq=198 Ack=32956 Win=465536 Len=0 TSval=814058 TSecr=814058
782;;127.0.0.1;;127.0.0.1;TCP;[TCP segment of a reassembled PDU]
