frame.number;eth.src;ip.src;eth.dst;ip.dst;_ws.col.Protocol;_ws.col.Info
1;;127.0.0.1;;127.0.0.1;TCP;45650 → 8080 [ACK] Seq=1 Ack=1 Win=3411 Len=0 TSval=805401 TSecr=805401
2;;127.0.0.1;;127.0.0.1;TCP;8080 → 45650 [PSH, ACK] Seq=1 Ack=1 Win=350 Len=8192 TSval=805401 TSecr=805401
3;;127.0.0.1;;127.0.0.1;TCP;45650 → 8080 [ACK] Seq=1 Ack=8193 Win=3637 Len=0 TSval=805401 TSecr=805401
4;;127.0.0.1;;127.0.0.1;TCP;8080 → 45650 [PSH, ACK] Seq=8193 Ack=1 Win=350 Len=8192 TSval=805401 TSecr=805401
5;;127.0.0.1;;127.0.0.1;TCP;45650 → 8080 [ACK] Seq=1 Ack=16385 Win=3637 Len=0 TSval=805401 TSecr=805401
6;;127.0.0.1;;127.0.0.1;TCP;8080 → 45650 [PSH, ACK] Seq=16385 Ack=1 Win=350 Len=8192 TSval=805401 TSecr=805401
7;;127.0.0.1;;127.0.0.1;TCP;45650 → 8080 [ACK] Seq=1 Ack=24577 Win=3637 Len=0 TSval=805401 TSecr=805401
8;;127.0.0.1;;127.0.0.1;TCP;8080 → 45650 [PSH, ACK] Seq=24577 Ack=1 Win=350 Len=8192 TSval=805401 TSecr=805401
9;;127.0.0.1;;127.0.0.1;TCP;45650 → 8080 [ACK] Seq=1 Ack=32769 Win=3637 Len=0 TSval=805401 TSecr=805401
10;;127.0.0.1;;127.0.0.1;TCP;8080 → 45650 [PSH, ACK] Seq=32769 Ack=1 Win=350 Len=8192 TSval=805401 TSecr=805401
11;;127.0.0.1;;127.0.0.1;TCP;45650 → 8080 [ACK] Seq=1 Ack=40961 Win=3637 Len=0 TSval=805401 TSecr=805401
12;;127.0.0.1;;127.0.0.1;TCP;8080 → 45650 [PSH, ACK] Seq=40961 Ack=1 Win=350 Len=8192 TSval=805401 TSecr=805401
13;;127.0.0.1;;127.0.0.1;TCP;45650 → 8080 [ACK] Seq=1 Ack=49153 Win=3637 Len=0 TSval=805401 TSecr=805401
14;;127.0.0.1;;127.0.0.1;TCP;8080 → 45650 [PSH, ACK] Seq=49153 Ack=1 Win=350 Len=8192 TSval=805401 TSecr=805401
15;;127.0.0.1;;127.0.0.1;TCP;45650 → 8080 [ACK] Seq=1 Ack=57345 Win=3637 Len=0 TSval=805401 TSecr=805401
16;;127.0.0.1;;127.0.0.1;TCP;8080 → 45650 [PSH, ACK] Seq=57345 Ack=1 Win=350 Len=8192 TSval=805401 TSecr=805401
17;;127.0.0.1;;127.0.0.1;TCP;45650 → 8080 [ACK] Seq=1 Ack=65537 Win=3637 Len=0 TSval=805401 TSecr=805401
18;;127.0.0.1;;127.0.0.1;TCP;8080 → 45650 [PSH, ACK] Seq=65537 Ack=1 Win=350 Len=8192 TSval=805401 TSecr=805401
19;;127.0.0.1;;127.0.0.1;TCP;45650 → 8080 [ACK] Seq=1 Ack=73729 Win=3637 Len=0 TSval=805401 TSecr=805401
20;;127.0.0.1;;127.0.0.1;TCP;8080 → 45650 [PSH, ACK] Seq=73729 Ack=1 Win=350 Len=8192 TSval=805402 TSecr=805401
21;;127.0.0.1;;127.0.0.1;TCP;8080 → 45650 [FIN, PSH, ACK] Seq=81921 Ack=1 Win=350 Len=45925 TSval=805402 TSecr=805401
22;;127.0.0.1;;127.0.0.1;TCP;45650 → 8080 [ACK] Seq=1 Ack=127847 Win=3540 Len=0 TSval=805402 TSecr=805402
23;;127.0.0.1;;127.0.0.1;TCP;45650 → 8080 [FIN, ACK] Seq=1 Ack=127847 Win=3637 Len=0 TSval=805402 TSecr=805402
24;;127.0.0.1;;127.0.0.1;TCP;8080 → 45650 [ACK] Seq=127847 Ack=2 Win=350 Len=0 TSval=805402 TSecr=805402
25;;127.0.0.1;;127.0.0.1;TCP;45652 → 8080 [SYN] Seq=0 Win=43690 Len=0 MSS=65495 SACK_PERM=1 TSval=805468 TSecr=0 WS=128
26;;127.0.0.1;;127.0.0.1;TCP;8080 → 45652 [SYN, ACK] Seq=0 Ack=1 Win=43690 Len=0 MSS=65495 SACK_PERM=1 TSval=805468 TSecr=805468 WS=128
27;;127.0.0.1;;127.0.0.1;TCP;45652 → 8080 [ACK] Seq=1 Ack=1 Win=43776 Len=0 TSval=805468 TSecr=805468
28;;127.0.0.1;;127.0.0.1;HTTP;GET /capture_00001_20170304175613.csv HTTP/1.1 
29;;127.0.0.1;;127.0.0.1;TCP;8080 → 45652 [ACK] Seq=1 Ack=198 Win=44800 Len=0 TSval=805468 TSecr=805468
30;;127.0.0.1;;127.0.0.1;TCP;[TCP segment of a reassembled PDU]
31;;127.0.0.1;;127.0.0.1;TCP;45652 → 8080 [ACK] Seq=198 Ack=18 Win=43776 Len=0 TSval=805468 TSecr=805468
32;;127.0.0.1;;127.0.0.1;TCP;[TCP segment of a reassembled PDU]
33;;127.0.0.1;;127.0.0.1;TCP;45652 → 8080 [ACK] Seq=198 Ack=56 Win=43776 Len=0 TSval=805468 TSecr=805468
34;;127.0.0.1;;127.0.0.1;TCP;[TCP segment of a reassembled PDU]
35;;127.0.0.1;;127.0.0.1;TCP;45652 → 8080 [ACK] Seq=198 Ack=93 Win=43776 Len=0 TSval=805468 TSecr=805468
36;;127.0.0.1;;127.0.0.1;TCP;[TCP segment of a reassembled PDU]
37;;127.0.0.1;;127.0.0.1;TCP;45652 → 8080 [ACK] Seq=198 Ack=117 Win=43776 Len=0 TSval=805468 TSecr=805468
38;;127.0.0.1;;127.0.0.1;TCP;[TCP segment of a reassembled PDU]
39;;127.0.0.1;;127.0.0.1;TCP;45652 → 8080 [ACK] Seq=198 Ack=141 Win=43776 Len=0 TSval=805468 TSecr=805468
40;;127.0.0.1;;127.0.0.1;TCP;[TCP segment of a reassembled PDU]
41;;127.0.0.1;;127.0.0.1;TCP;45652 → 8080 [ACK] Seq=198 Ack=187 Win=43776 Len=0 TSval=805468 TSecr=805468
42;;127.0.0.1;;127.0.0.1;TCP;[TCP segment of a reassembled PDU]
43;;127.0.0.1;;127.0.0.1;TCP;45652 → 8080 [ACK] Seq=198 Ack=189 Win=43776 Len=0 TSval=805468 TSecr=805468
44;;127.0.0.1;;127.0.0.1;TCP;[TCP segment of a reassembled PDU]
45;;127.0.0.1;;127.0.0.1;TCP;45652 → 8080 [ACK] Seq=198 Ack=8381 Win=174720 Len=0 TSval=805468 TSecr=805468
46;;127.0.0.1;;127.0.0.1;TCP;[TCP segment of a reassembled PDU]
47;;127.0.0.1;;127.0.0.1;TCP;45652 → 8080 [ACK] Seq=198 Ack=16573 Win=305664 Len=0 TSval=805468 TSecr=805468
48;;127.0.0.1;;127.0.0.1;TCP;[TCP segment of a reassembled PDU]
49;;127.0.0.1;;127.0.0.1;TCP;45652 → 8080 [ACK] Seq=198 Ack=24765 Win=436608 Len=0 TSval=805468 TSecr=805468
50;;127.0.0.1;;127.0.0.1;TCP;[TCP segment of a reassembled PDU]
51;;127.0.0.1;;127.0.0.1;TCP;45652 → 8080 [ACK] Seq=198 Ack=32957 Win=465536 Len=0 TSval=805468 TSecr=805468
52;;127.0.0.1;;127.0.0.1;TCP;[TCP segment of a reassembled PDU]
53;;127.0.0.1;;127.0.0.1;TCP;45652 → 8080 [ACK] Seq=198 Ack=41149 Win=465536 Len=0 TSval=805468 TSecr=805468
54;;127.0.0.1;;127.0.0.1;TCP;[TCP segment of a reassembled PDU]
55;;127.0.0.1;;127.0.0.1;TCP;45652 → 8080 [ACK] Seq=198 Ack=49341 Win=465536 Len=0 TSval=805468 TSecr=805468
56;;127.0.0.1;;127.0.0.1;TCP;[TCP segment of a reassembled PDU]
57;;127.0.0.1;;127.0.0.1;TCP;45652 → 8080 [ACK] Seq=198 Ack=57533 Win=465536 Len=0 TSval=805468 TSecr=805468
58;;127.0.0.1;;127.0.0.1;TCP;[TCP segment of a reassembled PDU]
59;;127.0.0.1;;127.0.0.1;TCP;45652 → 8080 [ACK] Seq=198 Ack=65725 Win=465536 Len=0 TSval=805468 TSecr=805468
60;;127.0.0.1;;127.0.0.1;TCP;[TCP segment of a reassembled PDU]
61;;127.0.0.1;;127.0.0.1;TCP;45652 → 8080 [ACK] Seq=198 Ack=73917 Win=465536 Len=0 TSval=805468 TSecr=805468
62;;127.0.0.1;;127.0.0.1;TCP;[TCP segment of a reassembled PDU]
63;;127.0.0.1;;127.0.0.1;TCP;45652 → 8080 [ACK] Seq=198 Ack=82109 Win=465536 Len=0 TSval=805468 TSecr=805468
64;;127.0.0.1;;127.0.0.1;TCP;[TCP segment of a reassembled PDU]
65;;127.0.0.1;;127.0.0.1;TCP;45652 → 8080 [ACK] Seq=198 Ack=90301 Win=465536 Len=0 TSval=805468 TSecr=805468
66;;127.0.0.1;;127.0.0.1;TCP;[TCP segment of a reassembled PDU]
67;;127.0.0.1;;127.0.0.1;TCP;45652 → 8080 [ACK] Seq=198 Ack=98493 Win=465536 Len=0 TSval=805468 TSecr=805468
68;;127.0.0.1;;127.0.0.1;TCP;[TCP segment of a reassembled PDU]
69;;127.0.0.1;;127.0.0.1;HTTP;HTTP/1.0 200 OK  (text/csv)
70;;127.0.0.1;;127.0.0.1;TCP;45652 → 8080 [ACK] Seq=198 Ack=152611 Win=453120 Len=0 TSval=805468 TSecr=805468
71;;127.0.0.1;;127.0.0.1;TCP;45652 → 8080 [FIN, ACK] Seq=198 Ack=152611 Win=465536 Len=0 TSval=805468 TSecr=805468
72;;127.0.0.1;;127.0.0.1;TCP;8080 → 45652 [ACK] Seq=152611 Ack=199 Win=44800 Len=0 TSval=805468 TSecr=805468
73;;127.0.0.1;;127.0.0.1;TCP;7687 → 41560 [PSH, ACK] Seq=1 Ack=1 Win=1382 Len=641 TSval=805494 TSecr=804845
74;;127.0.0.1;;127.0.0.1;TCP;41560 → 7687 [FIN, ACK] Seq=1 Ack=642 Win=377 Len=0 TSval=805494 TSecr=805494
75;;127.0.0.1;;127.0.0.1;TCP;7687 → 41560 [FIN, ACK] Seq=642 Ack=2 Win=1382 Len=0 TSval=805494 TSecr=805494
76;;127.0.0.1;;127.0.0.1;TCP;41560 → 7687 [ACK] Seq=2 Ack=643 Win=377 Len=0 TSval=805494 TSecr=805494
77;;127.0.0.1;;127.0.0.1;TCP;41576 → 7687 [SYN] Seq=0 Win=43690 Len=0 MSS=65495 SACK_PERM=1 TSval=805495 TSecr=0 WS=128
78;;127.0.0.1;;127.0.0.1;TCP;7687 → 41576 [SYN, ACK] Seq=0 Ack=1 Win=43690 Len=0 MSS=65495 SACK_PERM=1 TSval=805495 TSecr=805495 WS=128
79;;127.0.0.1;;127.0.0.1;TCP;41576 → 7687 [ACK] Seq=1 Ack=1 Win=43776 Len=0 TSval=805495 TSecr=805495
80;;127.0.0.1;;127.0.0.1;TCP;41576 → 7687 [PSH, ACK] Seq=1 Ack=1 Win=43776 Len=517 TSval=805495 TSecr=805495
81;;127.0.0.1;;127.0.0.1;TCP;7687 → 41576 [ACK] Seq=1 Ack=518 Win=44800 Len=0 TSval=805495 TSecr=805495
82;;127.0.0.1;;127.0.0.1;TCP;7687 → 41576 [PSH, ACK] Seq=1 Ack=518 Win=44800 Len=1120 TSval=805498 TSecr=805495
83;;127.0.0.1;;127.0.0.1;TCP;41576 → 7687 [ACK] Seq=518 Ack=1121 Win=45952 Len=0 TSval=805498 TSecr=805498
84;;127.0.0.1;;127.0.0.1;TCP;41576 → 7687 [PSH, ACK] Seq=518 Ack=1121 Win=45952 Len=126 TSval=805498 TSecr=805498
85;;127.0.0.1;;127.0.0.1;TCP;7687 → 41576 [PSH, ACK] Seq=1121 Ack=644 Win=44800 Len=51 TSval=805498 TSecr=805498
86;;127.0.0.1;;127.0.0.1;TCP;41576 → 7687 [PSH, ACK] Seq=644 Ack=1172 Win=45952 Len=49 TSval=805498 TSecr=805498
87;;127.0.0.1;;127.0.0.1;TCP;7687 → 41576 [PSH, ACK] Seq=1172 Ack=693 Win=44800 Len=33 TSval=805499 TSecr=805498
88;;127.0.0.1;;127.0.0.1;TCP;41576 → 7687 [PSH, ACK] Seq=693 Ack=1205 Win=45952 Len=108 TSval=805499 TSecr=805499
89;;127.0.0.1;;127.0.0.1;TCP;7687 → 41576 [PSH, ACK] Seq=1205 Ack=801 Win=44800 Len=55 TSval=805499 TSecr=805499
90;;127.0.0.1;;127.0.0.1;TCP;41576 → 7687 [PSH, ACK] Seq=801 Ack=1260 Win=45952 Len=287 TSval=805499 TSecr=805499
91;;127.0.0.1;;127.0.0.1;TCP;45656 → 8080 [SYN] Seq=0 Win=43690 Len=0 MSS=65495 SACK_PERM=1 TSval=805504 TSecr=0 WS=128
92;;127.0.0.1;;127.0.0.1;TCP;8080 → 45656 [SYN, ACK] Seq=0 Ack=1 Win=43690 Len=0 MSS=65495 SACK_PERM=1 TSval=805504 TSecr=805504 WS=128
93;;127.0.0.1;;127.0.0.1;TCP;45656 → 8080 [ACK] Seq=1 Ack=1 Win=43776 Len=0 TSval=805504 TSecr=805504
94;;127.0.0.1;;127.0.0.1;HTTP;GET /capture_00001_20170304175859.csv HTTP/1.1 
95;;127.0.0.1;;127.0.0.1;TCP;8080 → 45656 [ACK] Seq=1 Ack=198 Win=44800 Len=0 TSval=805504 TSecr=805504
96;;127.0.0.1;;127.0.0.1;TCP;[TCP segment of a reassembled PDU]
97;;127.0.0.1;;127.0.0.1;TCP;45656 → 8080 [ACK] Seq=198 Ack=18 Win=43776 Len=0 TSval=805504 TSecr=805504
98;;127.0.0.1;;127.0.0.1;TCP;[TCP segment of a reassembled PDU]
99;;127.0.0.1;;127.0.0.1;TCP;45656 → 8080 [ACK] Seq=198 Ack=56 Win=43776 Len=0 TSval=805504 TSecr=805504
100;;127.0.0.1;;127.0.0.1;TCP;[TCP segment of a reassembled PDU]
101;;127.0.0.1;;127.0.0.1;TCP;45656 → 8080 [ACK] Seq=198 Ack=93 Win=43776 Len=0 TSval=805504 TSecr=805504
102;;127.0.0.1;;127.0.0.1;TCP;[TCP segment of a reassembled PDU]
103;;127.0.0.1;;127.0.0.1;TCP;45656 → 8080 [ACK] Seq=198 Ack=117 Win=43776 Len=0 TSval=805504 TSecr=805504
104;;127.0.0.1;;127.0.0.1;TCP;[TCP segment of a reassembled PDU]
105;;127.0.0.1;;127.0.0.1;TCP;45656 → 8080 [ACK] Seq=198 Ack=140 Win=43776 Len=0 TSval=805504 TSecr=805504
106;;127.0.0.1;;127.0.0.1;TCP;[TCP segment of a reassembled PDU]
107;;127.0.0.1;;127.0.0.1;TCP;45656 → 8080 [ACK] Seq=198 Ack=186 Win=43776 Len=0 TSval=805504 TSecr=805504
108;;127.0.0.1;;127.0.0.1;TCP;[TCP segment of a reassembled PDU]
109;;127.0.0.1;;127.0.0.1;TCP;45656 → 8080 [ACK] Seq=198 Ack=188 Win=43776 Len=0 TSval=805504 TSecr=805504
110;;127.0.0.1;;127.0.0.1;TCP;7687 → 41576 [ACK] Seq=1260 Ack=1088 Win=45952 Len=0 TSval=805509 TSecr=805499
111;;127.0.0.1;;127.0.0.1;TCP;41576 → 7687 [PSH, ACK] Seq=1088 Ack=1260 Win=45952 Len=1963 TSval=805509 TSecr=805509
112;;127.0.0.1;;127.0.0.1;TCP;7687 → 41576 [ACK] Seq=1260 Ack=3051 Win=176896 Len=0 TSval=805509 TSecr=805509
113;;127.0.0.1;;127.0.0.1;TCP;[TCP segment of a reassembled PDU]
114;;127.0.0.1;;127.0.0.1;TCP;45656 → 8080 [ACK] Seq=198 Ack=8380 Win=174720 Len=0 TSval=805509 TSecr=805509
115;;127.0.0.1;;127.0.0.1;TCP;[TCP segment of a reassembled PDU]
116;;127.0.0.1;;127.0.0.1;TCP;45656 → 8080 [ACK] Seq=198 Ack=16572 Win=305664 Len=0 TSval=805509 TSecr=805509
117;;127.0.0.1;;127.0.0.1;TCP;[TCP segment of a reassembled PDU]
118;;127.0.0.1;;127.0.0.1;TCP;45656 → 8080 [ACK] Seq=198 Ack=24764 Win=436608 Len=0 TSval=805509 TSecr=805509
119;;127.0.0.1;;127.0.0.1;TCP;[TCP segment of a reassembled PDU]
120;;127.0.0.1;;127.0.0.1;TCP;45656 → 8080 [ACK] Seq=198 Ack=32956 Win=465536 Len=0 TSval=805509 TSecr=805509
121;;127.0.0.1;;127.0.0.1;TCP;[TCP segment of a reassembled PDU]
122;;127.0.0.1;;127.0.0.1;TCP;45656 → 8080 [ACK] Seq=198 Ack=41148 Win=465536 Len=0 TSval=805509 TSecr=805509
123;;127.0.0.1;;127.0.0.1;TCP;[TCP segment of a reassembled PDU]
124;;127.0.0.1;;127.0.0.1;TCP;45656 → 8080 [ACK] Seq=198 Ack=49340 Win=465536 Len=0 TSval=805509 TSecr=805509
125;;127.0.0.1;;127.0.0.1;TCP;[TCP segment of a reassembled PDU]
126;;127.0.0.1;;127.0.0.1;TCP;45656 → 8080 [ACK] Seq=198 Ack=57532 Win=465536 Len=0 TSval=805509 TSecr=805509
127;;127.0.0.1;;127.0.0.1;TCP;[TCP segment of a reassembled PDU]
128;;127.0.0.1;;127.0.0.1;TCP;45656 → 8080 [ACK] Seq=198 Ack=65724 Win=465536 Len=0 TSval=805509 TSecr=805509
129;;127.0.0.1;;127.0.0.1;TCP;[TCP segment of a reassembled PDU]
130;;127.0.0.1;;127.0.0.1;TCP;45656 → 8080 [ACK] Seq=198 Ack=73916 Win=465536 Len=0 TSval=805510 TSecr=805509
131;;127.0.0.1;;127.0.0.1;HTTP;HTTP/1.0 200 OK  (text/csv)
132;;127.0.0.1;;127.0.0.1;TCP;45656 → 8080 [ACK] Seq=198 Ack=77027 Win=465536 Len=0 TSval=805510 TSecr=805510
133;;127.0.0.1;;127.0.0.1;TCP;8080 → 45656 [FIN, ACK] Seq=77027 Ack=198 Win=44800 Len=0 TSval=805510 TSecr=805510
134;;127.0.0.1;;127.0.0.1;TCP;45656 → 8080 [FIN, ACK] Seq=198 Ack=77028 Win=465536 Len=0 TSval=805510 TSecr=805510
135;;127.0.0.1;;127.0.0.1;TCP;8080 → 45656 [ACK] Seq=77028 Ack=199 Win=44800 Len=0 TSval=805510 TSecr=805510
136;;127.0.0.1;;127.0.0.1;TCP;45658 → 8080 [SYN] Seq=0 Win=43690 Len=0 MSS=65495 SACK_PERM=1 TSval=805540 TSecr=0 WS=128
137;;127.0.0.1;;127.0.0.1;TCP;8080 → 45658 [SYN, ACK] Seq=0 Ack=1 Win=43690 Len=0 MSS=65495 SACK_PERM=1 TSval=805540 TSecr=805540 WS=128
138;;127.0.0.1;;127.0.0.1;TCP;45658 → 8080 [ACK] Seq=1 Ack=1 Win=43776 Len=0 TSval=805540 TSecr=805540
139;;127.0.0.1;;127.0.0.1;HTTP;GET /capture_00001_20170304175859.csv HTTP/1.1 
140;;127.0.0.1;;127.0.0.1;TCP;8080 → 45658 [ACK] Seq=1 Ack=198 Win=44800 Len=0 TSval=805540 TSecr=805540
141;;127.0.0.1;;127.0.0.1;TCP;[TCP segment of a reassembled PDU]
142;;127.0.0.1;;127.0.0.1;TCP;45658 → 8080 [ACK] Seq=198 Ack=18 Win=43776 Len=0 TSval=805540 TSecr=805540
143;;127.0.0.1;;127.0.0.1;TCP;[TCP segment of a reassembled PDU]
144;;127.0.0.1;;127.0.0.1;TCP;45658 → 8080 [ACK] Seq=198 Ack=56 Win=43776 Len=0 TSval=805540 TSecr=805540
145;;127.0.0.1;;127.0.0.1;TCP;[TCP segment of a reassembled PDU]
146;;127.0.0.1;;127.0.0.1;TCP;45658 → 8080 [ACK] Seq=198 Ack=93 Win=43776 Len=0 TSval=805540 TSecr=805540
147;;127.0.0.1;;127.0.0.1;TCP;[TCP segment of a reassembled PDU]
148;;127.0.0.1;;127.0.0.1;TCP;45658 → 8080 [ACK] Seq=198 Ack=117 Win=43776 Len=0 TSval=805540 TSecr=805540
149;;127.0.0.1;;127.0.0.1;TCP;[TCP segment of a reassembled PDU]
150;;127.0.0.1;;127.0.0.1;TCP;45658 → 8080 [ACK] Seq=198 Ack=140 Win=43776 Len=0 TSval=805540 TSecr=805540
151;;127.0.0.1;;127.0.0.1;TCP;[TCP segment of a reassembled PDU]
152;;127.0.0.1;;127.0.0.1;TCP;45658 → 8080 [ACK] Seq=198 Ack=186 Win=43776 Len=0 TSval=805540 TSecr=805540
153;;127.0.0.1;;127.0.0.1;TCP;[TCP segment of a reassembled PDU]
154;;127.0.0.1;;127.0.0.1;TCP;45658 → 8080 [ACK] Seq=198 Ack=188 Win=43776 Len=0 TSval=805540 TSecr=805540
155;;127.0.0.1;;127.0.0.1;TCP;[TCP segment of a reassembled PDU]
156;;127.0.0.1;;127.0.0.1;TCP;45658 → 8080 [ACK] Seq=198 Ack=8380 Win=174720 Len=0 TSval=805540 TSecr=805540
157;;127.0.0.1;;127.0.0.1;TCP;[TCP segment of a reassembled PDU]
158;;127.0.0.1;;127.0.0.1;TCP;45658 → 8080 [ACK] Seq=198 Ack=16572 Win=305664 Len=0 TSval=805540 TSecr=805540
159;;127.0.0.1;;127.0.0.1;TCP;[TCP segment of a reassembled PDU]
160;;127.0.0.1;;127.0.0.1;TCP;45658 → 8080 [ACK] Seq=198 Ack=24764 Win=436608 Len=0 TSval=805540 TSecr=805540
161;;127.0.0.1;;127.0.0.1;TCP;[TCP segment of a reassembled PDU]
162;;127.0.0.1;;127.0.0.1;TCP;45658 → 8080 [ACK] Seq=198 Ack=32956 Win=465536 Len=0 TSval=805540 TSecr=805540
163;;127.0.0.1;;127.0.0.1;TCP;[TCP segment of a reassembled PDU]
164;;127.0.0.1;;127.0.0.1;TCP;45658 → 8080 [ACK] Seq=198 Ack=41148 Win=465536 Len=0 TSval=805540 TSecr=805540
165;;127.0.0.1;;127.0.0.1;TCP;[TCP segment of a reassembled PDU]
166;;127.0.0.1;;127.0.0.1;TCP;45658 → 8080 [ACK] Seq=198 Ack=49340 Win=465536 Len=0 TSval=805540 TSecr=805540
167;;127.0.0.1;;127.0.0.1;TCP;[TCP segment of a reassembled PDU]
168;;127.0.0.1;;127.0.0.1;TCP;45658 → 8080 [ACK] Seq=198 Ack=57532 Win=465536 Len=0 TSval=805540 TSecr=805540
169;;127.0.0.1;;127.0.0.1;TCP;[TCP segment of a reassembled PDU]
170;;127.0.0.1;;127.0.0.1;TCP;45658 → 8080 [ACK] Seq=198 Ack=65724 Win=465536 Len=0 TSval=805540 TSecr=805540
171;;127.0.0.1;;127.0.0.1;HTTP;HTTP/1.0 200 OK  (text/csv)
172;;127.0.0.1;;127.0.0.1;TCP;45658 → 8080 [ACK] Seq=198 Ack=77027 Win=465536 Len=0 TSval=805540 TSecr=805540
173;;127.0.0.1;;127.0.0.1;TCP;8080 → 45658 [FIN, ACK] Seq=77027 Ack=198 Win=44800 Len=0 TSval=805540 TSecr=805540
174;;127.0.0.1;;127.0.0.1;TCP;45658 → 8080 [FIN, ACK] Seq=198 Ack=77028 Win=465536 Len=0 TSval=805541 TSecr=805540
175;;127.0.0.1;;127.0.0.1;TCP;8080 → 45658 [ACK] Seq=77028 Ack=199 Win=44800 Len=0 TSval=805541 TSecr=805541
176;;127.0.0.1;;127.0.0.1;TCP;45660 → 8080 [SYN] Seq=0 Win=43690 Len=0 MSS=65495 SACK_PERM=1 TSval=805609 TSecr=0 WS=128
177;;127.0.0.1;;127.0.0.1;TCP;8080 → 45660 [SYN, ACK] Seq=0 Ack=1 Win=43690 Len=0 MSS=65495 SACK_PERM=1 TSval=805609 TSecr=805609 WS=128
178;;127.0.0.1;;127.0.0.1;TCP;45660 → 8080 [ACK] Seq=1 Ack=1 Win=43776 Len=0 TSval=805609 TSecr=805609
179;;127.0.0.1;;127.0.0.1;HTTP;GET /capture_00001_20170304175859.csv HTTP/1.1 
180;;127.0.0.1;;127.0.0.1;TCP;8080 → 45660 [ACK] Seq=1 Ack=198 Win=44800 Len=0 TSval=805609 TSecr=805609
181;;127.0.0.1;;127.0.0.1;TCP;[TCP segment of a reassembled PDU]
182;;127.0.0.1;;127.0.0.1;TCP;45660 → 8080 [ACK] Seq=198 Ack=18 Win=43776 Len=0 TSval=805609 TSecr=805609
183;;127.0.0.1;;127.0.0.1;TCP;[TCP segment of a reassembled PDU]
184;;127.0.0.1;;127.0.0.1;TCP;45660 → 8080 [ACK] Seq=198 Ack=56 Win=43776 Len=0 TSval=805609 TSecr=805609
185;;127.0.0.1;;127.0.0.1;TCP;[TCP segment of a reassembled PDU]
186;;127.0.0.1;;127.0.0.1;TCP;45660 → 8080 [ACK] Seq=198 Ack=93 Win=43776 Len=0 TSval=805609 TSecr=805609
187;;127.0.0.1;;127.0.0.1;TCP;[TCP segment of a reassembled PDU]
188;;127.0.0.1;;127.0.0.1;TCP;45660 → 8080 [ACK] Seq=198 Ack=117 Win=43776 Len=0 TSval=805609 TSecr=805609
189;;127.0.0.1;;127.0.0.1;TCP;[TCP segment of a reassembled PDU]
190;;127.0.0.1;;127.0.0.1;TCP;45660 → 8080 [ACK] Seq=198 Ack=140 Win=43776 Len=0 TSval=805609 TSecr=805609
191;;127.0.0.1;;127.0.0.1;TCP;[TCP segment of a reassembled PDU]
192;;127.0.0.1;;127.0.0.1;TCP;45660 → 8080 [ACK] Seq=198 Ack=186 Win=43776 Len=0 TSval=805609 TSecr=805609
193;;127.0.0.1;;127.0.0.1;TCP;[TCP segment of a reassembled PDU]
194;;127.0.0.1;;127.0.0.1;TCP;45660 → 8080 [ACK] Seq=198 Ack=188 Win=43776 Len=0 TSval=805609 TSecr=805609
195;;127.0.0.1;;127.0.0.1;TCP;[TCP segment of a reassembled PDU]
196;;127.0.0.1;;127.0.0.1;TCP;45660 → 8080 [ACK] Seq=198 Ack=8380 Win=174720 Len=0 TSval=805609 TSecr=805609
197;;127.0.0.1;;127.0.0.1;TCP;[TCP segment of a reassembled PDU]
198;;127.0.0.1;;127.0.0.1;TCP;45660 → 8080 [ACK] Seq=198 Ack=16572 Win=305664 Len=0 TSval=805609 TSecr=805609
199;;127.0.0.1;;127.0.0.1;TCP;[TCP segment of a reassembled PDU]
200;;127.0.0.1;;127.0.0.1;TCP;45660 → 8080 [ACK] Seq=198 Ack=24764 Win=436608 Len=0 TSval=805609 TSecr=805609
201;;127.0.0.1;;127.0.0.1;TCP;[TCP segment of a reassembled PDU]
202;;127.0.0.1;;127.0.0.1;TCP;45660 → 8080 [ACK] Seq=198 Ack=32956 Win=465536 Len=0 TSval=805609 TSecr=805609
203;;127.0.0.1;;127.0.0.1;TCP;[TCP segment of a reassembled PDU]
204;;127.0.0.1;;127.0.0.1;TCP;45660 → 8080 [ACK] Seq=198 Ack=41148 Win=465536 Len=0 TSval=805609 TSecr=805609
205;;127.0.0.1;;127.0.0.1;TCP;[TCP segment of a reassembled PDU]
206;;127.0.0.1;;127.0.0.1;TCP;45660 → 8080 [ACK] Seq=198 Ack=49340 Win=465536 Len=0 TSval=805609 TSecr=805609
207;;127.0.0.1;;127.0.0.1;TCP;[TCP segment of a reassembled PDU]
208;;127.0.0.1;;127.0.0.1;TCP;45660 → 8080 [ACK] Seq=198 Ack=57532 Win=465536 Len=0 TSval=805609 TSecr=805609
209;;127.0.0.1;;127.0.0.1;TCP;[TCP segment of a reassembled PDU]
210;;127.0.0.1;;127.0.0.1;TCP;45660 → 8080 [ACK] Seq=198 Ack=65724 Win=465536 Len=0 TSval=805609 TSecr=805609
211;;127.0.0.1;;127.0.0.1;TCP;[TCP segment of a reassembled PDU]
212;;127.0.0.1;;127.0.0.1;TCP;45660 → 8080 [ACK] Seq=198 Ack=73916 Win=465536 Len=0 TSval=805609 TSecr=805609
213;;127.0.0.1;;127.0.0.1;HTTP;HTTP/1.0 200 OK  (text/csv)
214;;127.0.0.1;;127.0.0.1;TCP;45660 → 8080 [ACK] Seq=198 Ack=77027 Win=465536 Len=0 TSval=805609 TSecr=805609
215;;127.0.0.1;;127.0.0.1;TCP;8080 → 45660 [FIN, ACK] Seq=77027 Ack=198 Win=44800 Len=0 TSval=805609 TSecr=805609
216;;127.0.0.1;;127.0.0.1;TCP;45660 → 8080 [FIN, ACK] Seq=198 Ack=77028 Win=465536 Len=0 TSval=805610 TSecr=805609
217;;127.0.0.1;;127.0.0.1;TCP;8080 → 45660 [ACK] Seq=77028 Ack=199 Win=44800 Len=0 TSval=805610 TSecr=805610
218;;127.0.0.1;;127.0.0.1;TCP;45662 → 8080 [SYN] Seq=0 Win=43690 Len=0 MSS=65495 SACK_PERM=1 TSval=805640 TSecr=0 WS=128
219;;127.0.0.1;;127.0.0.1;TCP;8080 → 45662 [SYN, ACK] Seq=0 Ack=1 Win=43690 Len=0 MSS=65495 SACK_PERM=1 TSval=805640 TSecr=805640 WS=128
220;;127.0.0.1;;127.0.0.1;TCP;45662 → 8080 [ACK] Seq=1 Ack=1 Win=43776 Len=0 TSval=805640 TSecr=805640
221;;127.0.0.1;;127.0.0.1;HTTP;GET /capture_00001_20170304175859.csv HTTP/1.1 
222;;127.0.0.1;;127.0.0.1;TCP;8080 → 45662 [ACK] Seq=1 Ack=198 Win=44800 Len=0 TSval=805640 TSecr=805640
223;;127.0.0.1;;127.0.0.1;TCP;[TCP segment of a reassembled PDU]
224;;127.0.0.1;;127.0.0.1;TCP;45662 → 8080 [ACK] Seq=198 Ack=18 Win=43776 Len=0 TSval=805640 TSecr=805640
225;;127.0.0.1;;127.0.0.1;TCP;[TCP segment of a reassembled PDU]
226;;127.0.0.1;;127.0.0.1;TCP;45662 → 8080 [ACK] Seq=198 Ack=56 Win=43776 Len=0 TSval=805640 TSecr=805640
227;;127.0.0.1;;127.0.0.1;TCP;[TCP segment of a reassembled PDU]
228;;127.0.0.1;;127.0.0.1;TCP;45662 → 8080 [ACK] Seq=198 Ack=93 Win=43776 Len=0 TSval=805640 TSecr=805640
229;;127.0.0.1;;127.0.0.1;TCP;[TCP segment of a reassembled PDU]
230;;127.0.0.1;;127.0.0.1;TCP;45662 → 8080 [ACK] Seq=198 Ack=117 Win=43776 Len=0 TSval=805640 TSecr=805640
231;;127.0.0.1;;127.0.0.1;TCP;[TCP segment of a reassembled PDU]
232;;127.0.0.1;;127.0.0.1;TCP;45662 → 8080 [ACK] Seq=198 Ack=140 Win=43776 Len=0 TSval=805640 TSecr=805640
233;;127.0.0.1;;127.0.0.1;TCP;[TCP segment of a reassembled PDU]
234;;127.0.0.1;;127.0.0.1;TCP;45662 → 8080 [ACK] Seq=198 Ack=186 Win=43776 Len=0 TSval=805640 TSecr=805640
235;;127.0.0.1;;127.0.0.1;TCP;[TCP segment of a reassembled PDU]
236;;127.0.0.1;;127.0.0.1;TCP;45662 → 8080 [ACK] Seq=198 Ack=188 Win=43776 Len=0 TSval=805640 TSecr=805640
237;;127.0.0.1;;127.0.0.1;TCP;[TCP segment of a reassembled PDU]
238;;127.0.0.1;;127.0.0.1;TCP;45662 → 8080 [ACK] Seq=198 Ack=8380 Win=174720 Len=0 TSval=805640 TSecr=805640
239;;127.0.0.1;;127.0.0.1;TCP;[TCP segment of a reassembled PDU]
240;;127.0.0.1;;127.0.0.1;TCP;45662 → 8080 [ACK] Seq=198 Ack=16572 Win=305664 Len=0 TSval=805640 TSecr=805640
241;;127.0.0.1;;127.0.0.1;TCP;[TCP segment of a reassembled PDU]
242;;127.0.0.1;;127.0.0.1;TCP;45662 → 8080 [ACK] Seq=198 Ack=24764 Win=436608 Len=0 TSval=805640 TSecr=805640
243;;127.0.0.1;;127.0.0.1;TCP;[TCP segment of a reassembled PDU]
244;;127.0.0.1;;127.0.0.1;TCP;45662 → 8080 [ACK] Seq=198 Ack=32956 Win=465536 Len=0 TSval=805640 TSecr=805640
245;;127.0.0.1;;127.0.0.1;TCP;[TCP segment of a reassembled PDU]
246;;127.0.0.1;;127.0.0.1;TCP;45662 → 8080 [ACK] Seq=198 Ack=41148 Win=465536 Len=0 TSval=805640 TSecr=805640
247;;127.0.0.1;;127.0.0.1;TCP;[TCP segment of a reassembled PDU]
248;;127.0.0.1;;127.0.0.1;TCP;45662 → 8080 [ACK] Seq=198 Ack=49340 Win=465536 Len=0 TSval=805640 TSecr=805640
249;;127.0.0.1;;127.0.0.1;TCP;[TCP segment of a reassembled PDU]
250;;127.0.0.1;;127.0.0.1;TCP;45662 → 8080 [ACK] Seq=198 Ack=57532 Win=465536 Len=0 TSval=805640 TSecr=805640
251;;127.0.0.1;;127.0.0.1;TCP;[TCP segment of a reassembled PDU]
252;;127.0.0.1;;127.0.0.1;TCP;45662 → 8080 [ACK] Seq=198 Ack=65724 Win=465536 Len=0 TSval=805640 TSecr=805640
253;;127.0.0.1;;127.0.0.1;TCP;[TCP segment of a reassembled PDU]
254;;127.0.0.1;;127.0.0.1;TCP;45662 → 8080 [ACK] Seq=198 Ack=73916 Win=465536 Len=0 TSval=805640 TSecr=805640
255;;127.0.0.1;;127.0.0.1;HTTP;HTTP/1.0 200 OK  (text/csv)
256;;127.0.0.1;;127.0.0.1;TCP;45662 → 8080 [ACK] Seq=198 Ack=77027 Win=465536 Len=0 TSval=805640 TSecr=805640
257;;127.0.0.1;;127.0.0.1;TCP;8080 → 45662 [FIN, ACK] Seq=77027 Ack=198 Win=44800 Len=0 TSval=805640 TSecr=805640
258;;127.0.0.1;;127.0.0.1;TCP;45662 → 8080 [FIN, ACK] Seq=198 Ack=77028 Win=465536 Len=0 TSval=805641 TSecr=805640
259;;127.0.0.1;;127.0.0.1;TCP;8080 → 45662 [ACK] Seq=77028 Ack=199 Win=44800 Len=0 TSval=805641 TSecr=805641
260;;127.0.0.1;;127.0.0.1;TCP;45664 → 8080 [SYN] Seq=0 Win=43690 Len=0 MSS=65495 SACK_PERM=1 TSval=805702 TSecr=0 WS=128
261;;127.0.0.1;;127.0.0.1;TCP;8080 → 45664 [SYN, ACK] Seq=0 Ack=1 Win=43690 Len=0 MSS=65495 SACK_PERM=1 TSval=805702 TSecr=805702 WS=128
262;;127.0.0.1;;127.0.0.1;TCP;45664 → 8080 [ACK] Seq=1 Ack=1 Win=43776 Len=0 TSval=805702 TSecr=805702
263;;127.0.0.1;;127.0.0.1;HTTP;GET /capture_00001_20170304175859.csv HTTP/1.1 
264;;127.0.0.1;;127.0.0.1;TCP;8080 → 45664 [ACK] Seq=1 Ack=198 Win=44800 Len=0 TSval=805702 TSecr=805702
265;;127.0.0.1;;127.0.0.1;TCP;[TCP segment of a reassembled PDU]
266;;127.0.0.1;;127.0.0.1;TCP;45664 → 8080 [ACK] Seq=198 Ack=18 Win=43776 Len=0 TSval=805702 TSecr=805702
267;;127.0.0.1;;127.0.0.1;TCP;[TCP segment of a reassembled PDU]
268;;127.0.0.1;;127.0.0.1;TCP;45664 → 8080 [ACK] Seq=198 Ack=56 Win=43776 Len=0 TSval=805702 TSecr=805702
269;;127.0.0.1;;127.0.0.1;TCP;[TCP segment of a reassembled PDU]
270;;127.0.0.1;;127.0.0.1;TCP;45664 → 8080 [ACK] Seq=198 Ack=93 Win=43776 Len=0 TSval=805702 TSecr=805702
271;;127.0.0.1;;127.0.0.1;TCP;[TCP segment of a reassembled PDU]
272;;127.0.0.1;;127.0.0.1;TCP;45664 → 8080 [ACK] Seq=198 Ack=117 Win=43776 Len=0 TSval=805702 TSecr=805702
273;;127.0.0.1;;127.0.0.1;TCP;[TCP segment of a reassembled PDU]
274;;127.0.0.1;;127.0.0.1;TCP;45664 → 8080 [ACK] Seq=198 Ack=140 Win=43776 Len=0 TSval=805702 TSecr=805702
275;;127.0.0.1;;127.0.0.1;TCP;[TCP segment of a reassembled PDU]
276;;127.0.0.1;;127.0.0.1;TCP;45664 → 8080 [ACK] Seq=198 Ack=186 Win=43776 Len=0 TSval=805702 TSecr=805702
277;;127.0.0.1;;127.0.0.1;TCP;[TCP segment of a reassembled PDU]
278;;127.0.0.1;;127.0.0.1;TCP;45664 → 8080 [ACK] Seq=198 Ack=188 Win=43776 Len=0 TSval=805702 TSecr=805702
279;;127.0.0.1;;127.0.0.1;TCP;[TCP segment of a reassembled PDU]
280;;127.0.0.1;;127.0.0.1;TCP;45664 → 8080 [ACK] Seq=198 Ack=8380 Win=174720 Len=0 TSval=805702 TSecr=805702
281;;127.0.0.1;;127.0.0.1;TCP;[TCP segment of a reassembled PDU]
282;;127.0.0.1;;127.0.0.1;TCP;45664 → 8080 [ACK] Seq=198 Ack=16572 Win=305664 Len=0 TSval=805702 TSecr=805702
283;;127.0.0.1;;127.0.0.1;TCP;[TCP segment of a reassembled PDU]
284;;127.0.0.1;;127.0.0.1;TCP;45664 → 8080 [ACK] Seq=198 Ack=24764 Win=436608 Len=0 TSval=805702 TSecr=805702
285;;127.0.0.1;;127.0.0.1;TCP;[TCP segment of a reassembled PDU]
286;;127.0.0.1;;127.0.0.1;TCP;45664 → 8080 [ACK] Seq=198 Ack=32956 Win=465536 Len=0 TSval=805702 TSecr=805702
287;;127.0.0.1;;127.0.0.1;TCP;[TCP segment of a reassembled PDU]
288;;127.0.0.1;;127.0.0.1;TCP;45664 → 8080 [ACK] Seq=198 Ack=41148 Win=465536 Len=0 TSval=805702 TSecr=805702
289;;127.0.0.1;;127.0.0.1;TCP;[TCP segment of a reassembled PDU]
290;;127.0.0.1;;127.0.0.1;TCP;45664 → 8080 [ACK] Seq=198 Ack=49340 Win=465536 Len=0 TSval=805702 TSecr=805702
291;;127.0.0.1;;127.0.0.1;TCP;[TCP segment of a reassembled PDU]
292;;127.0.0.1;;127.0.0.1;TCP;45664 → 8080 [ACK] Seq=198 Ack=57532 Win=465536 Len=0 TSval=805702 TSecr=805702
293;;127.0.0.1;;127.0.0.1;TCP;[TCP segment of a reassembled PDU]
294;;127.0.0.1;;127.0.0.1;TCP;45664 → 8080 [ACK] Seq=198 Ack=65724 Win=465536 Len=0 TSval=805702 TSecr=805702
295;;127.0.0.1;;127.0.0.1;TCP;[TCP segment of a reassembled PDU]
296;;127.0.0.1;;127.0.0.1;TCP;45664 → 8080 [ACK] Seq=198 Ack=73916 Win=465536 Len=0 TSval=805702 TSecr=805702
297;;127.0.0.1;;127.0.0.1;HTTP;HTTP/1.0 200 OK  (text/csv)
298;;127.0.0.1;;127.0.0.1;TCP;45664 → 8080 [ACK] Seq=198 Ack=77027 Win=465536 Len=0 TSval=805702 TSecr=805702
299;;127.0.0.1;;127.0.0.1;TCP;8080 → 45664 [FIN, ACK] Seq=77027 Ack=198 Win=44800 Len=0 TSval=805702 TSecr=805702
300;;127.0.0.1;;127.0.0.1;TCP;45664 → 8080 [FIN, ACK] Seq=198 Ack=77028 Win=465536 Len=0 TSval=805703 TSecr=805702
301;;127.0.0.1;;127.0.0.1;TCP;8080 → 45664 [ACK] Seq=77028 Ack=199 Win=44800 Len=0 TSval=805703 TSecr=805703
302;;127.0.0.1;;127.0.0.1;TCP;45666 → 8080 [SYN] Seq=0 Win=43690 Len=0 MSS=65495 SACK_PERM=1 TSval=805750 TSecr=0 WS=128
303;;127.0.0.1;;127.0.0.1;TCP;8080 → 45666 [SYN, ACK] Seq=0 Ack=1 Win=43690 Len=0 MSS=65495 SACK_PERM=1 TSval=805750 TSecr=805750 WS=128
304;;127.0.0.1;;127.0.0.1;TCP;45666 → 8080 [ACK] Seq=1 Ack=1 Win=43776 Len=0 TSval=805750 TSecr=805750
305;;127.0.0.1;;127.0.0.1;HTTP;GET /capture_00001_20170304175859.csv HTTP/1.1 
306;;127.0.0.1;;127.0.0.1;TCP;8080 → 45666 [ACK] Seq=1 Ack=198 Win=44800 Len=0 TSval=805750 TSecr=805750
307;;127.0.0.1;;127.0.0.1;TCP;[TCP segment of a reassembled PDU]
308;;127.0.0.1;;127.0.0.1;TCP;45666 → 8080 [ACK] Seq=198 Ack=18 Win=43776 Len=0 TSval=805750 TSecr=805750
309;;127.0.0.1;;127.0.0.1;TCP;[TCP segment of a reassembled PDU]
310;;127.0.0.1;;127.0.0.1;TCP;45666 → 8080 [ACK] Seq=198 Ack=56 Win=43776 Len=0 TSval=805750 TSecr=805750
311;;127.0.0.1;;127.0.0.1;TCP;[TCP segment of a reassembled PDU]
312;;127.0.0.1;;127.0.0.1;TCP;45666 → 8080 [ACK] Seq=198 Ack=93 Win=43776 Len=0 TSval=805750 TSecr=805750
313;;127.0.0.1;;127.0.0.1;TCP;[TCP segment of a reassembled PDU]
314;;127.0.0.1;;127.0.0.1;TCP;45666 → 8080 [ACK] Seq=198 Ack=117 Win=43776 Len=0 TSval=805750 TSecr=805750
315;;127.0.0.1;;127.0.0.1;TCP;[TCP segment of a reassembled PDU]
316;;127.0.0.1;;127.0.0.1;TCP;45666 → 8080 [ACK] Seq=198 Ack=140 Win=43776 Len=0 TSval=805750 TSecr=805750
317;;127.0.0.1;;127.0.0.1;TCP;[TCP segment of a reassembled PDU]
318;;127.0.0.1;;127.0.0.1;TCP;45666 → 8080 [ACK] Seq=198 Ack=186 Win=43776 Len=0 TSval=805750 TSecr=805750
319;;127.0.0.1;;127.0.0.1;TCP;[TCP segment of a reassembled PDU]
320;;127.0.0.1;;127.0.0.1;TCP;45666 → 8080 [ACK] Seq=198 Ack=188 Win=43776 Len=0 TSval=805750 TSecr=805750
321;;127.0.0.1;;127.0.0.1;TCP;[TCP segment of a reassembled PDU]
322;;127.0.0.1;;127.0.0.1;TCP;45666 → 8080 [ACK] Seq=198 Ack=8380 Win=174720 Len=0 TSval=805750 TSecr=805750
323;;127.0.0.1;;127.0.0.1;TCP;[TCP segment of a reassembled PDU]
324;;127.0.0.1;;127.0.0.1;TCP;45666 → 8080 [ACK] Seq=198 Ack=16572 Win=305664 Len=0 TSval=805750 TSecr=805750
325;;127.0.0.1;;127.0.0.1;TCP;[TCP segment of a reassembled PDU]
326;;127.0.0.1;;127.0.0.1;TCP;45666 → 8080 [ACK] Seq=198 Ack=24764 Win=436608 Len=0 TSval=805750 TSecr=805750
327;;127.0.0.1;;127.0.0.1;TCP;[TCP segment of a reassembled PDU]
328;;127.0.0.1;;127.0.0.1;TCP;45666 → 8080 [ACK] Seq=198 Ack=32956 Win=465536 Len=0 TSval=805750 TSecr=805750
329;;127.0.0.1;;127.0.0.1;TCP;[TCP segment of a reassembled PDU]
330;;127.0.0.1;;127.0.0.1;TCP;45666 → 8080 [ACK] Seq=198 Ack=41148 Win=465536 Len=0 TSval=805750 TSecr=805750
331;;127.0.0.1;;127.0.0.1;TCP;[TCP segment of a reassembled PDU]
332;;127.0.0.1;;127.0.0.1;TCP;45666 → 8080 [ACK] Seq=198 Ack=49340 Win=465536 Len=0 TSval=805750 TSecr=805750
333;;127.0.0.1;;127.0.0.1;TCP;[TCP segment of a reassembled PDU]
334;;127.0.0.1;;127.0.0.1;TCP;45666 → 8080 [ACK] Seq=198 Ack=57532 Win=465536 Len=0 TSval=805750 TSecr=805750
335;;127.0.0.1;;127.0.0.1;TCP;[TCP segment of a reassembled PDU]
336;;127.0.0.1;;127.0.0.1;TCP;45666 → 8080 [ACK] Seq=198 Ack=65724 Win=465536 Len=0 TSval=805750 TSecr=805750
337;;127.0.0.1;;127.0.0.1;TCP;[TCP segment of a reassembled PDU]
338;;127.0.0.1;;127.0.0.1;TCP;45666 → 8080 [ACK] Seq=198 Ack=73916 Win=465536 Len=0 TSval=805750 TSecr=805750
339;;127.0.0.1;;127.0.0.1;HTTP;HTTP/1.0 200 OK  (text/csv)
340;;127.0.0.1;;127.0.0.1;TCP;45666 → 8080 [ACK] Seq=198 Ack=77027 Win=465536 Len=0 TSval=805750 TSecr=805750
341;;127.0.0.1;;127.0.0.1;TCP;8080 → 45666 [FIN, ACK] Seq=77027 Ack=198 Win=44800 Len=0 TSval=805750 TSecr=805750
342;;127.0.0.1;;127.0.0.1;TCP;45666 → 8080 [FIN, ACK] Seq=198 Ack=77028 Win=465536 Len=0 TSval=805751 TSecr=805750
343;;127.0.0.1;;127.0.0.1;TCP;8080 → 45666 [ACK] Seq=77028 Ack=199 Win=44800 Len=0 TSval=805751 TSecr=805751
344;;127.0.0.1;;127.0.0.1;TCP;45668 → 8080 [SYN] Seq=0 Win=43690 Len=0 MSS=65495 SACK_PERM=1 TSval=805796 TSecr=0 WS=128
345;;127.0.0.1;;127.0.0.1;TCP;8080 → 45668 [SYN, ACK] Seq=0 Ack=1 Win=43690 Len=0 MSS=65495 SACK_PERM=1 TSval=805796 TSecr=805796 WS=128
346;;127.0.0.1;;127.0.0.1;TCP;45668 → 8080 [ACK] Seq=1 Ack=1 Win=43776 Len=0 TSval=805796 TSecr=805796
347;;127.0.0.1;;127.0.0.1;HTTP;GET /capture_00001_20170304175859.csv HTTP/1.1 
348;;127.0.0.1;;127.0.0.1;TCP;8080 → 45668 [ACK] Seq=1 Ack=198 Win=44800 Len=0 TSval=805796 TSecr=805796
349;;127.0.0.1;;127.0.0.1;TCP;[TCP segment of a reassembled PDU]
350;;127.0.0.1;;127.0.0.1;TCP;45668 → 8080 [ACK] Seq=198 Ack=18 Win=43776 Len=0 TSval=805796 TSecr=805796
351;;127.0.0.1;;127.0.0.1;TCP;[TCP segment of a reassembled PDU]
352;;127.0.0.1;;127.0.0.1;TCP;45668 → 8080 [ACK] Seq=198 Ack=56 Win=43776 Len=0 TSval=805796 TSecr=805796
353;;127.0.0.1;;127.0.0.1;TCP;[TCP segment of a reassembled PDU]
354;;127.0.0.1;;127.0.0.1;TCP;45668 → 8080 [ACK] Seq=198 Ack=93 Win=43776 Len=0 TSval=805796 TSecr=805796
355;;127.0.0.1;;127.0.0.1;TCP;[TCP segment of a reassembled PDU]
356;;127.0.0.1;;127.0.0.1;TCP;45668 → 8080 [ACK] Seq=198 Ack=117 Win=43776 Len=0 TSval=805796 TSecr=805796
357;;127.0.0.1;;127.0.0.1;TCP;[TCP segment of a reassembled PDU]
358;;127.0.0.1;;127.0.0.1;TCP;45668 → 8080 [ACK] Seq=198 Ack=140 Win=43776 Len=0 TSval=805796 TSecr=805796
359;;127.0.0.1;;127.0.0.1;TCP;[TCP segment of a reassembled PDU]
360;;127.0.0.1;;127.0.0.1;TCP;45668 → 8080 [ACK] Seq=198 Ack=186 Win=43776 Len=0 TSval=805796 TSecr=805796
361;;127.0.0.1;;127.0.0.1;TCP;[TCP segment of a reassembled PDU]
362;;127.0.0.1;;127.0.0.1;TCP;45668 → 8080 [ACK] Seq=198 Ack=188 Win=43776 Len=0 TSval=805796 TSecr=805796
363;;127.0.0.1;;127.0.0.1;TCP;[TCP segment of a reassembled PDU]
364;;127.0.0.1;;127.0.0.1;TCP;45668 → 8080 [ACK] Seq=198 Ack=8380 Win=174720 Len=0 TSval=805796 TSecr=805796
365;;127.0.0.1;;127.0.0.1;TCP;[TCP segment of a reassembled PDU]
366;;127.0.0.1;;127.0.0.1;TCP;45668 → 8080 [ACK] Seq=198 Ack=16572 Win=305664 Len=0 TSval=805796 TSecr=805796
367;;127.0.0.1;;127.0.0.1;TCP;[TCP segment of a reassembled PDU]
368;;127.0.0.1;;127.0.0.1;TCP;45668 → 8080 [ACK] Seq=198 Ack=24764 Win=436608 Len=0 TSval=805796 TSecr=805796
369;;127.0.0.1;;127.0.0.1;TCP;[TCP segment of a reassembled PDU]
370;;127.0.0.1;;127.0.0.1;TCP;45668 → 8080 [ACK] Seq=198 Ack=32956 Win=465536 Len=0 TSval=805796 TSecr=805796
371;;127.0.0.1;;127.0.0.1;TCP;[TCP segment of a reassembled PDU]
372;;127.0.0.1;;127.0.0.1;TCP;45668 → 8080 [ACK] Seq=198 Ack=41148 Win=465536 Len=0 TSval=805796 TSecr=805796
373;;127.0.0.1;;127.0.0.1;TCP;[TCP segment of a reassembled PDU]
374;;127.0.0.1;;127.0.0.1;TCP;45668 → 8080 [ACK] Seq=198 Ack=49340 Win=465536 Len=0 TSval=805796 TSecr=805796
375;;127.0.0.1;;127.0.0.1;TCP;[TCP segment of a reassembled PDU]
376;;127.0.0.1;;127.0.0.1;TCP;45668 → 8080 [ACK] Seq=198 Ack=57532 Win=465536 Len=0 TSval=805796 TSecr=805796
377;;127.0.0.1;;127.0.0.1;TCP;[TCP segment of a reassembled PDU]
378;;127.0.0.1;;127.0.0.1;TCP;45668 → 8080 [ACK] Seq=198 Ack=65724 Win=465536 Len=0 TSval=805796 TSecr=805796
379;;127.0.0.1;;127.0.0.1;TCP;[TCP segment of a reassembled PDU]
380;;127.0.0.1;;127.0.0.1;TCP;45668 → 8080 [ACK] Seq=198 Ack=73916 Win=465536 Len=0 TSval=805796 TSecr=805796
381;;127.0.0.1;;127.0.0.1;HTTP;HTTP/1.0 200 OK  (text/csv)
382;;127.0.0.1;;127.0.0.1;TCP;45668 → 8080 [ACK] Seq=198 Ack=77027 Win=465536 Len=0 TSval=805796 TSecr=805796
383;;127.0.0.1;;127.0.0.1;TCP;8080 → 45668 [FIN, ACK] Seq=77027 Ack=198 Win=44800 Len=0 TSval=805796 TSecr=805796
384;;127.0.0.1;;127.0.0.1;TCP;45668 → 8080 [FIN, ACK] Seq=198 Ack=77028 Win=465536 Len=0 TSval=805797 TSecr=805796
385;;127.0.0.1;;127.0.0.1;TCP;8080 → 45668 [ACK] Seq=77028 Ack=199 Win=44800 Len=0 TSval=805797 TSecr=805797
386;;127.0.0.1;;127.0.0.1;TCP;7687 → 41576 [PSH, ACK] Seq=1260 Ack=3051 Win=176896 Len=587 TSval=805822 TSecr=805509
387;;127.0.0.1;;127.0.0.1;TCP;41576 → 7687 [FIN, ACK] Seq=3051 Ack=1847 Win=48256 Len=0 TSval=805822 TSecr=805822
388;;127.0.0.1;;127.0.0.1;TCP;7687 → 41576 [FIN, ACK] Seq=1847 Ack=3052 Win=176896 Len=0 TSval=805822 TSecr=805822
389;;127.0.0.1;;127.0.0.1;TCP;41576 → 7687 [ACK] Seq=3052 Ack=1848 Win=48256 Len=0 TSval=805823 TSecr=805822
390;;127.0.0.1;;127.0.0.1;TCP;41592 → 7687 [SYN] Seq=0 Win=43690 Len=0 MSS=65495 SACK_PERM=1 TSval=805823 TSecr=0 WS=128
391;;127.0.0.1;;127.0.0.1;TCP;7687 → 41592 [SYN, ACK] Seq=0 Ack=1 Win=43690 Len=0 MSS=65495 SACK_PERM=1 TSval=805823 TSecr=805823 WS=128
392;;127.0.0.1;;127.0.0.1;TCP;41592 → 7687 [ACK] Seq=1 Ack=1 Win=43776 Len=0 TSval=805823 TSecr=805823
393;;127.0.0.1;;127.0.0.1;TCP;41592 → 7687 [PSH, ACK] Seq=1 Ack=1 Win=43776 Len=517 TSval=805823 TSecr=805823
394;;127.0.0.1;;127.0.0.1;TCP;7687 → 41592 [ACK] Seq=1 Ack=518 Win=44800 Len=0 TSval=805823 TSecr=805823
395;;127.0.0.1;;127.0.0.1;TCP;7687 → 41592 [PSH, ACK] Seq=1 Ack=518 Win=44800 Len=1120 TSval=805825 TSecr=805823
396;;127.0.0.1;;127.0.0.1;TCP;41592 → 7687 [ACK] Seq=518 Ack=1121 Win=45952 Len=0 TSval=805825 TSecr=805825
397;;127.0.0.1;;127.0.0.1;TCP;41592 → 7687 [PSH, ACK] Seq=518 Ack=1121 Win=45952 Len=126 TSval=805826 TSecr=805825
398;;127.0.0.1;;127.0.0.1;TCP;7687 → 41592 [PSH, ACK] Seq=1121 Ack=644 Win=44800 Len=51 TSval=805826 TSecr=805826
399;;127.0.0.1;;127.0.0.1;TCP;41592 → 7687 [PSH, ACK] Seq=644 Ack=1172 Win=45952 Len=49 TSval=805826 TSecr=805826
400;;127.0.0.1;;127.0.0.1;TCP;7687 → 41592 [PSH, ACK] Seq=1172 Ack=693 Win=44800 Len=33 TSval=805826 TSecr=805826
401;;127.0.0.1;;127.0.0.1;TCP;41592 → 7687 [PSH, ACK] Seq=693 Ack=1205 Win=45952 Len=108 TSval=805826 TSecr=805826
402;;127.0.0.1;;127.0.0.1;TCP;7687 → 41592 [PSH, ACK] Seq=1205 Ack=801 Win=44800 Len=55 TSval=805827 TSecr=805826
403;;127.0.0.1;;127.0.0.1;TCP;41592 → 7687 [PSH, ACK] Seq=801 Ack=1260 Win=45952 Len=287 TSval=805827 TSecr=805827
404;;127.0.0.1;;127.0.0.1;TCP;45672 → 8080 [SYN] Seq=0 Win=43690 Len=0 MSS=65495 SACK_PERM=1 TSval=805830 TSecr=0 WS=128
405;;127.0.0.1;;127.0.0.1;TCP;8080 → 45672 [SYN, ACK] Seq=0 Ack=1 Win=43690 Len=0 MSS=65495 SACK_PERM=1 TSval=805830 TSecr=805830 WS=128
406;;127.0.0.1;;127.0.0.1;TCP;45672 → 8080 [ACK] Seq=1 Ack=1 Win=43776 Len=0 TSval=805830 TSecr=805830
407;;127.0.0.1;;127.0.0.1;HTTP;GET /capture_00001_20170304180024.csv HTTP/1.1 
408;;127.0.0.1;;127.0.0.1;TCP;8080 → 45672 [ACK] Seq=1 Ack=198 Win=44800 Len=0 TSval=805830 TSecr=805830
409;;127.0.0.1;;127.0.0.1;TCP;[TCP segment of a reassembled PDU]
410;;127.0.0.1;;127.0.0.1;TCP;45672 → 8080 [ACK] Seq=198 Ack=18 Win=43776 Len=0 TSval=805830 TSecr=805830
411;;127.0.0.1;;127.0.0.1;TCP;[TCP segment of a reassembled PDU]
412;;127.0.0.1;;127.0.0.1;TCP;45672 → 8080 [ACK] Seq=198 Ack=56 Win=43776 Len=0 TSval=805830 TSecr=805830
413;;127.0.0.1;;127.0.0.1;TCP;[TCP segment of a reassembled PDU]
414;;127.0.0.1;;127.0.0.1;TCP;45672 → 8080 [ACK] Seq=198 Ack=93 Win=43776 Len=0 TSval=805830 TSecr=805830
415;;127.0.0.1;;127.0.0.1;TCP;[TCP segment of a reassembled PDU]
416;;127.0.0.1;;127.0.0.1;TCP;45672 → 8080 [ACK] Seq=198 Ack=117 Win=43776 Len=0 TSval=805830 TSecr=805830
417;;127.0.0.1;;127.0.0.1;TCP;[TCP segment of a reassembled PDU]
418;;127.0.0.1;;127.0.0.1;TCP;45672 → 8080 [ACK] Seq=198 Ack=140 Win=43776 Len=0 TSval=805830 TSecr=805830
419;;127.0.0.1;;127.0.0.1;TCP;[TCP segment of a reassembled PDU]
420;;127.0.0.1;;127.0.0.1;TCP;45672 → 8080 [ACK] Seq=198 Ack=186 Win=43776 Len=0 TSval=805830 TSecr=805830
421;;127.0.0.1;;127.0.0.1;TCP;[TCP segment of a reassembled PDU]
422;;127.0.0.1;;127.0.0.1;TCP;45672 → 8080 [ACK] Seq=198 Ack=188 Win=43776 Len=0 TSval=805830 TSecr=805830
423;;127.0.0.1;;127.0.0.1;TCP;[TCP segment of a reassembled PDU]
424;;127.0.0.1;;127.0.0.1;TCP;45672 → 8080 [ACK] Seq=198 Ack=8380 Win=174720 Len=0 TSval=805830 TSecr=805830
425;;127.0.0.1;;127.0.0.1;TCP;[TCP segment of a reassembled PDU]
426;;127.0.0.1;;127.0.0.1;TCP;45672 → 8080 [ACK] Seq=198 Ack=16572 Win=305664 Len=0 TSval=805830 TSecr=805830
427;;127.0.0.1;;127.0.0.1;TCP;[TCP segment of a reassembled PDU]
428;;127.0.0.1;;127.0.0.1;TCP;45672 → 8080 [ACK] Seq=198 Ack=24764 Win=436608 Len=0 TSval=805830 TSecr=805830
429;;127.0.0.1;;127.0.0.1;TCP;[TCP segment of a reassembled PDU]
430;;127.0.0.1;;127.0.0.1;TCP;45672 → 8080 [ACK] Seq=198 Ack=32956 Win=465536 Len=0 TSval=805830 TSecr=805830
431;;127.0.0.1;;127.0.0.1;TCP;[TCP segment of a reassembled PDU]
432;;127.0.0.1;;127.0.0.1;TCP;45672 → 8080 [ACK] Seq=198 Ack=41148 Win=465536 Len=0 TSval=805830 TSecr=805830
433;;127.0.0.1;;127.0.0.1;TCP;[TCP segment of a reassembled PDU]
434;;127.0.0.1;;127.0.0.1;TCP;45672 → 8080 [ACK] Seq=198 Ack=49340 Win=465536 Len=0 TSval=805830 TSecr=805830
435;;127.0.0.1;;127.0.0.1;TCP;[TCP segment of a reassembled PDU]
436;;127.0.0.1;;127.0.0.1;TCP;45672 → 8080 [ACK] Seq=198 Ack=57532 Win=465536 Len=0 TSval=805830 TSecr=805830
437;;127.0.0.1;;127.0.0.1;TCP;[TCP segment of a reassembled PDU]
438;;127.0.0.1;;127.0.0.1;TCP;45672 → 8080 [ACK] Seq=198 Ack=65724 Win=465536 Len=0 TSval=805830 TSecr=805830
439;;127.0.0.1;;127.0.0.1;TCP;[TCP segment of a reassembled PDU]
440;;127.0.0.1;;127.0.0.1;TCP;45672 → 8080 [ACK] Seq=198 Ack=73916 Win=465536 Len=0 TSval=805830 TSecr=805830
441;;127.0.0.1;;127.0.0.1;TCP;[TCP segment of a reassembled PDU]
442;;127.0.0.1;;127.0.0.1;TCP;45672 → 8080 [ACK] Seq=198 Ack=82108 Win=465536 Len=0 TSval=805830 TSecr=805830
443;;127.0.0.1;;127.0.0.1;HTTP;HTTP/1.0 200 OK  (text/csv)
444;;127.0.0.1;;127.0.0.1;TCP;45672 → 8080 [ACK] Seq=198 Ack=89176 Win=465536 Len=0 TSval=805830 TSecr=805830
445;;127.0.0.1;;127.0.0.1;TCP;8080 → 45672 [FIN, ACK] Seq=89176 Ack=198 Win=44800 Len=0 TSval=805830 TSecr=805830
446;;127.0.0.1;;127.0.0.1;TCP;45672 → 8080 [FIN, ACK] Seq=198 Ack=89177 Win=465536 Len=0 TSval=805831 TSecr=805830
447;;127.0.0.1;;127.0.0.1;TCP;8080 → 45672 [ACK] Seq=89177 Ack=199 Win=44800 Len=0 TSval=805831 TSecr=805831
448;;127.0.0.1;;127.0.0.1;TCP;7687 → 41592 [ACK] Seq=1260 Ack=1088 Win=45952 Len=0 TSval=805837 TSecr=805827
449;;127.0.0.1;;127.0.0.1;TCP;41592 → 7687 [PSH, ACK] Seq=1088 Ack=1260 Win=45952 Len=1963 TSval=805837 TSecr=805837
450;;127.0.0.1;;127.0.0.1;TCP;7687 → 41592 [ACK] Seq=1260 Ack=3051 Win=176896 Len=0 TSval=805837 TSecr=805837
451;;127.0.0.1;;127.0.0.1;TCP;45674 → 8080 [SYN] Seq=0 Win=43690 Len=0 MSS=65495 SACK_PERM=1 TSval=805861 TSecr=0 WS=128
452;;127.0.0.1;;127.0.0.1;TCP;8080 → 45674 [SYN, ACK] Seq=0 Ack=1 Win=43690 Len=0 MSS=65495 SACK_PERM=1 TSval=805861 TSecr=805861 WS=128
453;;127.0.0.1;;127.0.0.1;TCP;45674 → 8080 [ACK] Seq=1 Ack=1 Win=43776 Len=0 TSval=805861 TSecr=805861
454;;127.0.0.1;;127.0.0.1;HTTP;GET /capture_00001_20170304180024.csv HTTP/1.1 
455;;127.0.0.1;;127.0.0.1;TCP;8080 → 45674 [ACK] Seq=1 Ack=198 Win=44800 Len=0 TSval=805861 TSecr=805861
456;;127.0.0.1;;127.0.0.1;TCP;[TCP segment of a reassembled PDU]
457;;127.0.0.1;;127.0.0.1;TCP;45674 → 8080 [ACK] Seq=198 Ack=18 Win=43776 Len=0 TSval=805862 TSecr=805862
458;;127.0.0.1;;127.0.0.1;TCP;[TCP segment of a reassembled PDU]
459;;127.0.0.1;;127.0.0.1;TCP;45674 → 8080 [ACK] Seq=198 Ack=56 Win=43776 Len=0 TSval=805862 TSecr=805862
460;;127.0.0.1;;127.0.0.1;TCP;[TCP segment of a reassembled PDU]
461;;127.0.0.1;;127.0.0.1;TCP;45674 → 8080 [ACK] Seq=198 Ack=93 Win=43776 Len=0 TSval=805862 TSecr=805862
462;;127.0.0.1;;127.0.0.1;TCP;[TCP segment of a reassembled PDU]
463;;127.0.0.1;;127.0.0.1;TCP;45674 → 8080 [ACK] Seq=198 Ack=117 Win=43776 Len=0 TSval=805862 TSecr=805862
464;;127.0.0.1;;127.0.0.1;TCP;[TCP segment of a reassembled PDU]
465;;127.0.0.1;;127.0.0.1;TCP;45674 → 8080 [ACK] Seq=198 Ack=140 Win=43776 Len=0 TSval=805862 TSecr=805862
466;;127.0.0.1;;127.0.0.1;TCP;[TCP segment of a reassembled PDU]
467;;127.0.0.1;;127.0.0.1;TCP;45674 → 8080 [ACK] Seq=198 Ack=186 Win=43776 Len=0 TSval=805862 TSecr=805862
468;;127.0.0.1;;127.0.0.1;TCP;[TCP segment of a reassembled PDU]
469;;127.0.0.1;;127.0.0.1;TCP;45674 → 8080 [ACK] Seq=198 Ack=188 Win=43776 Len=0 TSval=805862 TSecr=805862
470;;127.0.0.1;;127.0.0.1;TCP;[TCP segment of a reassembled PDU]
471;;127.0.0.1;;127.0.0.1;TCP;45674 → 8080 [ACK] Seq=198 Ack=8380 Win=174720 Len=0 TSval=805862 TSecr=805862
472;;127.0.0.1;;127.0.0.1;TCP;[TCP segment of a reassembled PDU]
473;;127.0.0.1;;127.0.0.1;TCP;45674 → 8080 [ACK] Seq=198 Ack=16572 Win=305664 Len=0 TSval=805862 TSecr=805862
474;;127.0.0.1;;127.0.0.1;TCP;[TCP segment of a reassembled PDU]
475;;127.0.0.1;;127.0.0.1;TCP;45674 → 8080 [ACK] Seq=198 Ack=24764 Win=436608 Len=0 TSval=805862 TSecr=805862
476;;127.0.0.1;;127.0.0.1;TCP;[TCP segment of a reassembled PDU]
