frame.number;eth.src;ip.src;eth.dst;ip.dst;_ws.col.Protocol;_ws.col.Info
1;;127.0.0.1;;127.0.0.1;TCP;45710 → 8080 [ACK] Seq=1 Ack=1 Win=3637 Len=0 TSval=814058 TSecr=814058
2;;127.0.0.1;;127.0.0.1;TCP;8080 → 45710 [PSH, ACK] Seq=1 Ack=1 Win=350 Len=4234 TSval=814058 TSecr=814058
3;;127.0.0.1;;127.0.0.1;TCP;45710 → 8080 [ACK] Seq=1 Ack=4235 Win=3637 Len=0 TSval=814058 TSecr=814058
4;;127.0.0.1;;127.0.0.1;TCP;8080 → 45710 [FIN, ACK] Seq=4235 Ack=1 Win=350 Len=0 TSval=814058 TSecr=814058
5;;127.0.0.1;;127.0.0.1;TCP;45710 → 8080 [FIN, ACK] Seq=1 Ack=4236 Win=3637 Len=0 TSval=814059 TSecr=814058
6;;127.0.0.1;;127.0.0.1;TCP;8080 → 45710 [ACK] Seq=4236 Ack=2 Win=350 Len=0 TSval=814059 TSecr=814059
7;;127.0.0.1;;127.0.0.1;TCP;45712 → 8080 [SYN] Seq=0 Win=43690 Len=0 MSS=65495 SACK_PERM=1 TSval=814087 TSecr=0 WS=128
8;;127.0.0.1;;127.0.0.1;TCP;8080 → 45712 [SYN, ACK] Seq=0 Ack=1 Win=43690 Len=0 MSS=65495 SACK_PERM=1 TSval=814087 TSecr=814087 WS=128
9;;127.0.0.1;;127.0.0.1;TCP;45712 → 8080 [ACK] Seq=1 Ack=1 Win=43776 Len=0 TSval=814087 TSecr=814087
10;;127.0.0.1;;127.0.0.1;HTTP;GET /capture_00002_20170304180056.csv HTTP/1.1 
11;;127.0.0.1;;127.0.0.1;TCP;8080 → 45712 [ACK] Seq=1 Ack=198 Win=44800 Len=0 TSval=814087 TSecr=814087
12;;127.0.0.1;;127.0.0.1;TCP;[TCP segment of a reassembled PDU]
13;;127.0.0.1;;127.0.0.1;TCP;45712 → 8080 [ACK] Seq=198 Ack=18 Win=43776 Len=0 TSval=814088 TSecr=814088
14;;127.0.0.1;;127.0.0.1;TCP;[TCP segment of a reassembled PDU]
15;;127.0.0.1;;127.0.0.1;TCP;45712 → 8080 [ACK] Seq=198 Ack=56 Win=43776 Len=0 TSval=814088 TSecr=814088
16;;127.0.0.1;;127.0.0.1;TCP;[TCP segment of a reassembled PDU]
17;;127.0.0.1;;127.0.0.1;TCP;45712 → 8080 [ACK] Seq=198 Ack=93 Win=43776 Len=0 TSval=814088 TSecr=814088
18;;127.0.0.1;;127.0.0.1;TCP;[TCP segment of a reassembled PDU]
19;;127.0.0.1;;127.0.0.1;TCP;45712 → 8080 [ACK] Seq=198 Ack=117 Win=43776 Len=0 TSval=814088 TSecr=814088
20;;127.0.0.1;;127.0.0.1;TCP;[TCP segment of a reassembled PDU]
21;;127.0.0.1;;127.0.0.1;TCP;45712 → 8080 [ACK] Seq=198 Ack=140 Win=43776 Len=0 TSval=814088 TSecr=814088
22;;127.0.0.1;;127.0.0.1;TCP;[TCP segment of a reassembled PDU]
23;;127.0.0.1;;127.0.0.1;TCP;45712 → 8080 [ACK] Seq=198 Ack=186 Win=43776 Len=0 TSval=814088 TSecr=814088
24;;127.0.0.1;;127.0.0.1;TCP;[TCP segment of a reassembled PDU]
25;;127.0.0.1;;127.0.0.1;TCP;45712 → 8080 [ACK] Seq=198 Ack=188 Win=43776 Len=0 TSval=814088 TSecr=814088
26;;127.0.0.1;;127.0.0.1;TCP;[TCP segment of a reassembled PDU]
27;;127.0.0.1;;127.0.0.1;TCP;45712 → 8080 [ACK] Seq=198 Ack=8380 Win=174720 Len=0 TSval=814088 TSecr=814088
28;;127.0.0.1;;127.0.0.1;TCP;[TCP segment of a reassembled PDU]
29;;127.0.0.1;;127.0.0.1;TCP;45712 → 8080 [ACK] Seq=198 Ack=16572 Win=305664 Len=0 TSval=814088 TSecr=814088
30;;127.0.0.1;;127.0.0.1;TCP;[TCP segment of a reassembled PDU]
31;;127.0.0.1;;127.0.0.1;TCP;45712 → 8080 [ACK] Seq=198 Ack=24764 Win=436608 Len=0 TSval=814088 TSecr=814088
32;;127.0.0.1;;127.0.0.1;TCP;[TCP segment of a reassembled PDU]
33;;127.0.0.1;;127.0.0.1;TCP;45712 → 8080 [ACK] Seq=198 Ack=32956 Win=465536 Len=0 TSval=814088 TSecr=814088
34;;127.0.0.1;;127.0.0.1;TCP;[TCP segment of a reassembled PDU]
35;;127.0.0.1;;127.0.0.1;TCP;45712 → 8080 [ACK] Seq=198 Ack=41148 Win=465536 Len=0 TSval=814088 TSecr=814088
36;;127.0.0.1;;127.0.0.1;HTTP;HTTP/1.0 200 OK  (text/csv)
37;;127.0.0.1;;127.0.0.1;TCP;45712 → 8080 [ACK] Seq=198 Ack=45382 Win=465536 Len=0 TSval=814088 TSecr=814088
38;;127.0.0.1;;127.0.0.1;TCP;8080 → 45712 [FIN, ACK] Seq=45382 Ack=198 Win=44800 Len=0 TSval=814088 TSecr=814088
39;;127.0.0.1;;127.0.0.1;TCP;45712 → 8080 [FIN, ACK] Seq=198 Ack=45383 Win=465536 Len=0 TSval=814088 TSecr=814088
40;;127.0.0.1;;127.0.0.1;TCP;8080 → 45712 [ACK] Seq=45383 Ack=199 Win=44800 Len=0 TSval=814088 TSecr=814088
41;;127.0.0.1;;127.0.0.1;TCP;45714 → 8080 [SYN] Seq=0 Win=43690 Len=0 MSS=65495 SACK_PERM=1 TSval=814134 TSecr=0 WS=128
42;;127.0.0.1;;127.0.0.1;TCP;8080 → 45714 [SYN, ACK] Seq=0 Ack=1 Win=43690 Len=0 MSS=65495 SACK_PERM=1 TSval=814134 TSecr=814134 WS=128
43;;127.0.0.1;;127.0.0.1;TCP;45714 → 8080 [ACK] Seq=1 Ack=1 Win=43776 Len=0 TSval=814134 TSecr=814134
44;;127.0.0.1;;127.0.0.1;HTTP;GET /capture_00002_20170304180056.csv HTTP/1.1 
45;;127.0.0.1;;127.0.0.1;TCP;8080 → 45714 [ACK] Seq=1 Ack=198 Win=44800 Len=0 TSval=814134 TSecr=814134
46;;127.0.0.1;;127.0.0.1;TCP;[TCP segment of a reassembled PDU]
47;;127.0.0.1;;127.0.0.1;TCP;45714 → 8080 [ACK] Seq=198 Ack=18 Win=43776 Len=0 TSval=814134 TSecr=814134
48;;127.0.0.1;;127.0.0.1;TCP;[TCP segment of a reassembled PDU]
49;;127.0.0.1;;127.0.0.1;TCP;45714 → 8080 [ACK] Seq=198 Ack=56 Win=43776 Len=0 TSval=814134 TSecr=814134
50;;127.0.0.1;;127.0.0.1;TCP;[TCP segment of a reassembled PDU]
51;;127.0.0.1;;127.0.0.1;TCP;45714 → 8080 [ACK] Seq=198 Ack=93 Win=43776 Len=0 TSval=814134 TSecr=814134
52;;127.0.0.1;;127.0.0.1;TCP;[TCP segment of a reassembled PDU]
53;;127.0.0.1;;127.0.0.1;TCP;45714 → 8080 [ACK] Seq=198 Ack=117 Win=43776 Len=0 TSval=814134 TSecr=814134
54;;127.0.0.1;;127.0.0.1;TCP;[TCP segment of a reassembled PDU]
55;;127.0.0.1;;127.0.0.1;TCP;45714 → 8080 [ACK] Seq=198 Ack=140 Win=43776 Len=0 TSval=814134 TSecr=814134
56;;127.0.0.1;;127.0.0.1;TCP;[TCP segment of a reassembled PDU]
57;;127.0.0.1;;127.0.0.1;TCP;45714 → 8080 [ACK] Seq=198 Ack=186 Win=43776 Len=0 TSval=814134 TSecr=814134
58;;127.0.0.1;;127.0.0.1;TCP;[TCP segment of a reassembled PDU]
59;;127.0.0.1;;127.0.0.1;TCP;45714 → 8080 [ACK] Seq=198 Ack=188 Win=43776 Len=0 TSval=814134 TSecr=814134
60;;127.0.0.1;;127.0.0.1;TCP;[TCP segment of a reassembled PDU]
61;;127.0.0.1;;127.0.0.1;TCP;45714 → 8080 [ACK] Seq=198 Ack=8380 Win=174720 Len=0 TSval=814134 TSecr=814134
62;;127.0.0.1;;127.0.0.1;TCP;[TCP segment of a reassembled PDU]
63;;127.0.0.1;;127.0.0.1;TCP;45714 → 8080 [ACK] Seq=198 Ack=16572 Win=305664 Len=0 TSval=814134 TSecr=814134
64;;127.0.0.1;;127.0.0.1;TCP;[TCP segment of a reassembled PDU]
65;;127.0.0.1;;127.0.0.1;TCP;45714 → 8080 [ACK] Seq=198 Ack=24764 Win=436608 Len=0 TSval=814134 TSecr=814134
66;;127.0.0.1;;127.0.0.1;TCP;[TCP segment of a reassembled PDU]
67;;127.0.0.1;;127.0.0.1;TCP;45714 → 8080 [ACK] Seq=198 Ack=32956 Win=465536 Len=0 TSval=814134 TSecr=814134
68;;127.0.0.1;;127.0.0.1;TCP;[TCP segment of a reassembled PDU]
69;;127.0.0.1;;127.0.0.1;TCP;45714 → 8080 [ACK] Seq=198 Ack=41148 Win=465536 Len=0 TSval=814134 TSecr=814134
70;;127.0.0.1;;127.0.0.1;HTTP;HTTP/1.0 200 OK  (text/csv)
71;;127.0.0.1;;127.0.0.1;TCP;45714 → 8080 [ACK] Seq=198 Ack=45382 Win=465536 Len=0 TSval=814134 TSecr=814134
72;;127.0.0.1;;127.0.0.1;TCP;8080 → 45714 [FIN, ACK] Seq=45382 Ack=198 Win=44800 Len=0 TSval=814134 TSecr=814134
73;;127.0.0.1;;127.0.0.1;TCP;45714 → 8080 [FIN, ACK] Seq=198 Ack=45383 Win=465536 Len=0 TSval=814134 TSecr=814134
74;;127.0.0.1;;127.0.0.1;TCP;8080 → 45714 [ACK] Seq=45383 Ack=199 Win=44800 Len=0 TSval=814134 TSecr=814134
75;;127.0.0.1;;127.0.0.1;TCP;45716 → 8080 [SYN] Seq=0 Win=43690 Len=0 MSS=65495 SACK_PERM=1 TSval=814172 TSecr=0 WS=128
76;;127.0.0.1;;127.0.0.1;TCP;8080 → 45716 [SYN, ACK] Seq=0 Ack=1 Win=43690 Len=0 MSS=65495 SACK_PERM=1 TSval=814172 TSecr=814172 WS=128
77;;127.0.0.1;;127.0.0.1;TCP;45716 → 8080 [ACK] Seq=1 Ack=1 Win=43776 Len=0 TSval=814172 TSecr=814172
78;;127.0.0.1;;127.0.0.1;HTTP;GET /capture_00002_20170304180056.csv HTTP/1.1 
79;;127.0.0.1;;127.0.0.1;TCP;8080 → 45716 [ACK] Seq=1 Ack=198 Win=44800 Len=0 TSval=814172 TSecr=814172
80;;127.0.0.1;;127.0.0.1;TCP;[TCP segment of a reassembled PDU]
81;;127.0.0.1;;127.0.0.1;TCP;45716 → 8080 [ACK] Seq=198 Ack=18 Win=43776 Len=0 TSval=814172 TSecr=814172
82;;127.0.0.1;;127.0.0.1;TCP;[TCP segment of a reassembled PDU]
83;;127.0.0.1;;127.0.0.1;TCP;45716 → 8080 [ACK] Seq=198 Ack=56 Win=43776 Len=0 TSval=814172 TSecr=814172
84;;127.0.0.1;;127.0.0.1;TCP;[TCP segment of a reassembled PDU]
85;;127.0.0.1;;127.0.0.1;TCP;45716 → 8080 [ACK] Seq=198 Ack=93 Win=43776 Len=0 TSval=814172 TSecr=814172
86;;127.0.0.1;;127.0.0.1;TCP;[TCP segment of a reassembled PDU]
87;;127.0.0.1;;127.0.0.1;TCP;45716 → 8080 [ACK] Seq=198 Ack=117 Win=43776 Len=0 TSval=814172 TSecr=814172
88;;127.0.0.1;;127.0.0.1;TCP;[TCP segment of a reassembled PDU]
89;;127.0.0.1;;127.0.0.1;TCP;45716 → 8080 [ACK] Seq=198 Ack=140 Win=43776 Len=0 TSval=814172 TSecr=814172
90;;127.0.0.1;;127.0.0.1;TCP;[TCP segment of a reassembled PDU]
91;;127.0.0.1;;127.0.0.1;TCP;45716 → 8080 [ACK] Seq=198 Ack=186 Win=43776 Len=0 TSval=814172 TSecr=814172
92;;127.0.0.1;;127.0.0.1;TCP;[TCP segment of a reassembled PDU]
93;;127.0.0.1;;127.0.0.1;TCP;45716 → 8080 [ACK] Seq=198 Ack=188 Win=43776 Len=0 TSval=814172 TSecr=814172
94;;127.0.0.1;;127.0.0.1;TCP;[TCP segment of a reassembled PDU]
95;;127.0.0.1;;127.0.0.1;TCP;45716 → 8080 [ACK] Seq=198 Ack=8380 Win=174720 Len=0 TSval=814172 TSecr=814172
96;;127.0.0.1;;127.0.0.1;TCP;[TCP segment of a reassembled PDU]
97;;127.0.0.1;;127.0.0.1;TCP;45716 → 8080 [ACK] Seq=198 Ack=16572 Win=305664 Len=0 TSval=814172 TSecr=814172
98;;127.0.0.1;;127.0.0.1;TCP;[TCP segment of a reassembled PDU]
99;;127.0.0.1;;127.0.0.1;TCP;45716 → 8080 [ACK] Seq=198 Ack=24764 Win=436608 Len=0 TSval=814172 TSecr=814172
100;;127.0.0.1;;127.0.0.1;TCP;[TCP segment of a reassembled PDU]
101;;127.0.0.1;;127.0.0.1;TCP;45716 → 8080 [ACK] Seq=198 Ack=32956 Win=465536 Len=0 TSval=814172 TSecr=814172
102;;127.0.0.1;;127.0.0.1;TCP;[TCP segment of a reassembled PDU]
103;;127.0.0.1;;127.0.0.1;TCP;45716 → 8080 [ACK] Seq=198 Ack=41148 Win=465536 Len=0 TSval=814172 TSecr=814172
104;;127.0.0.1;;127.0.0.1;HTTP;HTTP/1.0 200 OK  (text/csv)
105;;127.0.0.1;;127.0.0.1;TCP;45716 → 8080 [ACK] Seq=198 Ack=45382 Win=465536 Len=0 TSval=814172 TSecr=814172
106;;127.0.0.1;;127.0.0.1;TCP;8080 → 45716 [FIN, ACK] Seq=45382 Ack=198 Win=44800 Len=0 TSval=814172 TSecr=814172
107;;127.0.0.1;;127.0.0.1;TCP;45716 → 8080 [FIN, ACK] Seq=198 Ack=45383 Win=465536 Len=0 TSval=814172 TSecr=814172
108;;127.0.0.1;;127.0.0.1;TCP;8080 → 45716 [ACK] Seq=45383 Ack=199 Win=44800 Len=0 TSval=814172 TSecr=814172
109;;127.0.0.1;;127.0.0.1;TCP;45718 → 8080 [SYN] Seq=0 Win=43690 Len=0 MSS=65495 SACK_PERM=1 TSval=814209 TSecr=0 WS=128
110;;127.0.0.1;;127.0.0.1;TCP;8080 → 45718 [SYN, ACK] Seq=0 Ack=1 Win=43690 Len=0 MSS=65495 SACK_PERM=1 TSval=814209 TSecr=814209 WS=128
111;;127.0.0.1;;127.0.0.1;TCP;45718 → 8080 [ACK] Seq=1 Ack=1 Win=43776 Len=0 TSval=814209 TSecr=814209
112;;127.0.0.1;;127.0.0.1;HTTP;GET /capture_00002_20170304180056.csv HTTP/1.1 
113;;127.0.0.1;;127.0.0.1;TCP;8080 → 45718 [ACK] Seq=1 Ack=198 Win=44800 Len=0 TSval=814209 TSecr=814209
114;;127.0.0.1;;127.0.0.1;TCP;[TCP segment of a reassembled PDU]
115;;127.0.0.1;;127.0.0.1;TCP;45718 → 8080 [ACK] Seq=198 Ack=18 Win=43776 Len=0 TSval=814210 TSecr=814210
116;;127.0.0.1;;127.0.0.1;TCP;[TCP segment of a reassembled PDU]
117;;127.0.0.1;;127.0.0.1;TCP;45718 → 8080 [ACK] Seq=198 Ack=56 Win=43776 Len=0 TSval=814210 TSecr=814210
118;;127.0.0.1;;127.0.0.1;TCP;[TCP segment of a reassembled PDU]
119;;127.0.0.1;;127.0.0.1;TCP;45718 → 8080 [ACK] Seq=198 Ack=93 Win=43776 Len=0 TSval=814210 TSecr=814210
120;;127.0.0.1;;127.0.0.1;TCP;[TCP segment of a reassembled PDU]
121;;127.0.0.1;;127.0.0.1;TCP;45718 → 8080 [ACK] Seq=198 Ack=117 Win=43776 Len=0 TSval=814210 TSecr=814210
122;;127.0.0.1;;127.0.0.1;TCP;[TCP segment of a reassembled PDU]
123;;127.0.0.1;;127.0.0.1;TCP;45718 → 8080 [ACK] Seq=198 Ack=140 Win=43776 Len=0 TSval=814210 TSecr=814210
124;;127.0.0.1;;127.0.0.1;TCP;[TCP segment of a reassembled PDU]
125;;127.0.0.1;;127.0.0.1;TCP;45718 → 8080 [ACK] Seq=198 Ack=186 Win=43776 Len=0 TSval=814210 TSecr=814210
126;;127.0.0.1;;127.0.0.1;TCP;[TCP segment of a reassembled PDU]
127;;127.0.0.1;;127.0.0.1;TCP;45718 → 8080 [ACK] Seq=198 Ack=188 Win=43776 Len=0 TSval=814210 TSecr=814210
128;;127.0.0.1;;127.0.0.1;TCP;[TCP segment of a reassembled PDU]
129;;127.0.0.1;;127.0.0.1;TCP;45718 → 8080 [ACK] Seq=198 Ack=8380 Win=174720 Len=0 TSval=814210 TSecr=814210
130;;127.0.0.1;;127.0.0.1;TCP;[TCP segment of a reassembled PDU]
131;;127.0.0.1;;127.0.0.1;TCP;45718 → 8080 [ACK] Seq=198 Ack=16572 Win=305664 Len=0 TSval=814210 TSecr=814210
132;;127.0.0.1;;127.0.0.1;TCP;[TCP segment of a reassembled PDU]
133;;127.0.0.1;;127.0.0.1;TCP;45718 → 8080 [ACK] Seq=198 Ack=24764 Win=436608 Len=0 TSval=814210 TSecr=814210
134;;127.0.0.1;;127.0.0.1;TCP;[TCP segment of a reassembled PDU]
135;;127.0.0.1;;127.0.0.1;TCP;45718 → 8080 [ACK] Seq=198 Ack=32956 Win=465536 Len=0 TSval=814210 TSecr=814210
136;;127.0.0.1;;127.0.0.1;TCP;[TCP segment of a reassembled PDU]
137;;127.0.0.1;;127.0.0.1;TCP;45718 → 8080 [ACK] Seq=198 Ack=41148 Win=465536 Len=0 TSval=814210 TSecr=814210
138;;127.0.0.1;;127.0.0.1;HTTP;HTTP/1.0 200 OK  (text/csv)
139;;127.0.0.1;;127.0.0.1;TCP;45718 → 8080 [ACK] Seq=198 Ack=45382 Win=465536 Len=0 TSval=814210 TSecr=814210
140;;127.0.0.1;;127.0.0.1;TCP;8080 → 45718 [FIN, ACK] Seq=45382 Ack=198 Win=44800 Len=0 TSval=814210 TSecr=814210
141;;127.0.0.1;;127.0.0.1;TCP;45718 → 8080 [FIN, ACK] Seq=198 Ack=45383 Win=465536 Len=0 TSval=814210 TSecr=814210
142;;127.0.0.1;;127.0.0.1;TCP;8080 → 45718 [ACK] Seq=45383 Ack=199 Win=44800 Len=0 TSval=814210 TSecr=814210
143;;127.0.0.1;;127.0.0.1;TCP;7687 → 41626 [PSH, ACK] Seq=1 Ack=1 Win=1382 Len=585 TSval=814235 TSecr=813992
144;;127.0.0.1;;127.0.0.1;TCP;41626 → 7687 [FIN, ACK] Seq=1 Ack=586 Win=377 Len=0 TSval=814236 TSecr=814235
145;;127.0.0.1;;127.0.0.1;TCP;7687 → 41626 [FIN, ACK] Seq=586 Ack=2 Win=1382 Len=0 TSval=814236 TSecr=814236
146;;127.0.0.1;;127.0.0.1;TCP;41626 → 7687 [ACK] Seq=2 Ack=587 Win=377 Len=0 TSval=814236 TSecr=814236
147;;127.0.0.1;;127.0.0.1;DNS;Standard query 0x2db1 A www.google.com
148;;127.0.0.1,127.0.0.1;;127.0.0.1,127.0.0.1;ICMP;Destination unreachable (Port unreachable)
149;;127.0.0.1;;127.0.0.1;DNS;Standard query 0xdc53 A www.google.com
150;;127.0.0.1,127.0.0.1;;127.0.0.1,127.0.0.1;ICMP;Destination unreachable (Port unreachable)
151;;127.0.0.1;;127.0.0.1;DNS;Standard query 0x4913 A www.google.com
152;;127.0.0.1,127.0.0.1;;127.0.0.1,127.0.0.1;ICMP;Destination unreachable (Port unreachable)
153;;127.0.0.1;;127.0.0.1;DNS;Standard query 0x4913 A www.google.com
154;;127.0.0.1,127.0.0.1;;127.0.0.1,127.0.0.1;ICMP;Destination unreachable (Port unreachable)
155;;127.0.0.1;;127.0.0.1;DNS;Standard query 0xe791 A www.google.com
156;;127.0.0.1,127.0.0.1;;127.0.0.1,127.0.0.1;ICMP;Destination unreachable (Port unreachable)
157;;127.0.0.1;;127.0.0.1;DNS;Standard query 0xe791 A www.google.com
158;;127.0.0.1,127.0.0.1;;127.0.0.1,127.0.0.1;ICMP;Destination unreachable (Port unreachable)
159;;127.0.0.1;;127.0.0.1;DNS;Standard query 0x3571 A ntp.ubuntu.com
160;;127.0.0.1,127.0.0.1;;127.0.0.1,127.0.0.1;ICMP;Destination unreachable (Port unreachable)
161;;127.0.0.1;;127.0.0.1;DNS;Standard query 0xf5a8 AAAA ntp.ubuntu.com
162;;127.0.0.1,127.0.0.1;;127.0.0.1,127.0.0.1;ICMP;Destination unreachable (Port unreachable)
163;;127.0.0.1;;127.0.0.1;DNS;Standard query 0x3571 A ntp.ubuntu.com
164;;127.0.0.1,127.0.0.1;;127.0.0.1,127.0.0.1;ICMP;Destination unreachable (Port unreachable)
165;;127.0.0.1;;127.0.0.1;DNS;Standard query 0xf5a8 AAAA ntp.ubuntu.com
166;;127.0.0.1,127.0.0.1;;127.0.0.1,127.0.0.1;ICMP;Destination unreachable (Port unreachable)
167;;127.0.0.1;;127.0.0.1;DNS;Standard query 0x19b4 A ntp.ubuntu.com
168;;127.0.0.1,127.0.0.1;;127.0.0.1,127.0.0.1;ICMP;Destination unreachable (Port unreachable)
169;;127.0.0.1;;127.0.0.1;DNS;Standard query 0xedc2 AAAA ntp.ubuntu.com
170;;127.0.0.1,127.0.0.1;;127.0.0.1,127.0.0.1;ICMP;Destination unreachable (Port unreachable)
171;;127.0.0.1;;127.0.0.1;DNS;Standard query 0x19b4 A ntp.ubuntu.com
172;;127.0.0.1,127.0.0.1;;127.0.0.1,127.0.0.1;ICMP;Destination unreachable (Port unreachable)
173;;127.0.0.1;;127.0.0.1;DNS;Standard query 0xedc2 AAAA ntp.ubuntu.com
174;;127.0.0.1,127.0.0.1;;127.0.0.1,127.0.0.1;ICMP;Destination unreachable (Port unreachable)
175;;127.0.0.1;;127.0.0.1;DNS;Standard query 0xbba1 A ntp.ubuntu.com
176;;127.0.0.1,127.0.0.1;;127.0.0.1,127.0.0.1;ICMP;Destination unreachable (Port unreachable)
177;;127.0.0.1;;127.0.0.1;DNS;Standard query 0xa984 AAAA ntp.ubuntu.com
178;;127.0.0.1,127.0.0.1;;127.0.0.1,127.0.0.1;ICMP;Destination unreachable (Port unreachable)
179;;127.0.0.1;;127.0.0.1;DNS;Standard query 0xbba1 A ntp.ubuntu.com
180;;127.0.0.1,127.0.0.1;;127.0.0.1,127.0.0.1;ICMP;Destination unreachable (Port unreachable)
181;;127.0.0.1;;127.0.0.1;DNS;Standard query 0xa984 AAAA ntp.ubuntu.com
182;;127.0.0.1,127.0.0.1;;127.0.0.1,127.0.0.1;ICMP;Destination unreachable (Port unreachable)
183;;127.0.0.1;;127.0.0.1;DNS;Standard query 0x1fef A ntp.ubuntu.com
184;;127.0.0.1,127.0.0.1;;127.0.0.1,127.0.0.1;ICMP;Destination unreachable (Port unreachable)
185;;127.0.0.1;;127.0.0.1;DNS;Standard query 0x415c AAAA ntp.ubuntu.com
186;;127.0.0.1,127.0.0.1;;127.0.0.1,127.0.0.1;ICMP;Destination unreachable (Port unreachable)
187;;127.0.0.1;;127.0.0.1;DNS;Standard query 0x1fef A ntp.ubuntu.com
188;;127.0.0.1,127.0.0.1;;127.0.0.1,127.0.0.1;ICMP;Destination unreachable (Port unreachable)
189;;127.0.0.1;;127.0.0.1;DNS;Standard query 0x415c AAAA ntp.ubuntu.com
190;;127.0.0.1,127.0.0.1;;127.0.0.1,127.0.0.1;ICMP;Destination unreachable (Port unreachable)
191;;127.0.0.1;;127.0.0.1;DNS;Standard query 0xaf87 A ntp.ubuntu.com
192;;127.0.0.1,127.0.0.1;;127.0.0.1,127.0.0.1;ICMP;Destination unreachable (Port unreachable)
193;;127.0.0.1;;127.0.0.1;DNS;Standard query 0x7fbb AAAA ntp.ubuntu.com
194;;127.0.0.1,127.0.0.1;;127.0.0.1,127.0.0.1;ICMP;Destination unreachable (Port unreachable)
195;;127.0.0.1;;127.0.0.1;DNS;Standard query 0xaf87 A ntp.ubuntu.com
196;;127.0.0.1,127.0.0.1;;127.0.0.1,127.0.0.1;ICMP;Destination unreachable (Port unreachable)
197;;127.0.0.1;;127.0.0.1;DNS;Standard query 0x7fbb AAAA ntp.ubuntu.com
198;;127.0.0.1,127.0.0.1;;127.0.0.1,127.0.0.1;ICMP;Destination unreachable (Port unreachable)
199;;127.0.0.1;;127.0.0.1;DNS;Standard query 0x0ff8 A ntp.ubuntu.com
200;;127.0.0.1,127.0.0.1;;127.0.0.1,127.0.0.1;ICMP;Destination unreachable (Port unreachable)
201;;127.0.0.1;;127.0.0.1;DNS;Standard query 0xb739 AAAA ntp.ubuntu.com
202;;127.0.0.1,127.0.0.1;;127.0.0.1,127.0.0.1;ICMP;Destination unreachable (Port unreachable)
203;;127.0.0.1;;127.0.0.1;DNS;Standard query 0x0ff8 A ntp.ubuntu.com
204;;127.0.0.1,127.0.0.1;;127.0.0.1,127.0.0.1;ICMP;Destination unreachable (Port unreachable)
205;;127.0.0.1;;127.0.0.1;DNS;Standard query 0xb739 AAAA ntp.ubuntu.com
206;;127.0.0.1,127.0.0.1;;127.0.0.1,127.0.0.1;ICMP;Destination unreachable (Port unreachable)
207;;127.0.0.1;;127.0.0.1;DNS;Standard query 0xcd22 A ntp.ubuntu.com
208;;127.0.0.1,127.0.0.1;;127.0.0.1,127.0.0.1;ICMP;Destination unreachable (Port unreachable)
209;;127.0.0.1;;127.0.0.1;DNS;Standard query 0xfd13 AAAA ntp.ubuntu.com
210;;127.0.0.1,127.0.0.1;;127.0.0.1,127.0.0.1;ICMP;Destination unreachable (Port unreachable)
211;;127.0.0.1;;127.0.0.1;DNS;Standard query 0xcd22 A ntp.ubuntu.com
212;;127.0.0.1,127.0.0.1;;127.0.0.1,127.0.0.1;ICMP;Destination unreachable (Port unreachable)
213;;127.0.0.1;;127.0.0.1;DNS;Standard query 0xfd13 AAAA ntp.ubuntu.com
214;;127.0.0.1,127.0.0.1;;127.0.0.1,127.0.0.1;ICMP;Destination unreachable (Port unreachable)
215;;127.0.0.1;;127.0.0.1;DNS;Standard query 0x0b01 A ntp.ubuntu.com
216;;127.0.0.1,127.0.0.1;;127.0.0.1,127.0.0.1;ICMP;Destination unreachable (Port unreachable)
217;;127.0.0.1;;127.0.0.1;DNS;Standard query 0x73f2 AAAA ntp.ubuntu.com
218;;127.0.0.1,127.0.0.1;;127.0.0.1,127.0.0.1;ICMP;Destination unreachable (Port unreachable)
219;;127.0.0.1;;127.0.0.1;DNS;Standard query 0x0b01 A ntp.ubuntu.com
220;;127.0.0.1,127.0.0.1;;127.0.0.1,127.0.0.1;ICMP;Destination unreachable (Port unreachable)
221;;127.0.0.1;;127.0.0.1;DNS;Standard query 0x73f2 AAAA ntp.ubuntu.com
222;;127.0.0.1,127.0.0.1;;127.0.0.1,127.0.0.1;ICMP;Destination unreachable (Port unreachable)
223;;127.0.0.1;;127.0.0.1;DNS;Standard query 0xeba5 A ntp.ubuntu.com
224;;127.0.0.1,127.0.0.1;;127.0.0.1,127.0.0.1;ICMP;Destination unreachable (Port unreachable)
225;;127.0.0.1;;127.0.0.1;DNS;Standard query 0xe35f AAAA ntp.ubuntu.com
226;;127.0.0.1,127.0.0.1;;127.0.0.1,127.0.0.1;ICMP;Destination unreachable (Port unreachable)
227;;127.0.0.1;;127.0.0.1;DNS;Standard query 0xeba5 A ntp.ubuntu.com
228;;127.0.0.1,127.0.0.1;;127.0.0.1,127.0.0.1;ICMP;Destination unreachable (Port unreachable)
229;;127.0.0.1;;127.0.0.1;DNS;Standard query 0xe35f AAAA ntp.ubuntu.com
230;;127.0.0.1,127.0.0.1;;127.0.0.1,127.0.0.1;ICMP;Destination unreachable (Port unreachable)
231;;127.0.0.1;;127.0.0.1;DNS;Standard query 0x5184 A ntp.ubuntu.com
232;;127.0.0.1,127.0.0.1;;127.0.0.1,127.0.0.1;ICMP;Destination unreachable (Port unreachable)
233;;127.0.0.1;;127.0.0.1;DNS;Standard query 0x61ac AAAA ntp.ubuntu.com
234;;127.0.0.1,127.0.0.1;;127.0.0.1,127.0.0.1;ICMP;Destination unreachable (Port unreachable)
235;;127.0.0.1;;127.0.0.1;DNS;Standard query 0x5184 A ntp.ubuntu.com
236;;127.0.0.1,127.0.0.1;;127.0.0.1,127.0.0.1;ICMP;Destination unreachable (Port unreachable)
237;;127.0.0.1;;127.0.0.1;DNS;Standard query 0x61ac AAAA ntp.ubuntu.com
238;;127.0.0.1,127.0.0.1;;127.0.0.1,127.0.0.1;ICMP;Destination unreachable (Port unreachable)
239;;127.0.0.1;;127.0.0.1;DNS;Standard query 0x91ad A ntp.ubuntu.com
240;;127.0.0.1,127.0.0.1;;127.0.0.1,127.0.0.1;ICMP;Destination unreachable (Port unreachable)
241;;127.0.0.1;;127.0.0.1;DNS;Standard query 0x6db7 AAAA ntp.ubuntu.com
242;;127.0.0.1,127.0.0.1;;127.0.0.1,127.0.0.1;ICMP;Destination unreachable (Port unreachable)
243;;127.0.0.1;;127.0.0.1;DNS;Standard query 0x91ad A ntp.ubuntu.com
244;;127.0.0.1,127.0.0.1;;127.0.0.1,127.0.0.1;ICMP;Destination unreachable (Port unreachable)
245;;127.0.0.1;;127.0.0.1;DNS;Standard query 0x6db7 AAAA ntp.ubuntu.com
246;;127.0.0.1,127.0.0.1;;127.0.0.1,127.0.0.1;ICMP;Destination unreachable (Port unreachable)
247;;127.0.0.1;;127.0.0.1;DNS;Standard query 0x9bc8 A ntp.ubuntu.com
248;;127.0.0.1,127.0.0.1;;127.0.0.1,127.0.0.1;ICMP;Destination unreachable (Port unreachable)
249;;127.0.0.1;;127.0.0.1;DNS;Standard query 0xedde AAAA ntp.ubuntu.com
250;;127.0.0.1,127.0.0.1;;127.0.0.1,127.0.0.1;ICMP;Destination unreachable (Port unreachable)
251;;127.0.0.1;;127.0.0.1;DNS;Standard query 0x9bc8 A ntp.ubuntu.com
252;;127.0.0.1,127.0.0.1;;127.0.0.1,127.0.0.1;ICMP;Destination unreachable (Port unreachable)
253;;127.0.0.1;;127.0.0.1;DNS;Standard query 0xedde AAAA ntp.ubuntu.com
254;;127.0.0.1,127.0.0.1;;127.0.0.1,127.0.0.1;ICMP;Destination unreachable (Port unreachable)
255;;127.0.0.1;;127.0.0.1;DNS;Standard query 0xcf52 A ntp.ubuntu.com
256;;127.0.0.1,127.0.0.1;;127.0.0.1,127.0.0.1;ICMP;Destination unreachable (Port unreachable)
257;;127.0.0.1;;127.0.0.1;DNS;Standard query 0x55cd AAAA ntp.ubuntu.com
258;;127.0.0.1,127.0.0.1;;127.0.0.1,127.0.0.1;ICMP;Destination unreachable (Port unreachable)
259;;127.0.0.1;;127.0.0.1;DNS;Standard query 0xcf52 A ntp.ubuntu.com
260;;127.0.0.1,127.0.0.1;;127.0.0.1,127.0.0.1;ICMP;Destination unreachable (Port unreachable)
261;;127.0.0.1;;127.0.0.1;DNS;Standard query 0x55cd AAAA ntp.ubuntu.com
262;;127.0.0.1,127.0.0.1;;127.0.0.1,127.0.0.1;ICMP;Destination unreachable (Port unreachable)
263;;127.0.0.1;;127.0.0.1;DNS;Standard query 0x0bbd A ntp.ubuntu.com
264;;127.0.0.1,127.0.0.1;;127.0.0.1,127.0.0.1;ICMP;Destination unreachable (Port unreachable)
265;;127.0.0.1;;127.0.0.1;DNS;Standard query 0x63b0 AAAA ntp.ubuntu.com
266;;127.0.0.1,127.0.0.1;;127.0.0.1,127.0.0.1;ICMP;Destination unreachable (Port unreachable)
267;;127.0.0.1;;127.0.0.1;DNS;Standard query 0x0bbd A ntp.ubuntu.com
268;;127.0.0.1,127.0.0.1;;127.0.0.1,127.0.0.1;ICMP;Destination unreachable (Port unreachable)
269;;127.0.0.1;;127.0.0.1;DNS;Standard query 0x63b0 AAAA ntp.ubuntu.com
270;;127.0.0.1,127.0.0.1;;127.0.0.1,127.0.0.1;ICMP;Destination unreachable (Port unreachable)
271;;127.0.0.1;;127.0.0.1;DNS;Standard query 0xe398 A ntp.ubuntu.com
272;;127.0.0.1,127.0.0.1;;127.0.0.1,127.0.0.1;ICMP;Destination unreachable (Port unreachable)
273;;127.0.0.1;;127.0.0.1;DNS;Standard query 0xd787 AAAA ntp.ubuntu.com
274;;127.0.0.1,127.0.0.1;;127.0.0.1,127.0.0.1;ICMP;Destination unreachable (Port unreachable)
275;;127.0.0.1;;127.0.0.1;DNS;Standard query 0xe398 A ntp.ubuntu.com
276;;127.0.0.1,127.0.0.1;;127.0.0.1,127.0.0.1;ICMP;Destination unreachable (Port unreachable)
277;;127.0.0.1;;127.0.0.1;DNS;Standard query 0xd787 AAAA ntp.ubuntu.com
278;;127.0.0.1,127.0.0.1;;127.0.0.1,127.0.0.1;ICMP;Destination unreachable (Port unreachable)
279;;127.0.0.1;;127.0.0.1;DNS;Standard query 0x51f3 A ntp.ubuntu.com
280;;127.0.0.1,127.0.0.1;;127.0.0.1,127.0.0.1;ICMP;Destination unreachable (Port unreachable)
281;;127.0.0.1;;127.0.0.1;DNS;Standard query 0x1162 AAAA ntp.ubuntu.com
282;;127.0.0.1,127.0.0.1;;127.0.0.1,127.0.0.1;ICMP;Destination unreachable (Port unreachable)
283;;127.0.0.1;;127.0.0.1;DNS;Standard query 0x51f3 A ntp.ubuntu.com
284;;127.0.0.1,127.0.0.1;;127.0.0.1,127.0.0.1;ICMP;Destination unreachable (Port unreachable)
285;;127.0.0.1;;127.0.0.1;DNS;Standard query 0x1162 AAAA ntp.ubuntu.com
286;;127.0.0.1,127.0.0.1;;127.0.0.1,127.0.0.1;ICMP;Destination unreachable (Port unreachable)
287;;127.0.0.1;;127.0.0.1;DNS;Standard query 0x7db6 A ntp.ubuntu.com
288;;127.0.0.1,127.0.0.1;;127.0.0.1,127.0.0.1;ICMP;Destination unreachable (Port unreachable)
289;;127.0.0.1;;127.0.0.1;DNS;Standard query 0xfb10 AAAA ntp.ubuntu.com
290;;127.0.0.1,127.0.0.1;;127.0.0.1,127.0.0.1;ICMP;Destination unreachable (Port unreachable)
291;;127.0.0.1;;127.0.0.1;DNS;Standard query 0x7db6 A ntp.ubuntu.com
292;;127.0.0.1,127.0.0.1;;127.0.0.1,127.0.0.1;ICMP;Destination unreachable (Port unreachable)
293;;127.0.0.1;;127.0.0.1;DNS;Standard query 0xfb10 AAAA ntp.ubuntu.com
294;;127.0.0.1,127.0.0.1;;127.0.0.1,127.0.0.1;ICMP;Destination unreachable (Port unreachable)
295;;127.0.0.1;;127.0.0.1;DNS;Standard query 0xc7f3 A ntp.ubuntu.com
296;;127.0.0.1,127.0.0.1;;127.0.0.1,127.0.0.1;ICMP;Destination unreachable (Port unreachable)
297;;127.0.0.1;;127.0.0.1;DNS;Standard query 0xd3d9 AAAA ntp.ubuntu.com
298;;127.0.0.1,127.0.0.1;;127.0.0.1,127.0.0.1;ICMP;Destination unreachable (Port unreachable)
299;;127.0.0.1;;127.0.0.1;DNS;Standard query 0xc7f3 A ntp.ubuntu.com
300;;127.0.0.1,127.0.0.1;;127.0.0.1,127.0.0.1;ICMP;Destination unreachable (Port unreachable)
301;;127.0.0.1;;127.0.0.1;DNS;Standard query 0xd3d9 AAAA ntp.ubuntu.com
302;;127.0.0.1,127.0.0.1;;127.0.0.1,127.0.0.1;ICMP;Destination unreachable (Port unreachable)
303;;127.0.0.1;;127.0.0.1;DNS;Standard query 0x1b96 A ntp.ubuntu.com
304;;127.0.0.1,127.0.0.1;;127.0.0.1,127.0.0.1;ICMP;Destination unreachable (Port unreachable)
305;;127.0.0.1;;127.0.0.1;DNS;Standard query 0x4358 AAAA ntp.ubuntu.com
306;;127.0.0.1,127.0.0.1;;127.0.0.1,127.0.0.1;ICMP;Destination unreachable (Port unreachable)
307;;127.0.0.1;;127.0.0.1;DNS;Standard query 0x1b96 A ntp.ubuntu.com
308;;127.0.0.1,127.0.0.1;;127.0.0.1,127.0.0.1;ICMP;Destination unreachable (Port unreachable)
309;;127.0.0.1;;127.0.0.1;DNS;Standard query 0x4358 AAAA ntp.ubuntu.com
310;;127.0.0.1,127.0.0.1;;127.0.0.1,127.0.0.1;ICMP;Destination unreachable (Port unreachable)
311;;127.0.0.1;;127.0.0.1;DNS;Standard query 0xf37d A ntp.ubuntu.com
312;;127.0.0.1,127.0.0.1;;127.0.0.1,127.0.0.1;ICMP;Destination unreachable (Port unreachable)
313;;127.0.0.1;;127.0.0.1;DNS;Standard query 0x93a6 AAAA ntp.ubuntu.com
314;;127.0.0.1,127.0.0.1;;127.0.0.1,127.0.0.1;ICMP;Destination unreachable (Port unreachable)
315;;127.0.0.1;;127.0.0.1;DNS;Standard query 0xf37d A ntp.ubuntu.com
316;;127.0.0.1,127.0.0.1;;127.0.0.1,127.0.0.1;ICMP;Destination unreachable (Port unreachable)
317;;127.0.0.1;;127.0.0.1;DNS;Standard query 0x93a6 AAAA ntp.ubuntu.com
318;;127.0.0.1,127.0.0.1;;127.0.0.1,127.0.0.1;ICMP;Destination unreachable (Port unreachable)
319;;127.0.0.1;;127.0.0.1;TCP;41642 → 7687 [SYN] Seq=0 Win=43690 Len=0 MSS=65495 SACK_PERM=1 TSval=821774 TSecr=0 WS=128
320;;127.0.0.1;;127.0.0.1;TCP;7687 → 41642 [SYN, ACK] Seq=0 Ack=1 Win=43690 Len=0 MSS=65495 SACK_PERM=1 TSval=821774 TSecr=821774 WS=128
321;;127.0.0.1;;127.0.0.1;TCP;41642 → 7687 [ACK] Seq=1 Ack=1 Win=43776 Len=0 TSval=821774 TSecr=821774
322;;127.0.0.1;;127.0.0.1;TCP;41642 → 7687 [PSH, ACK] Seq=1 Ack=1 Win=43776 Len=517 TSval=821774 TSecr=821774
323;;127.0.0.1;;127.0.0.1;TCP;7687 → 41642 [ACK] Seq=1 Ack=518 Win=44800 Len=0 TSval=821774 TSecr=821774
324;;127.0.0.1;;127.0.0.1;TCP;7687 → 41642 [PSH, ACK] Seq=1 Ack=518 Win=44800 Len=1120 TSval=821776 TSecr=821774
325;;127.0.0.1;;127.0.0.1;TCP;41642 → 7687 [ACK] Seq=518 Ack=1121 Win=45952 Len=0 TSval=821776 TSecr=821776
326;;127.0.0.1;;127.0.0.1;TCP;41642 → 7687 [PSH, ACK] Seq=518 Ack=1121 Win=45952 Len=126 TSval=821776 TSecr=821776
327;;127.0.0.1;;127.0.0.1;TCP;7687 → 41642 [PSH, ACK] Seq=1121 Ack=644 Win=44800 Len=51 TSval=821777 TSecr=821776
328;;127.0.0.1;;127.0.0.1;TCP;41642 → 7687 [PSH, ACK] Seq=644 Ack=1172 Win=45952 Len=49 TSval=821777 TSecr=821777
329;;127.0.0.1;;127.0.0.1;TCP;7687 → 41642 [PSH, ACK] Seq=1172 Ack=693 Win=44800 Len=33 TSval=821777 TSecr=821777
330;;127.0.0.1;;127.0.0.1;TCP;41642 → 7687 [PSH, ACK] Seq=693 Ack=1205 Win=45952 Len=108 TSval=821777 TSecr=821777
331;;127.0.0.1;;127.0.0.1;TCP;7687 → 41642 [PSH, ACK] Seq=1205 Ack=801 Win=44800 Len=55 TSval=821777 TSecr=821777
332;;127.0.0.1;;127.0.0.1;TCP;41642 → 7687 [PSH, ACK] Seq=801 Ack=1260 Win=45952 Len=287 TSval=821778 TSecr=821777
333;;127.0.0.1;;127.0.0.1;TCP;45722 → 8080 [SYN] Seq=0 Win=43690 Len=0 MSS=65495 SACK_PERM=1 TSval=821781 TSecr=0 WS=128
334;;127.0.0.1;;127.0.0.1;TCP;8080 → 45722 [SYN, ACK] Seq=0 Ack=1 Win=43690 Len=0 MSS=65495 SACK_PERM=1 TSval=821781 TSecr=821781 WS=128
335;;127.0.0.1;;127.0.0.1;TCP;45722 → 8080 [ACK] Seq=1 Ack=1 Win=43776 Len=0 TSval=821781 TSecr=821781
336;;127.0.0.1;;127.0.0.1;HTTP;GET /capture_00004_20170304180131.csv HTTP/1.1 
337;;127.0.0.1;;127.0.0.1;TCP;8080 → 45722 [ACK] Seq=1 Ack=198 Win=44800 Len=0 TSval=821781 TSecr=821781
338;;127.0.0.1;;127.0.0.1;TCP;[TCP segment of a reassembled PDU]
339;;127.0.0.1;;127.0.0.1;TCP;45722 → 8080 [ACK] Seq=198 Ack=18 Win=43776 Len=0 TSval=821781 TSecr=821781
340;;127.0.0.1;;127.0.0.1;TCP;[TCP segment of a reassembled PDU]
341;;127.0.0.1;;127.0.0.1;TCP;45722 → 8080 [ACK] Seq=198 Ack=56 Win=43776 Len=0 TSval=821781 TSecr=821781
342;;127.0.0.1;;127.0.0.1;TCP;[TCP segment of a reassembled PDU]
343;;127.0.0.1;;127.0.0.1;TCP;45722 → 8080 [ACK] Seq=198 Ack=93 Win=43776 Len=0 TSval=821781 TSecr=821781
344;;127.0.0.1;;127.0.0.1;TCP;[TCP segment of a reassembled PDU]
345;;127.0.0.1;;127.0.0.1;TCP;45722 → 8080 [ACK] Seq=198 Ack=117 Win=43776 Len=0 TSval=821781 TSecr=821781
346;;127.0.0.1;;127.0.0.1;TCP;[TCP segment of a reassembled PDU]
347;;127.0.0.1;;127.0.0.1;TCP;45722 → 8080 [ACK] Seq=198 Ack=140 Win=43776 Len=0 TSval=821781 TSecr=821781
348;;127.0.0.1;;127.0.0.1;TCP;[TCP segment of a reassembled PDU]
349;;127.0.0.1;;127.0.0.1;TCP;45722 → 8080 [ACK] Seq=198 Ack=186 Win=43776 Len=0 TSval=821781 TSecr=821781
350;;127.0.0.1;;127.0.0.1;TCP;[TCP segment of a reassembled PDU]
351;;127.0.0.1;;127.0.0.1;TCP;45722 → 8080 [ACK] Seq=198 Ack=188 Win=43776 Len=0 TSval=821781 TSecr=821781
352;;127.0.0.1;;127.0.0.1;TCP;[TCP segment of a reassembled PDU]
353;;127.0.0.1;;127.0.0.1;TCP;45722 → 8080 [ACK] Seq=198 Ack=8380 Win=174720 Len=0 TSval=821781 TSecr=821781
354;;127.0.0.1;;127.0.0.1;TCP;[TCP segment of a reassembled PDU]
355;;127.0.0.1;;127.0.0.1;TCP;45722 → 8080 [ACK] Seq=198 Ack=16572 Win=305664 Len=0 TSval=821781 TSecr=821781
356;;127.0.0.1;;127.0.0.1;TCP;[TCP segment of a reassembled PDU]
357;;127.0.0.1;;127.0.0.1;TCP;45722 → 8080 [ACK] Seq=198 Ack=24764 Win=436608 Len=0 TSval=821781 TSecr=821781
358;;127.0.0.1;;127.0.0.1;HTTP;HTTP/1.0 200 OK  (text/csv)
359;;127.0.0.1;;127.0.0.1;TCP;45722 → 8080 [ACK] Seq=198 Ack=28047 Win=465536 Len=0 TSval=821781 TSecr=821781
360;;127.0.0.1;;127.0.0.1;TCP;8080 → 45722 [FIN, ACK] Seq=28047 Ack=198 Win=44800 Len=0 TSval=821781 TSecr=821781
361;;127.0.0.1;;127.0.0.1;TCP;45722 → 8080 [FIN, ACK] Seq=198 Ack=28048 Win=465536 Len=0 TSval=821781 TSecr=821781
362;;127.0.0.1;;127.0.0.1;TCP;8080 → 45722 [ACK] Seq=28048 Ack=199 Win=44800 Len=0 TSval=821781 TSecr=821781
363;;127.0.0.1;;127.0.0.1;TCP;7687 → 41642 [ACK] Seq=1260 Ack=1088 Win=45952 Len=0 TSval=821788 TSecr=821778
364;;127.0.0.1;;127.0.0.1;TCP;41642 → 7687 [PSH, ACK] Seq=1088 Ack=1260 Win=45952 Len=1963 TSval=821788 TSecr=821788
365;;127.0.0.1;;127.0.0.1;TCP;7687 → 41642 [ACK] Seq=1260 Ack=3051 Win=176896 Len=0 TSval=821788 TSecr=821788
366;;127.0.0.1;;127.0.0.1;TCP;45724 → 8080 [SYN] Seq=0 Win=43690 Len=0 MSS=65495 SACK_PERM=1 TSval=821810 TSecr=0 WS=128
367;;127.0.0.1;;127.0.0.1;TCP;8080 → 45724 [SYN, ACK] Seq=0 Ack=1 Win=43690 Len=0 MSS=65495 SACK_PERM=1 TSval=821810 TSecr=821810 WS=128
368;;127.0.0.1;;127.0.0.1;TCP;45724 → 8080 [ACK] Seq=1 Ack=1 Win=43776 Len=0 TSval=821810 TSecr=821810
369;;127.0.0.1;;127.0.0.1;HTTP;GET /capture_00004_20170304180131.csv HTTP/1.1 
370;;127.0.0.1;;127.0.0.1;TCP;8080 → 45724 [ACK] Seq=1 Ack=198 Win=44800 Len=0 TSval=821810 TSecr=821810
371;;127.0.0.1;;127.0.0.1;TCP;[TCP segment of a reassembled PDU]
372;;127.0.0.1;;127.0.0.1;TCP;45724 → 8080 [ACK] Seq=198 Ack=18 Win=43776 Len=0 TSval=821810 TSecr=821810
373;;127.0.0.1;;127.0.0.1;TCP;[TCP segment of a reassembled PDU]
374;;127.0.0.1;;127.0.0.1;TCP;45724 → 8080 [ACK] Seq=198 Ack=56 Win=43776 Len=0 TSval=821810 TSecr=821810
375;;127.0.0.1;;127.0.0.1;TCP;[TCP segment of a reassembled PDU]
376;;127.0.0.1;;127.0.0.1;TCP;45724 → 8080 [ACK] Seq=198 Ack=93 Win=43776 Len=0 TSval=821810 TSecr=821810
377;;127.0.0.1;;127.0.0.1;TCP;[TCP segment of a reassembled PDU]
378;;127.0.0.1;;127.0.0.1;TCP;45724 → 8080 [ACK] Seq=198 Ack=117 Win=43776 Len=0 TSval=821810 TSecr=821810
379;;127.0.0.1;;127.0.0.1;TCP;[TCP segment of a reassembled PDU]
380;;127.0.0.1;;127.0.0.1;TCP;45724 → 8080 [ACK] Seq=198 Ack=140 Win=43776 Len=0 TSval=821810 TSecr=821810
381;;127.0.0.1;;127.0.0.1;TCP;[TCP segment of a reassembled PDU]
382;;127.0.0.1;;127.0.0.1;TCP;45724 → 8080 [ACK] Seq=198 Ack=186 Win=43776 Len=0 TSval=821810 TSecr=821810
383;;127.0.0.1;;127.0.0.1;TCP;[TCP segment of a reassembled PDU]
384;;127.0.0.1;;127.0.0.1;TCP;45724 → 8080 [ACK] Seq=198 Ack=188 Win=43776 Len=0 TSval=821810 TSecr=821810
385;;127.0.0.1;;127.0.0.1;TCP;[TCP segment of a reassembled PDU]
386;;127.0.0.1;;127.0.0.1;TCP;45724 → 8080 [ACK] Seq=198 Ack=8380 Win=174720 Len=0 TSval=821810 TSecr=821810
387;;127.0.0.1;;127.0.0.1;TCP;[TCP segment of a reassembled PDU]
388;;127.0.0.1;;127.0.0.1;TCP;45724 → 8080 [ACK] Seq=198 Ack=16572 Win=305664 Len=0 TSval=821810 TSecr=821810
389;;127.0.0.1;;127.0.0.1;TCP;[TCP segment of a reassembled PDU]
390;;127.0.0.1;;127.0.0.1;TCP;45724 → 8080 [ACK] Seq=198 Ack=24764 Win=436608 Len=0 TSval=821810 TSecr=821810
391;;127.0.0.1;;127.0.0.1;HTTP;HTTP/1.0 200 OK  (text/csv)
392;;127.0.0.1;;127.0.0.1;TCP;45724 → 8080 [ACK] Seq=198 Ack=28047 Win=465536 Len=0 TSval=821810 TSecr=821810
393;;127.0.0.1;;127.0.0.1;TCP;8080 → 45724 [FIN, ACK] Seq=28047 Ack=198 Win=44800 Len=0 TSval=821810 TSecr=821810
394;;127.0.0.1;;127.0.0.1;TCP;45724 → 8080 [FIN, ACK] Seq=198 Ack=28048 Win=465536 Len=0 TSval=821810 TSecr=821810
395;;127.0.0.1;;127.0.0.1;TCP;8080 → 45724 [ACK] Seq=28048 Ack=199 Win=44800 Len=0 TSval=821810 TSecr=821810
396;;127.0.0.1;;127.0.0.1;TCP;45726 → 8080 [SYN] Seq=0 Win=43690 Len=0 MSS=65495 SACK_PERM=1 TSval=821846 TSecr=0 WS=128
397;;127.0.0.1;;127.0.0.1;TCP;8080 → 45726 [SYN, ACK] Seq=0 Ack=1 Win=43690 Len=0 MSS=65495 SACK_PERM=1 TSval=821846 TSecr=821846 WS=128
398;;127.0.0.1;;127.0.0.1;TCP;45726 → 8080 [ACK] Seq=1 Ack=1 Win=43776 Len=0 TSval=821846 TSecr=821846
399;;127.0.0.1;;127.0.0.1;HTTP;GET /capture_00004_20170304180131.csv HTTP/1.1 
400;;127.0.0.1;;127.0.0.1;TCP;8080 → 45726 [ACK] Seq=1 Ack=198 Win=44800 Len=0 TSval=821846 TSecr=821846
401;;127.0.0.1;;127.0.0.1;TCP;[TCP segment of a reassembled PDU]
402;;127.0.0.1;;127.0.0.1;TCP;45726 → 8080 [ACK] Seq=198 Ack=18 Win=43776 Len=0 TSval=821846 TSecr=821846
403;;127.0.0.1;;127.0.0.1;TCP;[TCP segment of a reassembled PDU]
404;;127.0.0.1;;127.0.0.1;TCP;45726 → 8080 [ACK] Seq=198 Ack=56 Win=43776 Len=0 TSval=821846 TSecr=821846
405;;127.0.0.1;;127.0.0.1;TCP;[TCP segment of a reassembled PDU]
406;;127.0.0.1;;127.0.0.1;TCP;45726 → 8080 [ACK] Seq=198 Ack=93 Win=43776 Len=0 TSval=821846 TSecr=821846
407;;127.0.0.1;;127.0.0.1;TCP;[TCP segment of a reassembled PDU]
408;;127.0.0.1;;127.0.0.1;TCP;45726 → 8080 [ACK] Seq=198 Ack=117 Win=43776 Len=0 TSval=821846 TSecr=821846
409;;127.0.0.1;;127.0.0.1;TCP;[TCP segment of a reassembled PDU]
410;;127.0.0.1;;127.0.0.1;TCP;45726 → 8080 [ACK] Seq=198 Ack=140 Win=43776 Len=0 TSval=821846 TSecr=821846
411;;127.0.0.1;;127.0.0.1;TCP;[TCP segment of a reassembled PDU]
412;;127.0.0.1;;127.0.0.1;TCP;45726 → 8080 [ACK] Seq=198 Ack=186 Win=43776 Len=0 TSval=821846 TSecr=821846
413;;127.0.0.1;;127.0.0.1;TCP;[TCP segment of a reassembled PDU]
414;;127.0.0.1;;127.0.0.1;TCP;45726 → 8080 [ACK] Seq=198 Ack=188 Win=43776 Len=0 TSval=821846 TSecr=821846
415;;127.0.0.1;;127.0.0.1;TCP;[TCP segment of a reassembled PDU]
416;;127.0.0.1;;127.0.0.1;TCP;45726 → 8080 [ACK] Seq=198 Ack=8380 Win=174720 Len=0 TSval=821846 TSecr=821846
417;;127.0.0.1;;127.0.0.1;TCP;[TCP segment of a reassembled PDU]
418;;127.0.0.1;;127.0.0.1;TCP;45726 → 8080 [ACK] Seq=198 Ack=16572 Win=305664 Len=0 TSval=821846 TSecr=821846
419;;127.0.0.1;;127.0.0.1;TCP;[TCP segment of a reassembled PDU]
420;;127.0.0.1;;127.0.0.1;TCP;45726 → 8080 [ACK] Seq=198 Ack=24764 Win=436608 Len=0 TSval=821846 TSecr=821846
421;;127.0.0.1;;127.0.0.1;HTTP;HTTP/1.0 200 OK  (text/csv)
422;;127.0.0.1;;127.0.0.1;TCP;45726 → 8080 [ACK] Seq=198 Ack=28047 Win=465536 Len=0 TSval=821846 TSecr=821846
423;;127.0.0.1;;127.0.0.1;TCP;8080 → 45726 [FIN, ACK] Seq=28047 Ack=198 Win=44800 Len=0 TSval=821846 TSecr=821846
424;;127.0.0.1;;127.0.0.1;TCP;45726 → 8080 [FIN, ACK] Seq=198 Ack=28048 Win=465536 Len=0 TSval=821847 TSecr=821846
425;;127.0.0.1;;127.0.0.1;TCP;8080 → 45726 [ACK] Seq=28048 Ack=199 Win=44800 Len=0 TSval=821847 TSecr=821847
426;;127.0.0.1;;127.0.0.1;TCP;45728 → 8080 [SYN] Seq=0 Win=43690 Len=0 MSS=65495 SACK_PERM=1 TSval=821875 TSecr=0 WS=128
427;;127.0.0.1;;127.0.0.1;TCP;8080 → 45728 [SYN, ACK] Seq=0 Ack=1 Win=43690 Len=0 MSS=65495 SACK_PERM=1 TSval=821875 TSecr=821875 WS=128
428;;127.0.0.1;;127.0.0.1;TCP;45728 → 8080 [ACK] Seq=1 Ack=1 Win=43776 Len=0 TSval=821875 TSecr=821875
429;;127.0.0.1;;127.0.0.1;HTTP;GET /capture_00004_20170304180131.csv HTTP/1.1 
430;;127.0.0.1;;127.0.0.1;TCP;8080 → 45728 [ACK] Seq=1 Ack=198 Win=44800 Len=0 TSval=821875 TSecr=821875
431;;127.0.0.1;;127.0.0.1;TCP;[TCP segment of a reassembled PDU]
432;;127.0.0.1;;127.0.0.1;TCP;45728 → 8080 [ACK] Seq=198 Ack=18 Win=43776 Len=0 TSval=821875 TSecr=821875
433;;127.0.0.1;;127.0.0.1;TCP;[TCP segment of a reassembled PDU]
434;;127.0.0.1;;127.0.0.1;TCP;45728 → 8080 [ACK] Seq=198 Ack=56 Win=43776 Len=0 TSval=821875 TSecr=821875
435;;127.0.0.1;;127.0.0.1;TCP;[TCP segment of a reassembled PDU]
436;;127.0.0.1;;127.0.0.1;TCP;45728 → 8080 [ACK] Seq=198 Ack=93 Win=43776 Len=0 TSval=821875 TSecr=821875
437;;127.0.0.1;;127.0.0.1;TCP;[TCP segment of a reassembled PDU]
438;;127.0.0.1;;127.0.0.1;TCP;45728 → 8080 [ACK] Seq=198 Ack=117 Win=43776 Len=0 TSval=821875 TSecr=821875
439;;127.0.0.1;;127.0.0.1;TCP;[TCP segment of a reassembled PDU]
440;;127.0.0.1;;127.0.0.1;TCP;45728 → 8080 [ACK] Seq=198 Ack=140 Win=43776 Len=0 TSval=821875 TSecr=821875
441;;127.0.0.1;;127.0.0.1;TCP;[TCP segment of a reassembled PDU]
442;;127.0.0.1;;127.0.0.1;TCP;45728 → 8080 [ACK] Seq=198 Ack=186 Win=43776 Len=0 TSval=821875 TSecr=821875
443;;127.0.0.1;;127.0.0.1;TCP;[TCP segment of a reassembled PDU]
444;;127.0.0.1;;127.0.0.1;TCP;45728 → 8080 [ACK] Seq=198 Ack=188 Win=43776 Len=0 TSval=821875 TSecr=821875
445;;127.0.0.1;;127.0.0.1;TCP;[TCP segment of a reassembled PDU]
446;;127.0.0.1;;127.0.0.1;TCP;45728 → 8080 [ACK] Seq=198 Ack=8380 Win=174720 Len=0 TSval=821875 TSecr=821875
447;;127.0.0.1;;127.0.0.1;TCP;[TCP segment of a reassembled PDU]
